lemma	pos	date	grouping	identifier	description	context	indexes_target_token	indexes_target_sentence
lane_nn	nn1	1975	2	fic_1975_10601.txt-1150-9	 	The chicken coop was below her, across the lane from the barn, and suddenly, at a certain stage of darkness, chickens, white blurs, would appear from the brush, from the wheat field, from the pasture on the other side of the road, and begin moving toward the coop as though drawn to a magnet, some of them running, catching up to others and frightening them into a run, some moving slowerp200through the darkness, alone.	43:47	0:420
lane_nn	nn2	1998	2	fic_1998_27532.txt-18-9	 	driven off the freeway by a careless teenager changing lanes, the thing that had been scheduled to kill Parsifal had been denied, and Sabine lost the years she was promised he still had.	55:60	0:186
lane_nn	nnl1	1850	1	fic_1850_7171.txt-150-13	 	There are rum-shops hereabouts, and there is the foot of Knuckle Lane, \" said a young man.	67:71	0:94
lane_nn	nnl1	1849	1	fic_1849_2605.txt-945-13	 	The captain was esteemed one of the kindest and best-natured neighbors in Willow Lane, where my father lived; and Julian, the captain's eldest son, very near my own age, was, among all the boys at school, my favorite play-fellow.	81:85	0:229
lane_nn	nn1	1835	1	fic_1835_7134.txt-2170-14	 	Descending the hill, we passed through a gate, opening into a narrow lane, bordered on either side with thick clumps of trees, and the luxuriant wild shrubbery which grows by the streams and along the roads throughout the south; and after winding through ravines and	69:73	0:266
lane_nn	nn1	2009	2	fic_2009_36764.txt-202-8	 	The four of them turned north on the lane that passed their cabin.	37:41	0:66
lane_nn	nnl1	1985	2	news_1985_669993.txt-0-15	 	@@669993 Behind a lectern in a Washington, D.C., courtroom this week stood Mark Lane, lawyer to controversial causes of right and left, making his opening statement.	80:84	0:165
lane_nn	nn1	1827	1	fic_1827_9757.txt-3901-7	 	Any garret or cellar in the dirtiest lane or darkest alley, will be good enough for me.	37:41	0:87
lane_nn	nnl1	1961	2	news_1961_722035.txt-2-0	 	Lane, the chief attorney, angrily denounced another district attorney and said he had removed that attorney from his job.	0:4	0:121
lane_nn	nn1	1849	1	fic_1849_583.txt-456-9	 	After turning from the main road up a narrow lane, so thickly shaded with forest-trees as to give it a complete air of seclusion, we came in sight of the cottage.	45:49	0:162
lane_nn	nn1	1860	1	fic_1860_9188.txt-5205-18	 	, I have a race with a deer or stag, which, caught browsing in the green lane, and seeing me coming, darts off like an arrow, a challenge which \" Buccleugh, \" the name of my handsome brown horse, (though called \" Buck \" for short,) never refuses to accept, nor his mistress either; but we are always beaten, of course, for the stag seems fairly to fly, and soon loses himself to sight in the shady recesses of his native woodland!	73:77	0:430
lane_nn	nn1	1853	1	fic_1853_2454.txt-325-10	 	At this moment the sleigh was seen coming up the lane, and Mrs. Wharton hastened to get ready to accompany the doctor to the Hemlocks. \"	49:53	0:136
lane_nn	nn1	1853	1	fic_1853_9805.txt-173-0	 	Lane Seminary was the pride and hope of the church.	0:4	0:51
lane_nn	nnl1	1854	1	fic_1854_9230.txt-132-29	 	But, as we were saying, -- Schools were not so common at that time as now, and as there was none nearer the Trotters than Huckleberry Lane, in the Upper Parish, and as there was a quarrel between the Upper and the Lower parishes, old Trotter, who belonged with the Lower, felt bound to stand by that section, -- though he knew nothing about the quarrel, -- and	134:138	0:360
lane_nn	nn1	2005	2	mag_2005_419504.txt-124-4	 	Furthermore, the fast lane is not reserved for the more affluent, and the ability of an American vehicle to accelerate quickly does not reflect the driver's economic status.	22:26	0:173
lane_nn	nnl1	1816	1	mag_1816_552728.txt-70-26	 	A mile below, is Bridgwater and the ruins of some large mills, which were destroyed by the Americans after the battle of Lundy's Lane.	129:133	0:134
lane_nn	nnl1	1980	2	news_1980_734630.txt-11-14	 	Even the set has been painted red and gold to blend with the Drury Lane decor.	67:71	0:78
lane_nn	nn1	1983	2	news_1983_668568.txt-1-25	 	Don ' t pay any attention to what ' s going on in that lane, \" he said, referring to Lazzaretti ' s lane, No.	100:104	0:109
lane_nn	nn1	1838	1	fic_1838_7145.txt-243-15	 	On they went, quickening still their pace, and, as they passed the lane, the troop appointed to the duty wheeled off, steadily, but without slackening	67:71	0:150
lane_nn	nn1	1859	1	mag_1859_591226.txt-285-18	 	He said No, and produced another paper, purporting to be a cominission, also signed by Lane.	87:91	0:92
lane_nn	nn1	2009	2	fic_2009_36636.txt-5-8	 	Carters jostle peddlers, and servants swarm the lane between shop windows and the row of posts protecting them from the street.	48:52	0:127
lane_nn	nn1	2004	2	mag_2004_412315.txt-14-20	 	We emphasized that play in practice all week, \" Dixon says as senior forward Jaron Brown cuts through the lane for a layup after receiving a pass from Taft on the left wing.	106:110	0:173
lane_nn	nnl1	1849	1	fic_1849_583.txt-3355-13	 	There were several beaux of their brother's acquaintance from Gray's Inn Lane and Hatton Garden,	73:77	0:96
lane_nn	nn2	1994	2	fic_1994_41277.txt-19-8	 	There in its vast ship outside the trade lanes of the First Worlds it had kept its engines still -- communicating with no one -- and so they had left it alone.	41:46	0:159
lane_nn	nn1	2006	2	fic_2006_26531.txt-7-12	 	Bent Funeral Directors (cremations or burials) on Old Oak Common Lane, the dismal congeries of shops at the turbulent intersection where Western Avenue becomes Western Way as cars and lorries tear towards the	65:69	0:208
lane_nn	nnl1	1973	2	fic_1973_10570.txt-5301-23	 	The room was a good indicator of the size and feel of the whole house, a massive bargelike structure moored at Muscat Lane.	118:122	0:123
lane_nn	nn1	1849	1	fic_1849_7218.txt-2815-6	 	As I daily passed through this lane of beggars, who thronged the docks as the Hebrew cripples did the Pool of Bethesda, and as I thought of my utter inability in any way to help them, I could not but offer up a prayer, that some angel might descend, and turn the waters of the docks into an elixir, that would heal all their woes, and make them, man and woman, healthy and whole as their ancestors, Adam and Eve, in the garden.	31:35	0:427
lane_nn	nnl1	1855	1	fic_1855_2730.txt-1391-6	 	Come to my calling, Lilly Lane, Like music falling, Come again.	26:30	0:63
lane_nn	nn2	1966	2	fic_1966_23838.txt-294-51	 	Overhead the bare branches of the trees were distorted and a little wild against the starry sky: a landscape of Ed-yard Munch, Ann Arbor was Moscow, Petersburg, A Story by MacDonald Harris 65 Stockholm, a city of white nights and frozen abstract demons; the campus lanes were the Nevsky Prospekt.	265:270	0:296
lane_nn	nn2	1975	2	nf_1975_774042.txt-2710-26	 	Wilkes, however, was a determined man, and by the end of December he was again heading south, his destination the little-known sea lanes south of Australia, an area which D'Urville was also about to enter.	131:136	0:205
lane_nn	nnl1	2005	2	fic_2005_32601.txt-110-26	 	But then the pleasure of the dream was stymied by the same frustration he'd felt that day at the crowded corner of Broadway and Maiden Lane.	135:139	0:140
lane_nn	nnl1	1846	1	nf_1846_748061.txt-558-12	 	In the same year, 1820, he was engaged at Drury Lane, and on the fifteenth of August appeared as Richmond to Kean's Richard, it being among the last performances of the latter actor, previous to his departure for America.	48:52	0:221
lane_nn	nn1	1848	1	fic_1848_7193.txt-9529-5	 	Toward the west, the lane descending, a hill was lost in the mazes of the woods.	21:25	0:80
lane_nn	nn1	2000	2	mag_2000_413712.txt-35-46	 	Also vocal are residents of western Massachusetts, who have seen their transit projects wither as $8.5 billion of state money was committed to the Dig, now a clanging construction site that runs the length of central Boston, 7.8 miles of infrastructure and 161 lane miles.	261:265	0:272
lane_nn	nn2	1847	1	fic_1847_7190.txt-1403-45	 	Back, over the mangled forms and shattered instruments of their own musicians, he hurled the formidable lancers, back, over the faces of their slaughtered infantry, back, with that iron shower tearing their pennons, splintering their spears, cutting lanes into their woven ranks, he hurled the chivalry of Mexico, until the shadows of the chaparral alone, saved the wreck of their glittering array.	250:255	0:398
lane_nn	nn2	1836	1	mag_1836_554391.txt-337-10	 	Who taught him to thread his way through the barberry-bush lanes, and across the beaver-meadows, to find out the true centre of population for their sun-burnt and flaxen-headed little tenantry?	59:64	0:193
lane_nn	nnl1	1993	2	news_1993_630378.txt-58-21	 	billion net) and the Fed got stuck owning the crap, but was legally only making a loan to Maiden Lane, who was the legal owner (Maiden Lane was incorporated not in NYC, but in Delaware to avoid paying taxes).	97:101	0:208
lane_nn	nnl1	1977	2	mag_1977_287957.txt-10-17	 	As befitted a new gentleman, he applied for a coat of arms in 1612; Carter Lane, off Fleet Street, still bears his name.	75:79	0:120
lane_nn	nnl1	1845	1	mag_1845_522622.txt-76-24	 	A great variety of forms of address might be used on different occasions, such as the following William Smith Jones, 516 Mark Lane, London.	126:130	0:139
lane_nn	nn2	1844	1	mag_1844_587318.txt-562-14	 	Haudreds of them toilsomely lived, and obscurely perished, in the same dark lanes and alleys where they first saw the light; and these two alone of them all, children of fortune, favorites of blind accident, are raised aloft as symbols of a destiny which all might have reached!	76:81	0:278
lane_nn	nn2	2007	2	fic_2007_52082.txt-602-20	 	The head swayed, dead eyes gleaming as the villagers carried their trophy through the gate and onto the narrow lanes that wound toward the dome in the center of the village.	111:116	0:173
lane_nn	nnl1	1846	1	nf_1846_748061.txt-38-49	 	This amusing request, as arrogant as it was ridiculous, serves to exhibit the questionable position which the great tragedian occupied in the estimation of the Covent Garden company, and will remind the reader of the advice given by a certain little actor of the /z/ Drury Lane stock, who on several occasions recommended Mr. Kean, previous to his appearance, not to loiter upon the bench in the hall, as was the custom, but to attend the front of the house, and profit by the good acting he there might have an opportunity to behold.	273:277	0:534
lane_nn	nn1	1852	1	nf_1852_771569.txt-1053-5	 	As we rattled along the lane of blue water which wound gracefully ahead to the westward, the shores of Cornwallis Island rapidly revealed themselves, and offered little that was striking or picturesque.	24:28	0:202
lane_nn	nn2	1843	1	nf_1843_747536.txt-2573-52	 	A City at present is a heterogeneous mass of small and separate houses of all sizes, shapes, colors, styles and materials, which are crowded together without regard to architectural unity or design, convenience or elegance; it is cut up with irregular and narrow streets, dark lanes, confined courts, and cramped yards and alleys; it has its dirty and muddy streets, that annoy the inhabitants; its filthy gutters that fill the atmosphere with noxious exhalations which are injurious to health, and presents a scene of confusion, incoherence, waste and disorder.	277:282	0:562
lane_nn	nn1	2002	2	news_2002_622956.txt-69-20	 	Penney stores and continued on a merchandising and management path that included Mervyn's, Sears Roebuck &; Co., Lane Bryant, Factory 2-U and Levi Strauss.	113:117	0:155
lane_nn	nn1	2008	2	nf_2008_774727.txt-14-20	 	Then, as the lane creeps to a slow halt, you notice with rising indignation that cars in the lane you have vacated are continuing to speed ahead, out of sight.	93:97	0:159
lane_nn	nn1	1973	2	fic_1973_10568.txt-3485-14	 	Soon the roadsides were lined solid with empty cars, and then the left lane was closed completely by an eight-car smash-up.	71:75	0:123
lane_nn	nn1	1851	1	nf_1851_771607.txt-830-32	 	I presume it will be decreed that no more than Forty, Fifty or at most Sixty Thousand single admissions shall be sold in one day, and that each apartment, lane or avenue in the building shall be entered from one prescribed end only and vacated from the other.	155:159	0:259
lane_nn	nnl1	2001	2	news_2001_661930.txt-66-19	 	Jeff Hawkins and Engineer Tony Brownell back their engines into the driveway of a mobile home off Tim Tam Lane, a gravel road traversing the ridge north of Miller Peak.	106:110	0:168
lane_nn	nn1	1853	1	fic_1853_2454.txt-1153-54	 	It was soon observed, that as the young clergyman rode from the Hemlocks back to the village, it seemed a difficult matter for him to pass Mr. Wharton's lane, but he often, and then oftener, and at length every day, turned his horse's head up the lane, and stopped to make a call.	247:251	0:280
lane_nn	nn1	1839	1	fic_1839_7088.txt-2105-7	 	The path she took was a green lane, famous for lover's rambles, that led towards the East River.	30:34	0:96
lane_nn	nnl1	2006	2	fic_2006_26773.txt-89-2	 	Ninety-nine Maple Lane was the only place she'd ever lived.	18:22	0:59
lane_nn	nnl1	2000	2	fic_2000_52612.txt-0-8	 	@@14612 ON THE TOP OF MY great-great-grandfather John Lane's limestone grave-marker, erected in eastern North Carolina in 1868, is a set of carved hands grasped in friendship.	54:58	0:175
lane_nn	nn1	1849	1	fic_1849_583.txt-2611-5	 	At the end of a lane there was an old sober-looking servant in livery waiting for them; he was accompanied by a superannuated pointer and by the redoubtable Bantam, a little old rat of a pony with a shaggy mane and long rusty tail, who stood dozing quietly by the roadside, little dreaming of the bustling times that awaited him.	16:20	0:329
lane_nn	nn1	1967	2	fic_1967_10489.txt-4044-23	 	The transistor talked to itself down in the grass to our left, and I heard Julie say something to Debby in the lane, but I paid no more attention than Peck did.	111:115	0:160
lane_nn	nn1	1966	2	fic_1966_10477.txt-6455-19	 	He got the rest of the way across the piazza without being seen and up into a dark narrow lane, and from this lane off into a series of lanes that kept him away from the Corso and the piazza but movingdeeper into the city where the workingmen lived.	90:94	0:249
lane_nn	nn1	1835	1	fic_1835_7133.txt-1751-9	 	and turning the corner of a narrow, fenced lane which extended from the river to the forest-covered marshes -- \" there it is, gentlemen, \" -- and at the same time extended his arm in the direction of the peaceful plain, which we had before observed, -- spread out like a carpet, it was so very level -- till it terminated in the distant forests, by which and the river it was nearly enclosed.	43:47	0:392
lane_nn	nn1	1835	1	fic_1835_7064.txt-3003-4	 	Pausing in a narrow lane, he held up the scroll.	20:24	0:48
lane_nn	nn2	1847	1	fic_1847_7190.txt-1076-33	 	Still, with that sternly compressed lip and eagle eye, he watched the effect of each discharge, nor hesitated, when he saw glimpses of the clear sky, through the lanes which he made in the Mexican ranks.	162:167	0:203
lane_nn	nnl1	1829	1	nf_1829_747740.txt-1710-25	 	I beg most kind remembrance to her, and ever am, \" My very dear friend, most cordially yours, /z/ \" Grove Lane, Sept. 25th, 182$. \"	106:110	0:131
lane_nn	nn1	1839	1	fic_1839_7001.txt-2701-11	 	Go, look from the window, Janette, down the lane to the woods.	44:48	0:62
lane_nn	nn1	1834	1	nf_1834_747481.txt-601-16	 	The moment a boat's crew get ashore, a half a dozen of these Hog lane men surround them, entice them into their shops, and, with the aid of spirituous liquors, seldom fail of obtaining all their cash. \"	65:69	0:202
lane_nn	nn2	1832	1	fic_1832_7054.txt-348-37	 	And the wild flamens of Cybele, stained By the red vintage, and the countless crowd Of magi, augurs, senators and slaves, Paphians and vestals, through the marble streets, From dusky lanes and sculptured palaces, Temple and forum and Cimmerian den, Outpoured in pageantry or squalid want, Like Scylla's whirlpool floods, to feast on death. '	183:188	0:341
lane_nn	nn1	1839	1	fic_1839_7088.txt-1960-61	 	When Robert Lester, now Kyd the pirate, left the presence of Kate Bellamont, without seeking the stone steps that descended to the lawn, he leaped from the low balcony to the ground, and strode, at a pace made quick and firm by the strength of his feelings, towards a gate that opened into the lane in which the inn of Jost Stoll was situated.	294:298	0:343
lane_nn	nn1	1853	1	fic_1853_2454.txt-331-21	 	Yes, if Kitty will wrap him up well, \" was the answer, and the sleigh flew down the lane, and was soon out of sight.	84:88	0:116
lane_nn	nn1	2000	2	fic_2000_38620.txt-307-11	 	After getting my prescription, I met Barb at a checkout lane and helped her unload the cart.	56:60	0:92
lane_nn	nn2	1856	1	fic_1856_5515.txt-880-9	 	The walk was rural and quiet, through green lanes that were seldom disturbed except when the house of God was open.	44:49	0:115
lane_nn	nn1	1986	2	fic_1986_23984.txt-75-9	 	The stroke happened as he turned from a feeder lane onto an eight-lane highway.	47:51	0:79
lane_nn	nn2	2003	2	news_2003_628522.txt-25-5	 	In an effort to keep lanes open in each direction at all times, Howard said city crews paved over the median so that people can drive on that while the main lanes are under construction.	21:26	0:186
lane_nn	nn1	1971	2	fic_1971_782010.txt-876-3	 	Her private asphalt lane wound through acres of mature avocado trees.	20:24	0:69
lane_nn	nn1	1967	2	fic_1967_10484.txt-5101-17	 	With pinwheeling legs, flailing arms, I hurdle a new ditch and commence rushingdown the ailanthus-shaded lane leading to the country road when now, abruptly, my pace slackens, I begin a slow dogtrot which in turn becomes a walk, feet scuffing along.	105:109	0:249
lane_nn	nn1	1835	1	fic_1835_7327.txt-2481-11	 	Badly, Squire, badly, -- we went up the lane, to the house you told me of.	40:44	0:74
lane_nn	nn1	1843	1	fic_1843_7208.txt-2712-27	 	screamed the amiable female bearing that name, standing in the door and directing a withering glance towards Mr. Drudge, who was slowly shambling up the lane completely exhausted and toil-worn. \"	153:157	0:195
lane_nn	nn1	1849	1	fic_1849_7218.txt-3145-7	 	Next, I came to a hawthorn lane, leading down very prettily to a nice little church; a mossy little church; a	27:31	0:109
lane_nn	nnl1	2004	2	news_2004_640251.txt-79-10	 	It is not a cash issue, \" said Mark Lane, an equity analyst with William Blair &; Co. in Chicago.	36:40	0:97
lane_nn	nn2	1860	1	fic_1860_9817.txt-4328-22	 	their distant prey -- some along the open spaces near the lines of the palisades, and the rest along the narrow lanes winding through the thickly clustered masses of the intervening wigwams, each too intent on reaching his destination, to heed the startled looks of the swarms of women, children, and disabled old men, everywhere encountered on the way, they had all, almost before the minutes could be counted, reached their appointed stations, and, still undiscovered, now stood eagerly awaiting the promised order, within fifty yards of the crowding lines of the multitudinous foemen all too deeply engrossed with the dangers in front, to have a thought to spare for any that might arise behind them.	112:117	0:703
lane_nn	nn1	2009	2	fic_2009_36491.txt-72-6	 	They have us down to one lane for repairs.	25:29	0:42
lane_nn	nnl1	1850	1	fic_1850_7171.txt-5203-23	 	Still, among the adherents of the cause, the inquiry arose, Shall the Church go to Knuckle Lane, or Knuckle Lane come to the Church?	108:112	0:132
lane_nn	nn1	1840	1	fic_1840_8770.txt-357-40	 	Mrs. Gudgeon Come, come, children, you have been long enough in the orchard -- the paradise orchard, as I call it: When Robert courted me by the well or the big walnut tree in the lane, it was always \" Margery, Margery, you are awhile foddering the turkeys -- is the Muscovy gander got among them agin and troubling you? \"	180:184	0:322
lane_nn	nn2	2006	2	fic_2006_51059.txt-23-15	 	As if responding to a secret sign, the Chinese pedestrians walk into the eight lanes of moving traffic as if the cars and trucks and vans do not exist.	79:84	0:151
lane_nn	nnl1	1981	2	news_1981_670991.txt-5-38	 	// These would include Miss Jackson ' s bracing, profoundly moving portrayal of the late Stevie Smith, the English poet, in \" Stevie, \" as well as the performances of Amanda Plummer and Diane Lane in \" Cattle Annie and Little Britches, \" which was made in 1979, and the performance of Sandrine Battistella in Jean-Luc Godard ' s \" Numero Deux, \" made in 1975.	192:196	0:359
lane_nn	nnl1	1965	2	nf_1965_773962.txt-42-13	 	MANCHESTER The Hollings College for the Food and Fashion Industries, Old Hall Lane, Wilmslow Road, Manchester 14.	78:82	0:113
lane_nn	nn2	1960	2	mag_1960_491648.txt-190-13	 	Also, All Star is operating in an area that is oversupplied with lanes.	65:70	0:71
lane_nn	nn1	1829	1	fic_1829_7072.txt-420-25	 	While I was indulging in one of these paroxysms of feeling, a boy who lived with Mr. Saunders appeared at the end of the lane leading to our house.	121:125	0:147
lane_nn	nn2	1992	2	mag_1992_394666.txt-57-33	 	The photos above compare the 100-micron counterpart of the dark clouds in Ophiuchus to an optical view The bright infrared streamers radiating away from the core of Ophiuchus correspond to the dark dust lanes that intrigued Barnard.	203:208	0:232
lane_nn	nn1	1848	1	fic_1848_7193.txt-351-5	 	At the end of the lane, our travellers stood, gazing in silence upon the prospect.	18:22	0:82
lane_nn	nn1	1860	1	fic_1860_9791.txt-498-11	 	began to caper from side to side, dashed into a lane, and then through a broken hedge, racing over the moor like hounds till they pulled up near another highway, and to-day that road took us to the village below here, where we had not intended to stop, and which was, you know, quite out of our way.	48:52	0:299
lane_nn	nn1	1986	2	mag_1986_332451.txt-4-22	 	Reunions in the latter two last week brought out more than 300 present and former bunnies for a final hop down memory lane. \"	118:122	0:125
lane_nn	nn1	1849	1	fic_1849_583.txt-1636-22	 	I can not but turn aside, while thus speaking of illustrious men, to observe that St. Michael's, Crooked Lane, contains also the ashes of that doughty champion, William Walworth, Knight, who so manfully clove down the sturdy wight, Wat Tyler, in Smithfield -- a hero worthy of honorable blazon, as almost the only Lord Mayor on record famous for deeds of arms, the sovereigns of Cockney being generally renowned as the most pacific of all potentates.	105:109	0:450
lane_nn	nn1	2004	2	fic_2004_29297.txt-20-8	 	Turn left, and drive down the gravel lane about a quarter of a mile until it dead-ends at a two-story white Victorian with a green roof, a wrap-around porch, and a windowed turret.	37:41	0:180
lane_nn	nn2	2009	2	mag_2009_405436.txt-6-19	 	What was a quaint intersection of two country roads 50 years ago is now a two-tiered interchange with 10 lanes of traffic-choked hell; try to cross it on foot, and you're taking your life into your hands.	105:110	0:204
lane_nn	nn1	1997	2	fic_1997_54824.txt-312-31	 	So the soldiers stepped on it, the APC started really rumbling down this lane like a bobsled, riding high up on curves as it tried to follow this winding lane.	154:158	0:159
lane_nn	nn1	2006	2	fic_2006_30085.txt-52-6	 	He steered her down the checkout lane, propelled her past the row of teenage baggers, and through a clot of abandoned shopping carts.	33:37	0:133
lane_nn	nn1	1856	1	fic_1856_5515.txt-1094-80	 	Six years have passed, and beneath the old maples sits Nurse Nannie, wrinkled and bent, with a wee babe upon her lap, while a girl of two years and a half plays with her doll upon the lawn, now and then looking up to catch mamma's smile, or to wonder why dear papa looks so grave when Grandmamma Dunmore tells him about the sick man in the cottage at the end of the lane, and his motherless children.	366:370	0:400
lane_nn	nn2	2006	2	fic_2006_30607.txt-88-14	 	His foot on the gas, the car raced down the street, straddling lanes as he struggled for control.	63:68	0:97
lane_nn	nn2	1976	2	fic_1976_10612.txt-640-44	 	I wouldn't want to be old Bertelson when he finds that in modern Sweden the Lutheran Church has become nothing but a registry of births and deaths, and that the sexual habits of young Swedes make the objectionablegoings-on in Omaha lovers ' lanes look like sandbox play.	241:246	0:270
lane_nn	nn2	1997	2	fic_1997_29729.txt-237-23	 	It's always rush hour but I haven't figured out when to put on my blinker because it's safe to change lanes and I 'm also not sure which exit I should take to get off this track altogether.	102:107	0:189
lane_nn	nn1	1854	1	fic_1854_9160.txt-2935-1	 	The lane by which I was wont to reach the demesne of Ditton, partook in an eminent degree of this character, being very narrow, winding about continually without any apparent cause, almost completely embowered by the tall hawthorn hedges, and the yet taller oaks and ashes which grew along their lines, making, when in full verdure, twilight of noon itself, and commanding no view whatever of the country through which it ran, except when a field-gate or cart-track opened into it, affording a glimpse of a lonely meadow, bounded, perhaps, by a deep wood-side.	4:8	0:560
