lemma	pos	date	grouping	identifier	description	context	indexes_target_token	indexes_target_sentence
blockera	 	1895	2	bib15761570_18950817_146176_135_0002_alto.xml-104-17	 	må anföras att en bonde, då gödselstaden omsider blef så stor att den hed och hållet blockerade hans ladugård, flyttade ladugården till en annau plats hällre än att göra sig besvär att undanskaffa gödseln.	85:95	0:205
blockera	 	1901	2	bib11653811_19010322_145317_46_0003_alto.xml-29-16	 	Från Köpenhamn telegraferas den 20 mars: Danska arbetareför¬ bundet har i dag beslutat förklara frihamnen blockerad från och med i morgon.	106:115	0:138
blockera	 	1895	2	bib19277277_18950506_147683_122_0005_alto.xml-132-6	 	land vägrade efterkomma Englands fordringar, blockerade i slutet af april den utanför Nicaraguas vestra kust kryssande engelska eskadern det der belägna Corinto, och staden besattes af engelsmännen.	45:55	0:198
blockera	 	1801	1	bib19225772_18010812_148004_91_0002_alto.xml-0-21	 	De wille 11 » wända om, mert 6 Engel sta Fregatter kommo deln, ryggen, och snart wörö de blockerade af 20 Engelsta krigsskepp och utsatte för elden frän alla sidor.	89:99	0:164
blockera	 	1829	1	bib19223423_18290603_145063_44_0001_alto.xml-9-8	 	att Ryssar, & gt; i stola blockera wår hamn.	26:34	0:44
blockera	 	1899	2	bib11653790_18990414_145648_28_0006_alto.xml-82-10	 	efter Jukonfloden har sedan den 26 oktober, då staden blockerades af is, uppehållits genom postiljoner med 14 dagars tur fram och åter mellan Dawson City och Saint Michaels.	54:65	0:173
blockera	 	1895	2	bib15650837_18950112_146391_10_0005_alto.xml-49-5	 	Två lokomotiv voro 1 Söndags blockerade på banan mellan Lnzenac och Ax samt två aldra på jernvägen mellan Lnzenac och Tarascon.	29:39	0:127
blockera	 	1901	2	bib11653838_19011018_147024_42_0003_alto.xml-26-10	 	för försvaret at hamnar och inlopp, för oroande af blockerande fartyg, som skydd mot brandskattning och dylikt bör däremot detta stridsredskap kunna tillmätas ett icke oväsentligt reelt värde.	51:62	0:192
blockera	 	1801	1	bib11653825_18011224_145134_152_0002_alto.xml-3-133	 	att Tropparne befunna sig i det ömkeligaste tillständ; att lill de widsträckta förskansningarncs förswar, knappt funnos 2000 man skicklige att göra tjenst; och desse wero dock af arbete utmattade; man hade artilleri och munition nog, men artilleristerne moro nywärfde Greker, och matroser som ingen öfning haft; att man ej hade brödkorn längre än till den 2Z Sept., och aldeles ingen olja; gansta litet brännwin och ätticka; endast för hospitalen litet färkött, och för Armen endast hästkött; wik, fanns alldeles icke; i Sjukhusen funno » 1900 man, sjuke af skörbjugg de fleste; watlen hade man ej för längre tid än 20 dygn, 0. s. w. Deremot war fiendens Landt.Arme 25,020 man, och pä sjösidan blockerades Alexandria af 40 Krigsskepp och pä sjön MarcoiiS af 120 Kanonflupar.	694:705	0:774
blockera	 	1820	1	bib19227291_18200216_145289_7_0002_alto.xml-0-33	 	Denna i Sr wisserligen wäl befäst; men Znsurgenkerne och inwänarne i Staden San Fer- vando, som afwen inbegrixes under ön, komma snart alt lida brist pä lifsmedel, dä ön blockeras bäde till lands och sjös.	170:179	0:205
