lemma	pos	date	grouping	identifier	description	context	indexes_target_token	indexes_target_sentence
Engpaß	NN	1860	1	humboldt_aequinoktial03_1859-2103-12	 	Aber über dem Einfluß des Rio Arauca, wenn man durch den Engpaß beim Baraguan kommt, wird es auf einmal anders, und von nun an findet der Reisende keine Ruhe mehr.	57:63	0:163
Engpaß	NN	1949	2	2532889X_1949-08-09_01_030.tcf.xml-5-8	 	2. Sonderschichten innerhalb des Betriebs zur Beseitigung von Engpässen bedürfen einer ausdrücklichen Zustimmung der.	62:71	0:117
Engpaß	NN	1860	1	humboldt_aequinoktial03_1859-1873-33	 	Sodann, nachdem sie unter dem reißenden Toben des Nil und den sich begegnenden Wellen tüchtig herumgeschaukelt worden sind, halten sie sich endlich an die seichtesten Kanäle, durch die sie den Engpässen der Felsen entgehen, und mit der ganzen Strömung niederstürzend, lenken sie den schießenden Nachen.“	193:202	0:303
Engpaß	NN	1869	1	brehm_thierleben06_1869-19570-31	 	Jeder Strahl kann dabei vorangehen und die Thiere sind im Stande, nicht nur Unebenheiten zu überwinden und senkrecht auf-und abwärts zu steigen, sondern sie drücken sich auch durch Engpässe, indem sie zwei Strahlen nach vorn und drei nach hinten aneinander legen.	181:189	0:263
Engpaß	NN	1957	2	2532889X_1957-06-12_01_047.tcf.xml-29-2	 	Ein fühlbarer Engpaß war bisher auch in unserem Kreis die Versorgung mit Baustoffen für Reparaturzwecke.	14:20	0:104
Engpaß	NN	1813	1	hc_1732910_1813-21-10	 	Das Corps zur Linken unter dem General Grenier vertheidigte die Engpässe des Thals der Fella.	64:72	0:93
Engpaß	NN	1848	1	nn_nrhz193_1849-455-27	 	Am 1. Jan. rückten beide Kolonnen nach Neustadt vor, welchen Ort der Feind verlassen und bei Budatin und Sillein Stellung genommen hatte, um den Brodner Engpaß und den Uebergang über die Waag zu vertheidigen.	153:159	0:208
Engpaß	NN	1948	2	2532889X_1948-06-27_01_025.tcf.xml-4-1	 	Der Engpaß für die Gaswerke ist seit Beginn der umfangreichen Kohlelieferungen aus Polen nicht mehr die Kohle, sondern die Materialversorgung zur Durchführung der notwendigen Reparaturen.	4:10	0:187
Engpaß	NN	1952	2	2532889X_1952-07-11_01_128.tcf.xml-816-23	 	Die Parteileitung im Betrieb soll nicht die Arbelt der Betriebsleitung verrichten, sie muß vielmehr öle Maßnahmen der Werkleltung zur Planerfüllung an den Engpässen im Betrieb kontrollleren: sie -oll den Werktätigen an Hand der konkreten Fragen des Betriebes unsere Politik erläutern; sie soll die Genossen'	155:164	0:307
Engpaß	NN	1848	1	nn_jaeger_1848-596-13	 	Standhaft ficht Letzt’rer (Preuß’ zollt ihm Applaus!) Und Hauptcorps aus Engpaß sich wickelt heraus.	73:79	0:100
Engpaß	NN	1864	1	brehm_thierleben01_1864-6441-1	 	Manche Engpässe durch waldreiche Schluchten sind berüchtigt wegen der Raubthaten des Tigers; Forbes versichert, daß ohne die große Furcht des Tigers vor dem Feuer kaum hier und da eine Verbindung im Lande möglich sein könne.	7:15	0:224
Engpaß	NN	1954	2	2532889X_1954-04-01_01_021.tcf.xml-204-60	 	für zu interessieren, den Ausschuß mit aller Kraft zu senken, Ausfall-und Stillstandzeiten zu vermeiden. den Ausfall von Maschinen zu verhindern oder notwendige Reparaturen zu beschleunigen, den Produktions-und Transportprozeß flüssig und störungsfrei zu organisieren, die Kapazitäten voll auszunutzen, keine faulen Ausreden irgendwelcher Betriebs-und Verwaltungsfuruktionäre über sogenannte „objektive\" Schwierigkeiten, über Engpässe und Schwierigkeiten der Materialversorgung gelten zu lassen.	426:434	0:495
Engpaß	NN	1960	2	26120215_1960_07_29_01_268.tcf.xml-46-7	 	Dispatcher Schröder machte den Vorschlag, diesen Engpaß durch einen Direktvertrag mit dem VEB Tadellos zu überbrücken.	49:55	0:118
Engpaß	NN	1948	2	26120215_1948_12_21_01_020.tcf.xml-6-1	 	Dieser Engpaß könne nur überwunden werden, wenn in kürzester Frist eme Wasserleitung von der Saale nach Unterwellenborn und im Werk einSO 000 cbm fassendes Wasserreservoir gebaut werden.	7:13	0:186
