lemma	pos	date	grouping	identifier	description	context	indexes_target_token	indexes_target_sentence
relationship_nn	nn1	1970	2	nf_1970_774162.txt-1426-33	 	Thus when the word hsin is used, it is not easy to tell from the context what kind of mind is talked about or referred to, partly because the distinction and/or relationship between the phenomenal mind and the noumenal mind is theoretically problematic in Buddhist thought.	161:173	0:273
relationship_nn	nn1	1844	1	fic_1844_2105.txt-69-25	 	The collection of them, by different observers, seems sufficiently abundant, and strictly harmonizes with itself, yet never brings us into intimate relationship with the hero, nor makes us feel the warmth and the human throb of his heart.	148:160	0:238
relationship_nn	nn1	1840	1	fic_1840_7332.txt-524-37	 	Langdale staid to dinner; he was every now and then, whatever was the topic of conversation, quoting Miss Atherton, or alluding to her beauty, and the prize he had found in her relationship.	177:189	0:190
relationship_nn	nn1	1984	2	fic_1984_10716.txt-7443-18	 	I have it from my closest girl friend, Madeleine -- she, uh, has a special relationship with Inspector Fontaine, who is the head of the Lourdes gendarmerie -- \" \" Yes? \"	75:87	0:169
relationship_nn	nn1	1837	1	nf_1837_747960.txt-2020-33	 	The same fashion has represented the kingdom of grace alone, as connected wiHi the atonement of Jesus Christ; supposing the kingdom of nature and the kingdom of providence to sustain no relationship to his mediation.	186:198	0:216
relationship_nn	nn1	2001	2	fic_2001_29273.txt-78-4	 	marriage would erode a relationship I had come to value.	23:35	0:56
relationship_nn	nn2	1995	2	mag_1995_396720.txt-13-12	 	Individual identity is forged not in isolation but in the context of relationships.	69:82	0:83
relationship_nn	nn1	1974	2	mag_1974_314761.txt-23-4	 	The close, conspiratorial relationship between Rose and Sarah, the rebel maid, was inspired by the two maids in Henry Green's novel Loving (belowstairs in a country house).	26:38	0:172
relationship_nn	nn1	1979	2	mag_1979_293051.txt-1-29	 	After Jimmy Carter and Leonid Brezhnev sign the SALT II treaty next week, it goes before the Senate for a ratification debate that will range over the whole relationship between the world's two superpowers.	157:169	0:206
relationship_nn	nn1	1855	1	nf_1855_748479.txt-650-19	 	These mechanics were called \" uncles \" by all the younger slaves, not because they really sustained that relationship to any, but according to plantation etiquette, as a mark of respect, due54 from the younger to the older slaves.	105:117	0:230
relationship_nn	nn1	1824	1	fic_1824_7279.txt-1554-6	 	It is my wish that our relationship should remain a secret for the present. \"	23:35	0:77
relationship_nn	nn2	1990	2	mag_1990_419883.txt-14-4	 	Such changes obscure historical relationships among languages after about 6,000 years, Campbell says. \"	32:45	0:103
relationship_nn	nn1	1977	2	fic_1977_10629.txt-2699-9	 	Apparently the old man had adopted him, a relationship David didn't mind.	42:54	0:73
relationship_nn	nn1	1855	1	fic_1855_9053.txt-5231-20	 	I informed Mr. Fantish, \" he said, calmly, \" that I had called in right of my relationship, and in further right of my charge from your father, to say that the continuance of the jest in relation to yourself, Silvia, would make it necessary for you to abandon the city. \"	78:90	0:271
relationship_nn	nn2	1999	2	nf_1999_773697.txt-443-0	 	relationships makes the course of economic affairs a limitless and often unique series of historical facts.ls Yet one might well gather from many an economic principles textbook that perfect competition is a sort of norm, which might be taken to imply that any departures from perfect competition are generally unfortunate.	0:13	0:323
relationship_nn	nn1	1984	2	mag_1984_299239.txt-6-15	 	Then the U.S. could sever the umbilical cord that links us to Israel in a relationship that costs us so much money and gives us so much trouble in dealing with other nations.	74:86	0:174
relationship_nn	nn1	1859	1	fic_1859_9220.txt-3536-4	 	However, notwithstanding the relationship I spoke of between the witness and the accused, \" he	29:41	0:94
relationship_nn	nn1	1973	2	nf_1973_774239.txt-1000-4	 	The underlying ground for relationship quality is clearly the continuous physical textures of the body.24 The event quality of each successive perception becomes gradually enriched in a process called funding	26:38	0:208
relationship_nn	nn1	1966	2	mag_1966_490646.txt-59-24	 	It was something all but unheard of -- a long period during which the police and the public were in a close and non-antagonistic relationship.	129:141	0:142
relationship_nn	nn1	1843	1	mag_1843_555146.txt-509-15	 	The Mother and the Children have had conflicting interests from the earliest hour of this relationship, and it is their destiny, probably, that this rivalry shall endure to the end of their national existence.	90:102	0:209
relationship_nn	nn1	1994	2	nf_1994_746583.txt-738-4	 	1988) (recognizing relationship between CERCLA section 113(h)'s goal of prompt cleanups and Congress's goal of protection of public health and the environment from hazardous wastes).	19:31	0:182
relationship_nn	nn1	2007	2	mag_2007_389494.txt-18-4	 	it was an abusive relationship; that was just another experience of being powerless.	18:30	0:84
relationship_nn	nn1	1838	1	fic_1838_7085.txt-2404-5	 	if I ask if the relationship was sacredly regarded by you? \"	16:28	0:60
relationship_nn	nn1	1859	1	nf_1859_747415.txt-1418-9	 	If ever we venture on the testimony of such relationship between languages as giving proof of ancient kindred between nations, it must be when historical considerations render the conclusion in itself probable, or indicate that it affords the most natural explanation of the phenomena observed.	44:56	0:294
relationship_nn	nn1	1817	1	nf_1817_747573.txt-2005-18	 	Her birth-place, her home, her connections, all were relinquished for the privileges of her new relationship and adopted country, although to her eye nothing was presented but poverty and want.	96:108	0:193
relationship_nn	nn2	1993	2	nf_1993_773791.txt-93-5	 	By contrast, the vowel relationships in the Indo-European languages were extensively examined to arrive at current analyses.	23:36	0:124
relationship_nn	nn1	1839	1	fic_1839_7068.txt-1489-43	 	Helen's recent arrival in London had prevented her from before learning ought of the infamy belonging to our hero's parentage; nor was she prepared by any previous knowledge of the circumstances, connected with Glenthorne's history, or his relationship to Clifton, to anticipate the disgrace thus reflected on the latter.	240:252	0:321
relationship_nn	nn1	1831	1	fic_1831_7210.txt-1209-10	 	I think, \" said she, \" that the relationship existing between Harris and me, fully sanctions the intimacy of which you complain.	32:44	0:128
relationship_nn	nn1	1852	1	nf_1852_771217.txt-1894-17	 	The radical difference indeed of this mental refinement from genuine religion, in spite of its seeming relationship, is the very cardinal point on which my present discussion turns; yet, on the other hand, such refinement may readily be assigned to a Christian origin by hasty or distant observers, or by those who view it in a particular light.	103:115	0:345
relationship_nn	nn1	1984	2	news_1984_671374.txt-1-54	 	// For many months, I have encouraged the Soviet Union to join with us in a major effort to see if we could make progress in these broad problem areas, reducing the threat and use of force in solving international disputes, reducing armaments in the world and establishing a better working relationship with each other.	290:302	0:319
relationship_nn	nn1	1838	1	mag_1838_586207.txt-214-35	 	Where A owes B, and B owes C, and C owes A, it is evident that all that is wanted to effect a satisfactory adjustment, is, a knowledge of the relationship of the parties to one another: and without	142:154	0:197
relationship_nn	nn1	1859	1	fic_1859_9220.txt-7847-23	 	human being might be to her, and however decided her admiration for him, nothing would induce her to enter into the relationship of marriage with him, not only so long as he might be a man of the world -- a self-righteous man -- a careless unbeliever -- but so long as there was any great essential difference in their religious views; and on the whole, therefore, said she to Edith, as I do not believe in marriage, as a necessity -- nor even as a \" consummation devoutly to be wished \" or greatly desired; as I do not believe that the unmarried are obliged to be unhappy, while I know the married often are -- I have about made up my mind never to marry. '	116:128	0:658
relationship_nn	nn2	1981	2	nf_1981_774357.txt-1630-1	 	about relationships, the Amiable person can rely on these qualities in some social dealings.	6:19	0:92
relationship_nn	nn1	2004	2	news_2004_617168.txt-56-7	 	I think there's a little better relationship with the mayor than there has been.	32:44	0:80
relationship_nn	nn2	1859	1	fic_1859_270.txt-2863-32	 	Thirst belongs to humanity, everywhere, in all ages; but that white-pine pail, and that brown mug belong to me in particular; and just so of my special relationships with other things and with my rice.	152:165	0:201
relationship_nn	nn2	1856	1	fic_1856_5515.txt-130-8	 	They had married, and in their new relationships lost sight of each other, until, by a mysterious Providence, they were now united.	35:48	0:131
relationship_nn	nn2	1991	2	news_1991_649979.txt-5-13	 	realities: in our increasingly female, work-centered world, most of our relationships, including intimate ones, are initiated in the workplace; gender relations, especially new ones, are complex and invariably ambiguous; in our heterogeneous society, the perception of what constitutes proper and effective male-female relations varies across gender, class, ethnicity and region; and in keeping with our egalitarian ideals, we take pride in the fact that the WASP boss may legitimately desire or want to marry his or her Puerto Rican aide or chauffeur.	72:85	0:552
relationship_nn	nn1	1997	2	fic_1997_54734.txt-225-1	 	The relationship between them and King Islanders is symbiotic.	4:16	0:62
relationship_nn	nn1	1962	2	news_1962_722734.txt-49-6	 	The balance of payments is the relationship of money flowing into and out of the country, and low short-term interest rates induce money to flow out.	31:43	0:149
relationship_nn	nn1	1845	1	fic_1845_7170.txt-4641-4	 	whom and herself some relationship was claimed, and work silently with Obed in his herb-beds, despite the most urgent solicitations of Margaret; she resorted alone to the thickest parts of the forest; and sometimes she would break away from Margaret when they were on the Pond together, take the canoe and wander alone over the deep dark waters, or spend hours by herself on a solitary island.	22:34	0:393
relationship_nn	nn1	1840	1	fic_1840_7256.txt-439-20	 	But, in truth, I had no reason to believe that (with the exception of the matter of relationship, and in the case of Wilson himself), this similarity had ever been made a subject of comment, or even observed at all by our schoolfellows.	84:96	0:236
relationship_nn	nn1	1845	1	fic_1845_7262.txt-1368-12	 	And is it possible -- can it be that there is any relationship between -- \" \" Yes; this	50:62	0:87
relationship_nn	nn1	1848	1	nf_1848_754438.txt-2164-11	 	It is true that a few Canarian families boast of their relationship to the last shepherd-king of Guimar, but these pretensions do not rest on very solid foundations, and are only renewed from time to time when some Canarian of more dusky hue than his countrymen is prompted to solicit a commission in the service of the king of Spain.	55:67	0:334
relationship_nn	nn1	1845	1	nf_1845_747909.txt-507-48	 	epochs, the broad hand of an overruling Providence is to be- discovered, fashioning and framing each class of created forms, irrespective of external physical forces or agents, and giving birth spontaneously to unconnected tribes of animals and plants, which bear no sort of relationship to one another, and are not parts of one common plan in which there is a unity of design?	275:287	0:377
relationship_nn	nn1	1978	2	news_1978_733719.txt-90-4	 	Because of this special relationship, there is every reason to urge Mr. Marcos to implement genuine economic and human rights reforms which will benefit the people of his country and, if he chooses not to do so, to question the wisdom of continuing to support his Government with large infusions of American aid.	24:36	0:312
relationship_nn	nn1	1839	1	fic_1839_7011.txt-1995-51	 	I know not whether it was from an impulse of humanity infused into his breast by his warm hearted wife, of whom he was excessively fond, or from a a coarser motive of gain, or from the two feelings combined, that Captain Galley upon learning in what relationship Isabel stood to the rich Governor of Pensacola, began to express his regrets that that port was so very far out of his way; hinting that, if it were the Havanna, from which, he said, having a fair wind, we were scarce distant twenty-four hours ' sail, he would not hesitate to carry her thither to her friends, without asking of them any thing further in recompense than the payment of his expenses.	250:262	0:662
relationship_nn	nn1	1842	1	fic_1842_7158.txt-65-2	 	not of relationship alone, but of affectionate and earnest solicitude.	7:19	0:70
relationship_nn	nn1	2002	2	nf_2002_746524.txt-91-11	 	Unfortunately, there are insufficient data with which to assess the relationship between urban population growth and violence in other regions of the world.	68:80	0:156
relationship_nn	nn2	1969	2	nf_1969_773553.txt-656-25	 	the second case nothing necessarily follows from homogeneity except that it will facilitate the establishment of relationships, provided that people seek the formation of relationships within the locality which they will have to do if the locality is a settlement and relatively isolated.	171:184	0:288
relationship_nn	nn1	1971	2	fic_1971_780007.txt-518-20	 	Then, if we don't get anywhere with this, that leaves you and | him in the same relationship as before.	80:92	0:103
relationship_nn	nn1	1987	2	news_1987_670537.txt-23-35	 	// In a novel, the prose is the hero, the human thing; the author ' s voice is our foremost point of contact and upholds one side of the shifting, teasing relationship we as reader are invited into.	155:167	0:198
relationship_nn	nn1	2007	2	fic_2007_33947.txt-229-10	 	She asked, \" Could you tell me about your relationship with that prisoner in Capitola? \"	42:54	0:88
relationship_nn	nn1	1830	1	fic_1830_7266.txt-1061-3	 	Mrs. Clarence ' relationship with some of the most distinguished families in the city, was, at the dawn of her prosperity, remembered, and the cause became a topic in fashionable circles.	16:28	0:187
relationship_nn	nn1	2003	2	nf_2003_746676.txt-28-5	 	Further, findings indicating a relationship between intolerance for ambiguity and low endorsement for diversity interventions in business students	31:43	0:146
relationship_nn	nn1	1978	2	fic_1978_13992.txt-3116-6	 	His body is in the same relationship to DODGE 'S.	24:36	0:49
relationship_nn	nn1	1835	1	fic_1835_7014.txt-120-6	 	How far the kindly feelings of relationship, or how far the influence of his daughter's growing beauty, had contributed to secure him the benevolence of this friend	31:43	0:164
relationship_nn	nn1	1974	2	mag_1974_491563.txt-283-11	 	The ostensible purpose would be to establish some sort of working relationship between the mobs in control of the various regions of the country.	66:78	0:145
relationship_nn	nn2	1990	2	mag_1990_420398.txt-79-5	 	naturally led to some difficult relationships between various elements, not all resolved satisfactorily; an example is the relationship between the large corner capitals and the miniature arcade above them, in which no convincing rapport was made.	32:45	0:247
relationship_nn	nn1	1847	1	fic_1847_7194.txt-1243-14	 	Strange words these, when you remember that Reginald is yet ignorant of the relationship of this poor peasant maid to a wealthy planter, unconscious of the dear tie which binds her to the heart of Martin Landsdowne.	76:88	0:215
relationship_nn	nn1	1831	1	fic_1831_7210.txt-1111-19	 	It is not to be wondered at, that, with such companionable qualities added to his claim of relationship, this agreeable young man should soon be permitted to enjoy much intimacy and favour with Harriet Lewis.	91:103	0:208
relationship_nn	nn1	1840	1	mag_1840_586586.txt-358-53	 	Thus war and wo have been multiplied; thus the estrangement between nations has widened so that long ages will // hardly close the gap; arid thus the spirit of implacable enmity has been fostered, until it has become almost a matter for the sternest moral courage to assert the original relationship of men, to proclaim the duty of mutual respect, or to insist upon the supreme obligation of cherishing peace.	287:299	0:409
relationship_nn	nn1	2001	2	mag_2001_415828.txt-264-14	 	Struggling to find life within their classrooms, participants reached out to establish a relationship with others.	89:101	0:114
relationship_nn	nn1	1857	1	fic_1857_290.txt-464-8	 	I could plead none of the rights of relationship; yet I enjoyed the privileges of a son.	36:48	0:88
relationship_nn	nn1	1834	1	fic_1834_2652.txt-1534-44	 	She was a trembling, timid body, thin, pale, and emaciated, who appeared to have suffered much, and certainly stood in as much awe of the man whose name she bore as it was well fitting in such a relationship to permit.	195:207	0:218
relationship_nn	nn1	1986	2	news_1986_670404.txt-34-5	 	The Secretary said the security relationship is terminated. \"	32:44	0:61
relationship_nn	nn2	1856	1	mag_1856_590818.txt-60-3	 	In all these relationships his admirable manners, weight of character, and unsullied reputation gave him great influence with all parties.	13:26	0:138
relationship_nn	nn1	2001	2	mag_2001_416749.txt-96-2	 	When the relationship is good, all is well at your home and hers.	9:21	0:65
relationship_nn	nn1	1848	1	fic_1848_7009.txt-2768-6	 	-- He would have known their relationship to Coquese at once, from their resemblance to her, had she not before told him of them.	29:41	0:129
relationship_nn	nn1	1988	2	news_1988_670637.txt-52-54	 	// Frustrated by what he felt was RCA ' s failure to market his records properly (RCA wasn ' t happy with sales, either) and by the contractual hassles whenever he wanted to record with Mr. Ma (who records for CBS Masterworks), the pianist recently severed his longterm relationship with RCA to sign with CBS.	270:282	0:309
relationship_nn	nn2	1998	2	news_1998_653834.txt-47-15	 	That's because the best-compensated investment bankers tend to be those with the tightest client relationships.	97:110	0:111
relationship_nn	nn1	1981	2	nf_1981_774357.txt-1047-33	 	Yes, in another sense because you are approaching others in a way that pleases, rather than irritates them, so you can set a positive stage for effective performance from the relationship.	175:187	0:188
relationship_nn	nn2	1987	2	fic_1987_10756.txt-6386-30	 	I had headed into Utah for answers to both relationships, but once there it had become not future revelations that held me but the quality of immediate ones, relationships that in this place had a way of remaining jettisoned from the past.	158:171	0:239
relationship_nn	nn2	1848	1	mag_1848_565738.txt-197-9	 	The instant that he reaches out beyond his earthly relationships, he finds himself caught into those which connect him with the noral administration of God.	51:64	0:156
relationship_nn	nn1	1859	1	nf_1859_747415.txt-2377-9	 	For while comparative philology is adequate to trace the relationship of languages, and thus to trace all languages to one primeval stock, or at least, when considered in connection with other criteria of the alliance of races, to demonstrate a community of origin for all, it does not \" by ITSELF decide \" that the entire human genus have descended from \" a single pair, \" inasmuch as a primeval tongue might have been communicated to any number of individuals as well as to two.	57:69	0:480
relationship_nn	nn1	1855	1	mag_1855_505293.txt-298-44	 	Yet now, so far had the work of ruin gone on in the minds of these young girls, that they not only had forgotten many of their early friends and associates, but, strange to say, they had forgotten the relationship between themselves.	201:213	0:233
relationship_nn	nn1	1846	1	mag_1846_565585.txt-11-25	 	For it makes all members of one family, and binds them to the acts and affections which grow out of that common and intimate relationship.	125:137	0:138
relationship_nn	nn1	1839	1	fic_1839_7011.txt-1985-14	 	in so extraordinary a manner brought us together and revealed the secret of our relationship, could not have done so only to let us perish in each other's arms on the broad deep; and her confidence restored me in part to mine.	80:92	0:226
relationship_nn	nn1	1990	2	nf_1990_773757.txt-502-3	 	makes a love relationship particularly vulnerable and fragile is the need for reciprocity.	13:25	0:90
relationship_nn	nn1	1995	2	mag_1995_396716.txt-10-3	 	MEMENTOS OF OUR RELATIONSHIP -- BOXES OF LETTERS, OUR WEDDING ALBUM, OUR SON 'S FIRST LOCK OF HAIR.	16:28	0:99
relationship_nn	nn1	1856	1	fic_1856_2470.txt-7240-27	 	It was not until the health of Armstrong seemed completely restored that his brother, in the presence of his son and of Faith, disclosed his relationship.	141:153	0:154
relationship_nn	nn2	1991	2	mag_1991_421245.txt-23-7	 	by considering placement, size, spatial relationships, and rhythms. \"	40:53	0:69
relationship_nn	nn1	1975	2	news_1975_732273.txt-29-10	 	Thus, it now seem fairly assured that the U.S.-China relationship is likely to keep moving along at somewhat the same level as it has been since former President Richard M. Nixon broke the ice between the countries.	53:65	0:215
relationship_nn	nn1	2004	2	news_2004_660955.txt-53-5	 	But Arnett defends the close relationship between 20-somethings and their parents today. \"	29:41	0:90
relationship_nn	nn1	1849	1	mag_1849_525201.txt-755-26	 	Be this, however, as it may, the officers, whether of the Union or the States, represent, in philosophical truth of relationship, just those for whom they act.	116:128	0:159
relationship_nn	nn1	1827	1	fic_1827_9757.txt-3992-25	 	I believe it would be more rational to wish that the world would suffer me to act the fatherly or brotherly part, without the relationship.	126:138	0:139
relationship_nn	nn1	1838	1	fic_1838_7085.txt-2402-8	 	Am I to understand that such was the relationship you assumed in your wild journey, on which both Mars and Venus appear to have smiled? \"	37:49	0:137
relationship_nn	nn1	1852	1	fic_1852_9232.txt-4293-15	 	Parson Bindwell placed himself along-side of her, and the several groups, according to relationship or intimacy, ranged themselves in near neighborhood.	87:99	0:152
relationship_nn	nn1	1834	1	fic_1834_2652.txt-3385-21	 	It involves no impropriety; it stands in the way of no other duty, since, I trust, the relationship between us is as binding as any other which may call for your regard.	87:99	0:169
relationship_nn	nn1	1855	1	fic_1855_9053.txt-1513-18	 	Mr. Sansoucy inwardly reflected that any respectable scare-crow in a cornfield would indignantly have repelled the idea of relationship to Charley.	123:135	0:147
relationship_nn	nn1	1822	1	fic_1822_7244.txt-856-33	 	think -- but after an endless voyage, over the lonely and unfrequented solitudes of the ocean, every animate and inanimate thing is pleasant; every thing that reminds you of your relationship to other human beings.	179:191	0:214
relationship_nn	nn1	1834	1	mag_1834_554246.txt-77-61	 	Inasmuch as traits of consanguinity between different men may be discerned in their moral and intellectual resemblance, when their features and complexion would never betray the fact, so to discern the affinities of plants and animals, we must often go beneath the surface, // and find, in more important parts of their structure, marks of relationship of	340:352	0:355
relationship_nn	nn1	1995	2	nf_1995_746519.txt-93-30	 	Yet it would be a mistake to ascribe descriptions of the closeness of Anglo-American relations during this period either to Churchillian romanticism or to the isolated quality of the personal relationship between the American president and	192:204	0:239
relationship_nn	nn1	1853	1	fic_1853_9040.txt-2057-80	 	The following day I related to Jane the incidents of the evening: how Mr. Widdleton had mended a tub, and his wife had darned and mended; in fact, whatever had been done or said that could interest her, not omitting the conversation about Edward and Delia -- for I was determined to find out something in reference to the affair, as I persuaded myself I had a perfect right to do, considering our relationship; and Delia's pale face haunted me; her supplicating appeal for permission to remain at home I felt assured was not on my account; I saw pots of her flowers standing about, dying from neglect, and I could not help thinking her thoughts had been otherwhere	397:409	0:664
relationship_nn	nn1	1859	1	fic_1859_9220.txt-7959-95	 	You do not wish me to go into particulars nor to give reasons; but as our friend Mr. Fay has not called for two or three weeks, and may be comparatively a stranger to us hereafter -- though not for a long time, we hope -- and you are constantly meeting him, as you say, it seems to be but fair that you should be advised to treat him, always, and everywhere, and under all circumstances, just as if nothing had happened here to change the relationship we have always found so pleasant and so profitable.	439:451	0:503
