lemma	pos	date	grouping	identifier	description	context	indexes_target_token	indexes_target_sentence
relationship_nn	nn1	2004	2	mag_2004_414034.txt-51-5	 	and it could be a relationship at any price, \" says Susan Forward, PhD, author of Men Who Hate Women and the Women Who Love Them.	18:30	0:129
relationship_nn	nn1	1967	2	news_1967_726232.txt-126-27	 	Mr. Levin is aware that I travel 60 to 70 per cent of my working time, which I think suffices for his various aspersions about my relationship with Lord Russell.	130:142	0:161
relationship_nn	nn1	1993	2	news_1993_600205.txt-74-23	 	The first tribal leader to speak before a joint session said the state and federal governments should deal with tribes in a government-to-government relationship.	149:161	0:162
relationship_nn	nn1	1988	2	news_1988_668934.txt-3-18	 	In addition, for new customers, CDs give him a foot in the door and a broker-client relationship that may permit him to offer other financial products later.	84:96	0:157
relationship_nn	nn1	1834	1	fic_1834_2652.txt-7731-18	 	Yes, Edith -- Edith Colleton, Lucy, is the name of my cousin, and the relationship will soon be something closer between us.	70:82	0:124
relationship_nn	nn1	1822	1	fic_1822_7243.txt-3802-10	 	Whatever he found was in the wrong place -- all relationship was confounded.	48:60	0:76
