lemma	pos	date	grouping	identifier	description	context	indexes_target_token	indexes_target_sentence
bäck	nan	1895	2	bib15760690_18950422_145050_61_0003_alto.xml-28-31	 	pä afstånd en gansta wacker skogsäs, som sätt det något underliga namnet Räfwaflansen, och nedanför desi fluttning har man en smal remsa af aker och äng, hwarigenom en bäck flingrar sig.	168:172	0:186
bäck	nan	1895	2	bib11653811_18950614_145317_90_0002_alto.xml-24-9	 	räd att gifwa tio öre, och\" mänga bäckar små göra en stor ä\".	34:40	0:61
bäck	nan	1806	1	bib11653825_18060317_145134_33_0004_alto.xml-9-9	 	2 anseende till förestående Bouppteckning efter aflldne Hvf-kakcjeii Johan Bäck, anmoda?	75:79	0:88
bäck	nan	1895	2	bib15650835_18950927_146472_81_0006_alto.xml-117-11	 	lager upptäcktes 1861 af en man, som stannat wid en bäck för att fläcka sin törst.	52:56	0:82
bäck	nan	1828	1	bib19223423_18281213_145063_100_0001_alto.xml-2-20	 	I morgon, som är ven z:e Söndagen i Advent, insamlas uti Stadens Stor-Kyrka och de wiv dörrarne stäenve Bäcken ven af Kongl.	104:110	0:124
bäck	nan	1827	1	bib19223423_18270407_145063_28_0002_alto.xml-5-28	 	lvöade försök upptäckte de ändtligen icke längt frän ett enstaka huS wik änkan af en liten stag tre fruntimmer, som sutto och twättodr fbtterna i en klar bäck.	154:158	0:159
bäck	nan	1810	1	bib11653806_18100605_145120_63_0003_alto.xml-1-4	 	TillkännagifweS att Klockare-Systan wik Bäck Annex Kyrka af Frcdsbergg Församling t Skara Skift är ledig, hwartill lönen är sä knapp, att ingen ber kan soutenera; hägade vch stickelige sökande kunna anmäla sig inom trennc mänader hos undertecknad.	40:44	0:247
bäck	nan	1896	2	bib11653830_18960402_146968_27_0002_alto.xml-31-10	 	Anders Stenberg har upphört med den handelsrörelse, han i Bäcken af Grinstads socken idkat under firma A. Stenberg.	58:64	0:115
bäck	nan	1814	1	bib19277346_18140122_147394_4_0003_alto.xml-7-18	 	Om T«omten dörtill kui de ärhällas, fä,.tt siä näst ofivanföre den bron som lijgtr cf-uer bäcken, pä Sandzärtsgotan och sölcdeS huset formera hörnet imellan denna Gatan och den som kommer ftän Tor & gt; t; Om öpen Gata woro rundt omkring del samma; Om för wattnetS iippdckni mande att gjöra et » fall ned i bassingen pZ FänghusgLrden, en wntten Reservoir skrmerades i Bäcken, och den » na tillika ut!li?gades; Om » från Gatorna pä ömse sidor om Bäcken, cn sör nSt gra mo&lt; ifv * rror tillräckeligen brcd stenläggning, sogia stuttande ned St bottnen till i i aln diup anlades; Om denna fördelades i 2 eller z delar genom smala SM^er att stä pä dem som Sste upp matten, och om sör inloppet till Fsng- »	90:96	0:702
bäck	nan	1801	1	bib19225792_18011128_147359_48_0003_alto.xml-1-65	 	Sahlgrenska Sjukhns - Direcrioneit tager ater igen sin tilflykl til den » välgörande delen af Allmänheten, för at anhålla om et förnvadt prof af betz gifmildhet, dä den ärliga Lollcccen, svin allernädigst blifwit förunnad til denna Inrättnings understöd, nn i morgon, såsom den förste i Adventet, kommer pä wanligt sätt at insamlas utaf Herrar Borgerskapets Äldste med Häkwar och Bäcken talla Mastorne i denna Stadens och Fattighusets Kyrkor.	380:386	0:442
bäck	nan	1790	1	bib11653828_17901126_144028_275_0001_alto.xml-1-1	 	klara bäckar stingra sig uti ödemarkerna, vch deras susande höres endast af wildtjuren.	6:12	0:87
bäck	nan	1798	1	bib19225772_17980928_148003_77_0002_alto.xml-6-2	 	dörrarne siälde Bäcken, i bada Gudstiensterne, e » af de Collecter, sorn ärligen kilfalla Orgelkramparen, bwilken, i anseende til sin stora fattigdom med hustru och barn, samt den ringa tön kyrkan förmär at gifwa honom, ödmjukt och wördsamt wid detta tilfällc recommenderas.	16:22	0:274
bäck	nan	1814	1	bib13506739_18140714_144030_159_0004_alto.xml-0-1	 	NIIS Bäck är sjölägenhet för Fraktgods och PaKagerare till Böthcbvrg.	5:9	0:69
bäck	nan	1825	1	bib19225772_18250215_148004_19_0002_alto.xml-8-97	 	oförändrad kemnade Dom, uti Mäler emellan Backman, ä ena sidan, samt Carnegie och Lamberg i egenstap af Mitchellsta Sterbhusets rätts innehafware, ä den andra, angående stuldfordran, till bedömande i ett sammanhang nied denna sak, hänstjutit de af Backman i oftvannämnde rättegång wäckte answars pästäenden, i anledning af ett sädant förment förhällande, alt Carnegie och Mitchell warit i ett förtegadt Bolag: att Carnegie och kauiberg stola warit wällande till bedrägeri och falsthet uti del emot Backman anställde krak: att Hustru Mitchell och hennes omyndige Barns förmyndare Iohn Bäck innehaft det Backman tillhörige Skeppet Fredrika, detsamma stg till nytta brukar och sig sintligen afhandt, lita » alt de gittat dertill wisa laga åtkomst: att Hustru Mitchell och Bäck, genom detta afhändande hulpit Lamberg, säsom Backmans förr warande Betjent, Skeppet sisi tillegna, upsätligen förfara och undandölja: akt Car » egie och Lamberg stola föröftvar, samt Hustr » Mitchell och Back, genvur	584:588	0:991
