lemma	pos	date	grouping	identifier	description	context	indexes_target_token	indexes_target_sentence
Einreichung	NN	1989	2	26120215_1989_03_10_01_215.tcf.xml-1-43	 	Die Bezirkswahlkommission Berlin gibt bekannt, daß die Wahlkommissionen der Stadtbezirke auf der Grundlage der gemäß § 16 des Wahlgesetzes erfolgten Abstimmung zwischen den demokratischen Parteien und Massenorganisationen die örtlich zuständigen Ausschüsse der -Nationalen Front der DDR entsprechend 15 des Wahlgesetzes zur Einreichung der gemeinsamen Wahlvorschlage der Nationalen Front für die Wahlen am 7. Mai 1989 aufgefordert haben.	324:335	0:437
Einreichung	NN	1848	1	nn_nrhz190_1849-171-72	 	6) Aber auch abgesehen von dem Verfassungswerke der Note vom 28. v. M. und den Erläuterungen des neuen östreichischen Bevollmächtigten, bleibt eine Verhandlung mit der östreichischen Regierung nothwendig, sowohl um das Inslebenführen der deutschen Verfassung dadurch zu beschleunigen, daß eine gegenseitige Erklärung über das Verhältniß des nichtdeutschen Oestreichs zu dem Gesammt-Deutschlande, oder eventuell einer Union des Gesammt-Oestreichs zu dem übrigen Deutschland vorbereitet werde; als auch zur Einreichung der unmittelbaren Regierungszwecke der Centralgewalt, und zur Erfüllung ihrer Pflicht, welche einen Bevollmächtigten an dem Orte nothwendig macht, wo die Neugestaltung eines Reiches sich entscheidet, das zu einem großen Theile zu Deutschland gehört, und wo große europäische Interessen ihren Mittelpunkt finden.	505:516	0:828
Einreichung	NN	1948	2	26120215_1948_07_02_01_195.tcf.xml-2-28	 	Mit Rücksicht auf die besondere Inanspruchnahme der Steuerpflichtigen durch die Einhaltung von Terminen für die Währungsreform hat das Landesfinanzamt Groß-Berlin die Finanzämter angewiesen, Zuschläge wegen verspäteter Einreichung der Jahres-Steuererklärunqen für 1947 nicht zu erheben, wenn die Erklärungen bis zum 15. Juli 1948 beim Finanzamt eingereicht werden.	219:230	0:364
Einreichung	NN	1950	2	26120215_1950_04_12_01_218.tcf.xml-9-20	 	Unter dieser Überschrift beklagte sich Herr Karl Hampe aus Ragösen am 21. März darüber, daß drei Monalo nach der Einreichung seines Antrages auf Insulin-Ausgabe bei der Landesregierung in Potsdam immer noch keine Antwort von dort eingegangen sei.	113:124	0:246
Einreichung	NN	1950	2	26120215_1950_08_11_01_525.tcf.xml-93-8	 	Die Wähler erhalten die Stimmzettel Wahieebiete sind: Einreichung von Wahlvorschlägen und die (1)	54:65	0:97
Einreichung	NN	1847	1	heckert_schulgesetzgebung_1847-3253-37	 	Da nunmehr aber eine sehr lebhafte Theilnahme für denselben erwacht ist, und viele Behörden sich durch eine sehr zweckmäßige Behandlung desselben auszeichnen, so findet sich das Ministerium veranlaßt, sowohl in Absicht der Zeit der Einreichung als auch der Art der Einrichtung dieser Nachweisungen folgende Abänderung eintreten zu lassen: 1)	232:243	0:341
Einreichung	NN	1847	1	heckert_schulgesetzgebung_1847-658-25	 	6) Die Forderungen ordnungsmäßig concessionirter Privat-Schul-und Erziehungs-Anstalten an rückständigem, durch ihren Einrichtungsplan festgesetztem Schul-oder Pensionsgelde aus dem Zeitraume eines Jahres von Einreichung der Klage zurückgerechnet, dürfen im Wege des Mandatsprozesses eingeklagt werden.	208:219	0:301
Einreichung	NN	1950	2	26120215_1950_08_31_01_030.tcf.xml-2-24	 	Der Wahlleiter für die Wahlen zur Volkskammer, Dr. Steinhoff, fordert auf Grund des § 25 des Wahlgesetzes vom 9. August 1950 zur Einreichung von Wahlvorschlägen für die Wahlen zur Volkskammer der Deutschen Demokratischen Republik in Berlin am 15. Oktober auf.	129:140	0:259
Einreichung	NN	1958	2	26120215_1958_03_27_01_183.tcf.xml-95-8	 	Die SPD-Fraktion hat im Bonner Bundestag die Einreichung eines Gesetzentwurfes auf Volksbefragung gegen die Atomrüstung angekündigt.	45:56	0:132
Einreichung	NN	1950	2	26120215_1950_08_31_01_030.tcf.xml-6-2	 	Die zur Einreichung von WaifalvorscMägen berechtigten Vereinigungen haben das Recht, gemeinsame Wahlvorschläige einzubringen.	8:19	0:125
Einreichung	NN	1951	2	2532889X_1951-08-25_01_060.tcf.xml-21-28	 	Kommission nach einem ein*,-heltlichen, auf der Grundlage der • Bilanzierung aufgebauten Prinzip einschließlich der technischen Fragen der Planbearbeitung und der Terminstellung; ¦ 4. ¦ Einreichung von Verbesserungsvorschläaen und Kontrolle ihrer Auswertung — -einschließlich Kaderfragen.	186:197	0:288
Einreichung	NN	1950	2	2532889X_1950-03-23_01_056.tcf.xml-63-13	 	Jahre 1950 und der sich au » diesem Zeitpunkt ergebenden Termine für die Einreichung der' Vorschläge (§ 4 [ 1 ] und 8 5 [ 2 ]) erläßt der Ministerrat eine besondere Anordnung.	73:84	0:175
Einreichung	NN	1851	1	beseler_kommentar_1851-1392-43	 	Nachdem die landesherrliche Bestätigung der wegen Majestätsbeleidigung ergangenen Erkenntnisse durch die Verordnung vom 12. Septbr. 1841. (Gesetzs. S. 289.) aufgegeben worden, die landesherrliche Bestätigung anderer auf Freiheitsstrafe lautenden Kriminalurtel aber gleichfalls für fortgefallen zu erachten ist, seitdem die Einreichung solcher Erkenntnisse an den Justizminister aufgehoben worden; sind nur noch — abgesehen von den gegen Militairpersonen ergangenen Urtheilen (s.	323:334	0:478
Einreichung	NN	1880	1	laband_staatsrecht0301_1880-3509-3	 	Die Aufstellung und Einreichung von Listen dieser Offiziere gehört zu den jährlichen Mobilmachungs-Arbeiten.	20:31	0:108
Einreichung	NN	1951	2	2532889X_1951-11-18_01_030.tcf.xml-44-10	 	An dieser Stelle muß auch gesagt werden, daß die Einreichung von Unterlagen über die Atomwaffe oder andere Waffenarten zur Massenvernichtung, die die schrecklichsten und gefährlichsten Waffen sind,	49:60	0:197
Einreichung	NN	1950	2	2532889X_1950-08-10_01_148.tcf.xml-153-7	 	§ 27 Die in § 26 zur Einreichung von Wahlvorschlägen berechtigten Vereinigungen haben das Recht, gemeinsame Wahlvorschläge einzubringen, § 28 (1)	21:32	0:145
Einreichung	NN	1958	2	2532889X_1958-10-04_01_010.tcf.xml-4-7	 	Innenminister Maron, veröffentlicht nachstehende Aufforderung zur Einreichung von Wahlvorschlägen für die Wahlen zur Volkskammer:	66:77	0:129
Einreichung	NN	1848	1	nn_nrhz017_1848-379-25	 	Allein die Minister hatten doch vor der Volksmeinung zu große Furcht, weigerten sich deshalb, auf den königlichen Wunsch einzugehen und drohten andernfalls mit Einreichung ihres Entlassungsgesuchs.	160:171	0:197
Einreichung	NN	1847	1	heckert_schulgesetzgebung_1847-5682-6	 	1) Diejenigen, welche nach Einreichung einer lateinischen Dissertation, und nach einer förmlichen mündlichen Prüfung einer philosophischen Facultät einer inländischen Universität, die Doctor-oder Magisterwürde erhalten haben.	27:38	0:225
Einreichung	NN	1962	2	26120215_1962_02_24_01_028.tcf.xml-5-25	 	Im Produktionsaufgebot wurde in allen Zweigen der Industrie eine erhöhte Vorschlags-und Erfindertätigkeit erreicht 14,7 Prozent aller Beschäf-1 tigten der Industrie beteiligten sich an der Einreichung von Verbesserungsvorschlägen.	189:200	0:230
