lemma	pos	date	grouping	identifier	description	context	indexes_target_token	indexes_target_sentence
abgebrüht	ADJD	1864	1	brehm_thierleben01_1864-3282-21	 	Die Nahrung hat aber unter allen Umständen ihr Abschreckendes, zumal wenn die Jndianer dem Affen das Haar abgesengt oder ihn abgebrüht in den Topf gesteckt oder ihn zum Braten an einen spitzen Stab befestigt haben.	125:134	0:214
abgebrüht	ADJD	1879	1	davidis_kochbuch_1879-555-13	 	Zugleich kann man Reis, für jede Person ½ Eßlöffel voll gerechnet, abgebrüht, in abgeklärter Bouillon, wozu man so viel mehr Fleisch rechnen muß, gahr und dick kochen, doch müssen die Körner ganz bleiben.	67:76	0:204
abgebrüht	ADJD	1947	2	2532889X_1947-04-18_01_029.tcf.xml-13-1	 	Doch abgebrüht, wie er ist, will er auch weiterhin die sozialistische Arbeiterbewegung diskreditieren.	5:14	0:102
abgebrüht	ADJA	1953	2	26120215_1953_01_17_01_130.tcf.xml-2-60	 	Die Protestbewegung gegen den Replanten Mord an dem Ehepaar Rosenberg, der sich Millionen anständiger Menschen angeschlossen haben, hat die „Welt der Arbeit\", das Sprachrohr der rechten DGB-Führer, in ihrer Ausgabe vom 18. Januar zu einem „Bericht\" veranlaßt, der jedem ehrlichen westdeutschen Gewerkschafter die Schamröte ins Gesicht treibt Was nicht einmal die abgebrühtesten amerikanischen Zeltungen wagten, da Ethel und Julius Rosenberg konsequent Ihre Unschuld erklären, die „Welt der Arbeit\" schafft es: Sie lügt unverfroren, die Rosenberga „gestanden freiwillig ihren Verrat\".	363:377	0:583
abgebrüht	ADJA	1977	2	26120215_1977_04_09_01_064.tcf.xml-25-31	 	OHNE BESONDERES TATMO-TIV: Mit einer namhaften Besetzung und effektvollen szenischen Lösungen erzählt der französische Regisseur Philippe Labro die Geschichte eines Verbrechens, das selbst den mit der Aufklärung betrauten abgebrühten Kriminalisten letzte Illusionen über den moralischen Zustand der sogenannten „high society\" austreibt.	222:233	0:336
abgebrüht	ADJD	1849	1	davidis_kochbuch_1849-6071-10	 	Ein Pfund Catharinenpflaumen, oder gute Zwetschen, werden gut abgebrüht und in etwas Wasser so lange langsam gekocht, bis sich die Steine herausdrücken lassen, dann werden sie mit der Brühe, ½ Flasche weißem Wein, 12 Loth Zucker, Saft und Schale einer Zitrone in einem irdenen Töpfchen fest zugedeckt, ganz langsam weich gekocht.	62:71	0:329
abgebrüht	ADJA	1887	1	toennies_gemeinschaft_1887-2092-149	 	Auch stellt in einigem Maasse der (ob zwar zu grossem Theile blos den Phrasen nach) » wissenschaftliche « Unterricht, welchen die Jugend zumal der höheren d. i. der kapitalistischen Klassen durch Civilisation erhält, auf ihrer Seite als eine Art von Zwangsarbeit sich dar, wodurch leicht die besten Keime eigenthümlichen Geistes in ihnen verkrüppeln, ihr Gemüth erkältet und ihr Gewissen verhärtet wird; während doch dergleichen seiner eigentlichen Natur nach Musik und Gymnastik, d. h. eine harmonische Ausbildung des ganzen Menschen (des Leibes und der Seele) sein will, so ist oder wird es jene besondere und einseitige Erziehung des Gedächtnisses, welche zur Willkür gewandt macht, als zur bewussten Anwendung eingeprägter Regeln, und mit Worten, Sätzen, ja sogar Methoden auf mechanische Weise operiren lehrt; wie denn aber in der That solche gedrillte, gleichgültig-überlegene, abgebrühte Menschen in den meisten jener Beschäftigungen gefordert werden, oder doch am meisten brauchbar sind, welchen solche Jugend im Dienste der Gesellschaft oder des Staates (als der personificirten Gesellschaft) sich hinzugeben geneigt oder genöthigt ist.	884:894	0:1145
abgebrüht	ADJD	1956	2	2532889X_1956-06-24_01_161.tcf.xml-4-14	 	Allerdings darf das Gemüse nicht, wie es vielfach geschieht, vor der Zubereitung abgebrüht werden!	81:90	0:98
abgebrüht	ADJD	1849	1	davidis_kochbuch_1849-7327-6	 	Es wird eine Tasse Reis gut abgebrüht, mit einem Stück feinen Zimmet in einen irdenen Topf zu einem Maß kochendem Wasser gegeben, weich gekocht, ohne Rühren durch ein Sieb geschüttet und mit Zucker versüßt.	28:37	0:206
abgebrüht	ADJA	1955	2	2532889X_1955-12-25_01_118.tcf.xml-118-18	 	Irgendeine dumme Freude, in einer verfänglichen Lage einen guten Rat gefunden zu haben, stieg in dem abgebrühten Lagerkommandanten auf, und so machte er mit der sichersten Bewegung die Geste des Unteroffiziers nach.	101:112	0:215
abgebrüht	ADJA	1947	2	2532889X_1947-07-06_01_083.tcf.xml-23-39	 	Erwin Biegel als der fröhlich-melancholische Trinker, Franz Stein als Muriels Vater, Ilya Guenten als die um eigenes Familienglück 'betrogene „alte Jungfer\", Ulrich Hoffmann, der • smarte Studiosus, und Otto Matthies, der abgebrühte Kellner, schufen besonders lebensvolle Charakterstudlen.	222:232	0:289
abgebrüht	ADJA	1989	2	26120215_1989_04_28_01_171.tcf.xml-2-7	 	Nichts mehr von der Keckheit, dem abgebrühten Humor, der ihn in der ersten Nacht eils amüsiert, teils-befremdet hatte.	34:45	0:118
abgebrüht	ADJD	1961	2	2532889X_1961-02-05_01_049.tcf.xml-4-1	 	haft abgebrüht genug und darauf gedrillt, aus dem bundesdeutschen Schwarzbraun das unschuldige Weiß abendländischer Friedfertigkeit zu machen, Um also mit einer Folgerung zu beginnen: wenn schon diese Presse Alarm schlägt, dann müssen die Zustände in Schleswig-Holstein himmelschrei -	5:14	0:284
abgebrüht	ADJA	1971	2	26120215_1971_02_23_01_109.tcf.xml-10-13	 	Ich hatte bis zu diesem Augenblick eigentlich mich selbst immer für einen ziemlich abgebrühten Menschen gehalten, aber was Evertier jetzt bot, das war der Gipfel!	83:94	0:162
abgebrüht	ADJA	1963	2	2532889X_1963-03-21_01_008.tcf.xml-8-12	 	Das Blatt schreibt, „die Montagsvorstellung im Bundestag mußte selbst die abgebrühtesten Beobachter erschüttern\".	74:88	0:113
abgebrüht	ADJA	1949	2	2532889X_1949-02-24_01_063.tcf.xml-21-11	 	Liselotte Reimann macht aus der nach Leben haschenden Stella « In abgebrühtes wissendes Mädchen.	66:77	0:96
abgebrüht	ADJD	1849	1	davidis_kochbuch_1849-5896-7	 	Drei Viertelpfund Reis wird in Wasser gehörig abgebrüht, mit Milch langsam weich, aber recht steif gekocht; doch müssen die Körner ganz bleiben.	46:55	0:144
abgebrüht	ADJD	1849	1	davidis_kochbuch_1849-2221-8	 	Der Sago wird zwei Mal mit heißem Wasser abgebrüht, mit kaltem, weichem Wasser zu Feuer gebracht und mit einigen Zitronenscheiben weich gekocht, welches etwa 2 Stunden dauert.	41:50	0:175
abgebrüht	ADJD	1849	1	davidis_kochbuch_1849-3625-6	 	Ein halbes Pfund Reis wird gut abgebrüht, mit Bouillon, dem nöthigen Salz und mit Krebsbutter gahr und dick gekocht, zuletzt ein Glas Madeira durchgerührt.	31:40	0:155
abgebrüht	ADJA	1968	2	2532889X_1968-10-03_01_147.tcf.xml-5-30	 	Wir wünschen euch noch viel « kesse Blüten. und Wurzeln, tief im Boden dieser Zeit Ein guter Gag kann manchen Bock verhüten, und nicht einmal die scheinbar Abgebrühten sind auf die Dauer gegen Spott gefeit	156:167	0:205
abgebrüht	ADJD	1849	1	davidis_kochbuch_1849-3498-5	 	Unterdeß wird 1 Pfund Reis abgebrüht, in einem irdenen Geschirr mit reichlich 4 Maß Wasser und dem Pfunde Zucker 3 Stunden gekocht.	27:36	0:131
abgebrüht	ADJA	1990	2	2532889X_1990-08-03_01_044.tcf.xml-3-14	 	Was die Bonner Parteien und ihre ostlichen Ziehkinder gegenwärtig veranstalten, kann jedenfalls auch abgebrühten Naturen die Schamröte ins Gesicht treiben.	101:112	0:155
abgebrüht	ADJA	1879	1	davidis_kochbuch_1879-591-25	 	Es wird dazu ein fleischiges Stück genommen, wie oben ausgeschäumt, die Brühe durch ein Sieb gegossen und mit einem Stückchen frischer Butter und abgebrühtem Reis gahr gekocht.	146:157	0:176
abgebrüht	ADJA	1879	1	davidis_kochbuch_1879-597-37	 	Das Fleisch wird gewaschen, mit kochendem Wasser und nicht zu viel Salz aufs Feuer gebracht, abgeschäumt, ein Sellerieknöllchen, eine junge Kohlrabi, feingeschnittene Zwiebel, geschwitztes Mehl nach No. 7 und Perlgraupen oder abgebrühter Reis hinzugegeben, und, fest zugedeckt, langsam gekocht.	226:237	0:294
abgebrüht	ADJD	1849	1	davidis_kochbuch_1849-3453-8	 	Zehn Loth Sago wird, nachdem er behutsam abgebrüht ist, in Milch mit 6 Loth Zucker und Zitronenschale langsam gahr und ganz steif gekocht.	41:50	0:138
abgebrüht	ADJA	1952	2	26120215_1952_10_16_01_189.tcf.xml-12-3	 	Man muß diesen abgebrühten Gauner kennen, um zu wissen, daß ihm der Trick mit dem Konkurs prachtvoll gelingen wird.	15:26	0:115
abgebrüht	ADJD	1952	2	2532889X_1952-11-23_01_046.tcf.xml-15-17	 	Die Haßblicke der versammelten Arbeiter und ihre höhnischen Reden berührten ihn wenig, er war dagegen schon abgebrüht, und es kränkte ihn nicht mehr, wenn die Kumpel ihm ihre Verachtung offen zeigten.	108:117	0:200
abgebrüht	ADJA	1953	2	26120215_1953_05_27_01_094.tcf.xml-4-9	 	Oft nkbt man es. daß die Betrüger mit abgebrühter Frechheit vor den Schranken des Gerichts stehen und höhnisch bi richten, wie sie in Saus und Braus Gelebt haben und in welche dunklen Kanäle der westlichen Schieberwelt sie das, was der fleißige Arbeiter an der Wcrkbink schuf, gebracht haben.	38:49	0:292
abgebrüht	ADJA	1967	2	2532889X_1967-10-17_01_088.tcf.xml-28-5	 	Man spürt, wie selbst abgebrühte bürmerllche Journalisten bewegt werden.	22:32	0:72
abgebrüht	ADJA	1947	2	2532889X_1947-10-04_01_046.tcf.xml-35-9	 	„Schließlich blieben 1918 doch nur noch kleine Gruppen abgebrühter Burschen vorn, Leute, die meist schon ein paarmal verwundet waren.	55:66	0:133
abgebrüht	ADJA	1957	2	26120215_1957_03_12_01_174.tcf.xml-16-10	 	Falsche Kameradschaft bindet ihn anfänglich an die Gefährten und ihren abgebrühten Nazi-Zynismus.	71:82	0:97
abgebrüht	ADJD	1966	2	26120215_1966_11_11_01_073.tcf.xml-81-3	 	Pickler war gewiß abgebrüht, er riskierte viel, aber so bodenlos frech?	18:27	0:71
abgebrüht	ADJA	1957	2	26120215_1957_03_31_02_137.tcf.xml-25-41	 	„Hirschfeld ist immer von dritten Personen zu Notwehrhandlungen provoziert worden, und wenn er einmal zuschlug, stand er unter dem Einfluß des bösen Alkohols und handelte in sofortiger Erwiderung erlittener Beleidigungen'\", jodelte ein Rechtsanwalt, und selbst abgebrühte Gerichts -	261:271	0:282
abgebrüht	ADJA	1946	2	26120215_1946_11_05_01_038.tcf.xml-10-60	 	der Welt...\" — einen Blick nur für die, Mutter, für die Frauen und Mädchen ins Feldlazarett von Latatschino, dorthin, wohin sie so oft wimmernd, mit den letzten Atemzügen von jungen und alten Mannein vergeblich gerufen wurden und sie hätten alle Lügen durchschaut, mit denen dieser Krieg glorifiziert wurde!); die abgebrühten, mechanischen, unbeteiligten Handlangerdienste der Sanitatsdienstgrade, von denen alle Welt wußte, daß sie den Augenblick abpaßten, da die Schwerverletzten starben, um ihnen die Ringe, die Uhren und andere Habseligkeiten wegzunehmen; und wie die Tür sich immer wieder auftat, um neue Elendsfiguren einzulassen, während draußen, schon ganz in der Nähe, die russischen Maschinengewehre ihre Todesnahte steppten, auf allen Seiten und unaufhörlich und immer deutlicher; und wie sie den Verbrannten hereintrugen, der sich vor Schmerzen krümmte, und wie sie gleich danach die Bahre mit dem jungen Unteroffizier brachten, dessen Unterleib eine einzige breiige rote Fleischmasse war, und danach den Feldwebel, der kein Zeichen einer Verwundung aufwies und am Tisch saß, den Kopf in beide Hände gestützt und weinend um seine	314:325	0:1141
abgebrüht	ADJD	1849	1	davidis_kochbuch_1849-3745-3	 	Ist der Reis abgebrüht, setze man ihn nach vorhergehender Angabe zu Feuer, gebe, wenn er eine kleine Weile gekocht hat, ausgesuchte und gewaschene Rosinen dazu, so wie auch später Zucker und wenig Salz und lasse ihn gahr werden, aber nicht zerkochen.	13:22	0:250
abgebrüht	ADJA	1956	2	26120215_1956_08_05_02_318.tcf.xml-5-12	 	Und Flüche kannte die schwarze Dora, deren blumenreicher Inhalt selbst den abgebrühtesten Wüstenscheich auf sein Kamel und in die Flucht setrieben hätten.	75:89	0:154
abgebrüht	ADJA	1849	1	davidis_kochbuch_1849-3494-3	 	Ein Viertel Pfund abgebrühter Reis wird mit Milch, einem Stück Vanille und 8 Loth Zucker gahr und dick gekocht.	18:29	0:111
abgebrüht	ADJD	1879	1	davidis_kochbuch_1879-6739-7	 	Man nimmt ganz kleine Gurken, welche abgebrüht und gewaschen werden, reibt eine jede mit Salz ab und läßt sie 24 Stunden liegen.	37:46	0:128
abgebrüht	ADJD	1849	1	davidis_kochbuch_1849-3513-5	 	Ein halbes Pfund Sago wird abgebrüht, in Milch gahr und so steif gekocht, daß er sich vom Topfe ablös’t.	27:36	0:104
abgebrüht	ADJD	1956	2	2532889X_1956-02-05_01_105.tcf.xml-67-9	 	Jules: Aber Georges: Sie sind noch nicht abgebrüht genug, um die ganze Wahrheit vertragen zu können.	41:50	0:100
abgebrüht	ADJD	1879	1	davidis_kochbuch_1879-3870-3	 	Ist der Reis abgebrüht, so setze man ihn nach vorhergehender Angabe aufs Feuer und gebe, wenn er 1/4 Stunde gekocht hat, ausgesuchte und gewaschene Rosinen dazu und lasse ihn weich werden, aber nicht zerkochen.	13:22	0:210
abgebrüht	ADJD	1963	2	2532889X_1963-12-14_01_038.tcf.xml-22-3	 	Manche sind ganz abgebrüht, die machen dann montags frei.	17:26	0:57
abgebrüht	ADJD	1971	2	26120215_1971_11_02_01_173.tcf.xml-30-9	 	Mir war es auch gleichgültig, der ist so abgebrüht, der Harry, wenn sie den vorne hinausschmeißen, kommt der von hinten wieder herein.	41:50	0:134
abgebrüht	ADJA	1879	1	davidis_kochbuch_1879-3868-23	 	Wird spät im Frühjahr dies Gericht von Paradies-Aepfeln zubereitet, so lasse man sie zur Hälfte weich kochen und gebe dann erst den abgebrühten Reis hinzu.	132:143	0:155
abgebrüht	ADJD	1955	2	26120215_1955_10_16_02_013.tcf.xml-13-4	 	Billy Hopp war genügend abgebrüht, um diesen feindseligen Blicken standzuhalten.	24:33	0:80
abgebrüht	ADJA	1962	2	2532889X_1962-07-13_01_039.tcf.xml-23-13	 	Aber so naiv, wie das „Welf '-Geschrei klingt, ist das abgebrühte Schreiberkorps Springers wahrhaftig nicht.	55:65	0:108
abgebrüht	ADJD	1879	1	davidis_kochbuch_1879-3332-4	 	Nachdem der Reis gut abgebrüht, kocht man denselben mit Milch, Zucker und Zitronenschale langsam gahr und dick und rührt ihn mit 4 Eidottern ab.	21:30	0:144
abgebrüht	ADJD	1961	2	2532889X_1961-09-09_01_018.tcf.xml-5-12	 	*-' kapitalistischer Presseorgane, die IJ as mußten sogar die Vertreter gewiß abgebrüht und kaltschnäuzig genug sind, um menschliche Empfindungen nicht über ihren Auftrag und ihre Vorurteile triumphieren zu lassen.	78:87	0:214
abgebrüht	ADJD	1879	1	davidis_kochbuch_1879-7217-16	 	29. Ein ganz vorzügliches Getränk bei Diarrhöe und krankhaften Beschwerden. 1/2 Pfund bester Reis wird gut abgebrüht, mit 1/2 Unze ganzem Zimmet in einem irdenen Topf zu 1 3/4 Quart kochendem Wassers gegeben, bis zu 1 1/8 Quart eingekocht, ohne Rühren durch ein Sieb gegossen und mit oder ohne Zucker den Tag hindurch getrunken.	107:116	0:328
abgebrüht	ADJA	1849	1	davidis_kochbuch_1849-4797-34	 	Hat man die Gans nach A. No. 3 zum Braten vorgerichtet, füllt man den Leib mit in 4 Theile geschnittenen Aepfeln, unter welche man nach Belieben Rosinen oder Corinthen, oder auch abgebrühte Pflaumen mischen kann.	179:189	0:212
abgebrüht	ADJD	1886	1	rein_japan02_1886-2847-26	 	Nachdem man dieselben ausgegraben hat, werden sie von den Fasern und andern Anhängseln befreit und sorgfältig abgewaschen, darauf rasch in kochendem Wasser oder Wasserdampf abgebrüht, so dass sie nachher auf dem Querschnitt braungelb und gallertartig aussehen.	173:182	0:260
abgebrüht	ADJD	1957	2	26120215_1957_10_30_01_131.tcf.xml-30-19	 	Er als Merkur ironisiert immerzu seinen göttlichen Vorgesetzten; sie als Leda Ironisiert — zwar ihrerseits liebeshungrig, aber abgebrüht die betuliche Alkmene.	127:136	0:159
abgebrüht	ADJD	1956	2	26120215_1956_05_16_01_186.tcf.xml-64-5	 	Die Lore Schacht war so abgebrüht, sich aus all dem nichts zu machen.	24:33	0:69
abgebrüht	ADJD	1965	2	26120215_1965_04_07_01_070.tcf.xml-3-5	 	Der Einbrecher icar allerdings nicht abgebrüht, sondern — stocktaub.	37:46	0:68
abgebrüht	ADJA	1959	2	26120215_1959_09_03_01_190.tcf.xml-12-7	 	Krckodilslränen — dieses treffende Bild hätten die abgebrühten Kriegshetzer vielleicht noch „geschluckt\".	51:62	0:105
abgebrüht	ADJD	1879	1	davidis_kochbuch_1879-2994-18	 	Die Flossen werden, so weit die Außenseite geht, abgeschnitten, Füße und Bauchplatte in kochendem Wasser abgebrüht, wodurch die Haut schuppenweise abgezogen werden kann.	105:114	0:169
abgebrüht	ADJD	1879	1	davidis_kochbuch_1879-3696-8	 	36. Pfannkuchen von dickgekochtem Reis. 1/2 Pfund abgebrühter, in Milch mit einem Stückchen Butter, einigen Stücken Zimmet oder Zitronenschale, 1/4 Pfund Rosinen (welche etwas später dazu kommen) und etwas Salz weich und dick gekochter Reis, 4 Eier, 2–3 Eßlöffel Zucker, etwas gestoßener Zwieback oder geriebenes Weißbrod.	50:61	0:322
abgebrüht	ADJA	1986	2	26120215_1986_04_05_01_040.tcf.xml-9-17	 	Der staatseigene Sender „Radio Südafrika\" erklärte, der Geistliche habe damit eine Position von „abgebrühter Dummheit\" eingenommen.	97:108	0:131
abgebrüht	ADJA	1963	2	2532889X_1963-07-12_01_026.tcf.xml-7-13	 	„Hat die Bundesregierung das nötig?\", so hörte man selbst abgebrühte Korrespondenten westlicher Zeitungen sich fragen.	58:68	0:118
abgebrüht	ADJA	1948	2	2532889X_1948-12-23_01_078.tcf.xml-2-92	 	Unter -dem Motto „Eine Hand wäscht die andere krempelte ein unappetitlicher Schwarzmarktjunglinß sein ausgefranstes rechtes Hosenbein hoch und offerierte einem „Kollegen\", dem die Ware ausgegangen war. aus seinen „sauberen\" Socken zwei Camel-Päckchen und vier Schokoladenstreifen, -Sicher ist sicher\", aaste sich der andere Schncllgerichtsaspirant und praktizierte die Sachen, naeh dem Begebenen Beispiel zwischen Strumpf und Unterhose Bezahlte, ohne zu handeln, unter Brüdern mit Rabatt versteht sich, und verdrückte sich mit dein unschuldigsten Gesiehf, wie es nur ein abgebrühter Ganove aufsetzen kann.	571:582	0:605
abgebrüht	ADJA	1849	1	davidis_kochbuch_1849-2062-61	 	Nachdem es gut gewaschen, mit Wasser und Salz rein ausgeschäumt, gibt man die Brühe nach Verlauf von einer starken halben Stunde durch ein Sieb, schwitzt wie in No. 2, Mehl in Butter, schüttet die Kalbfleischbrühe vom Bodensatz langsam hinzu, gibt eine Petersilien-und einige Scorzoner-Wurzeln dazu, so wie ½ Stunde vor dem Anrichten abgebrühten Reis, und kocht die Suppe langsam, fest zugedeckt, gahr.	334:345	0:402
abgebrüht	ADJD	1963	2	26120215_1963_12_08_01_177.tcf.xml-15-13	 	doch da er stets Kredit bezieht. verbringt er frech, froh, abgebrüht ein ausgeborgtes Leben	59:68	0:91
abgebrüht	ADJA	1958	2	2532889X_1958-05-24_01_026.tcf.xml-56-15	 	Er ist der Häuptling jener zehn Verbrecher, über dersn besonders abscheuliche Untaten sogar die abgebrühten Berichterstatter westlicher Zeitungen entsetzt sind.	96:107	0:160
abgebrüht	ADJD	1879	1	davidis_kochbuch_1879-5545-9	 	Die Pflaumen werden in heißem Wasser abgewaschen, Zwetschen abgebrüht (siehe Compotes), und in wenig Wasser so lange langsam gekocht, bis sich die Steige herausdrücken lassen.	60:69	0:175
abgebrüht	ADJA	1951	2	26120215_1951_10_12_01_036.tcf.xml-5-14	 	Diese gelehrte Dame dem Doktortitel führte die Tagung einem Höhepunkt, über den selbst abgebrühten Geisterbeschwörer staun-Sie berichtete nämlich, daß sie mit dorn Geist des berüchtigten Obernazis Ernst Rohm unterhalten habe. dieser Geist habe ihr erzählt, daß sich Hitler drüben nicht etwa im Paradies, sonin der wirklichen feurigen Hölle befinde!	87:98	0:348
abgebrüht	ADJA	1972	2	26120215_1972_05_07_01_184.tcf.xml-27-21	 	Dies jedoch nicht aus böser Absicht, und so sagte ich ihm denn auch, daß ich kein Feird. kein abgebrühter Kollaborateur und kein Ultra wäre.	94:105	0:140
abgebrüht	ADJA	1985	2	2532889X_1985-01-10_01_081.tcf.xml-5-20	 	Tatsächlich hat der Neuzugang von 136000 BRD-Bürgern zum stehenden Heer von nunmehr rund vier Millionen registrierter und nichtregistrierter Arbeitsloser auch abgebrühte Pessimisten schockiert Das gilt nicht zuletzt für die Zunahme der Dauerarbeitslosigkeit mit ihren bitteren sozialen Folgen.	159:169	0:293
abgebrüht	ADJD	1961	2	26120215_1961_12_24_01_483.tcf.xml-31-38	 	Man nahm sie zu Suppen und Saucen, die außerdem noch vielfach mit Rahm und Eiern legiert wurden, man kochte mit ihnen Getreideprodukte und gab sie an alle Gemüse, die vorher aber blanchiert, das heißt abgebrüht oder abgekocht oder restlos ausgewässert wurden.	201:210	0:259
abgebrüht	ADJD	1957	2	2532889X_1957-02-17_01_113.tcf.xml-35-17	 	Getreideprodukte und gibt sie an alle Gemüse, die vorher aber „blanchieret\", das heißt abgebrüht oder abgekocht oder restlos ausgewässert werden.	87:96	0:145
abgebrüht	ADJA	1956	2	2532889X_1956-06-24_01_051.tcf.xml-2-21	 	Dieser Akt war mit Sicherheit vorauszusehen, und doch hat er einiges Erstaunen ausgelöst; denn für so borniert hatten selbst abgebrühte westdeutsche Journalisten die Bonner Regierung nicht gehalten.	125:135	0:198
abgebrüht	ADJA	1879	1	davidis_kochbuch_1879-2333-32	 	Hat man die Gans nach I. zum Braten vorgerichtet, so füllt man den Leib mit in 4 Theile geschnittenen Aepfeln, welche man auch mit Rosinen oder Korinthen oder mit getrockneten abgebrühten Zwetschen vermischen kann.	176:187	0:214
abgebrüht	ADJD	1948	2	26120215_1948_02_08_01_248.tcf.xml-15-1	 	Erschreckend abgebrüht und frühreif schauen diese jungen Mädel drein; ihre Zuge zeigen eine berechnende Gier, alles in sich aufzunehmen, was die Musik, die Körpernähe des Mannes, die Schnapsgläser und des Partners Brieftasche herzugeben vermögen.	13:22	0:246
abgebrüht	ADJA	1953	2	26120215_1953_06_10_01_018.tcf.xml-131-19	 	In der Besuchszelle, wo diese » Treffen stattfindet, wollen die Wachtet und Wächterinnen von Sinc-Sing, gewiß abgebrühte Leute, keinen Dienst verrichten •— die Szene ist zu grausam.	110:120	0:181
abgebrüht	ADJA	1961	2	2532889X_1961-08-25_01_112.tcf.xml-31-1	 	Der abgebrühte Salvatorelli (ein bürgerlicher italienischer Journalist ND) protestiert mit Schaum vor dem Mund gegen die „Einseitigkeit\" der in Berlin getroffenen Maßnahmen.	4:14	0:173
abgebrüht	ADJA	1961	2	2532889X_1961-09-16_01_007.tcf.xml-137-11	 	Es gibt die unterschiedlichsten Angaben iiber Startplatz und Flugroute, Besonders abgebrühte Lügner erzählen Märchen von einem ominösen Funkleitstrahl, auf dem die Maschinen „möglicherweise In den Osten gelockt\" wurden.	82:92	0:219
abgebrüht	ADJA	1989	2	26120215_1989_12_16_01_134.tcf.xml-25-23	 	Bogart gelang dann immer wieder das Kunststück, durch die verschiedenen Charaktere seine Persönlichkeit durchschimmern zu lassen und so die unverwechselbare Figur eines abgebrühten individualistischen Abenteurers zu formen, mit einem Anhauch von Idealismus hinter der rauhen Fassade, ein Philosoph im Trenchcoat.	169:180	0:312
abgebrüht	ADJA	1963	2	26120215_1963_02_10_01_145.tcf.xml-31-23	 	Der da hinterm Lenkrad, das war nicht mehr der liebenswürdige Dagobert, das war ein finsterer Herr mit dem harten Blick eines abgebrühten Schellfisches.	126:137	0:152
abgebrüht	ADJA	1969	2	2532889X_1969-06-05_01_127.tcf.xml-12-17	 	Die Kämpfe um Macht und Einfluß spielen sich nicht nur zwischen den ganz Großen ab, den abgebrühten und vor nichts zurückschreckenden Managern.	88:99	0:143
abgebrüht	ADJD	1879	1	davidis_kochbuch_1879-3146-3	 	Der Reis wird abgebrüht, in Milch mit etwas ganzem Zimmet und Zitronenschale langsam gahr und steif, nicht breiig gekocht.	14:23	0:122
abgebrüht	ADJA	1849	1	davidis_kochbuch_1849-3584-11	 	Man kocht nach der Größe der Form ½ — ¾ Pfund abgebrühten Reis mit Milch und einem Stück frischer Butter gahr, aber nicht zu weich, rührt den nöthigen Zucker, sowie das von 4—6 Eiern zu steifem Schaum geschlagene Weiße durch.	46:57	0:225
abgebrüht	ADJA	1956	2	26120215_1956_02_05_02_127.tcf.xml-12-3	 	Aber so etwas Abgebrühtes und Charakterloses konnte ich mir nicht vorstellen.	14:25	0:77
abgebrüht	ADJD	1948	2	2532889X_1948-05-06_01_089.tcf.xml-53-11	 	„Ich bin, ich kann es nicht leutmen, einigermaßen abgebrüht. was Zechprellerei und ähnlicha faule Tricks angeht.	50:59	0:112
abgebrüht	ADJA	1879	1	davidis_kochbuch_1879-583-65	 	Nachdem es gut gewaschen, in Wasser und Salz abgeschäumt, gibt man die Brühe nach Verlauf von einer halben Stunde durch ein Sieb, schwitzt wie in No. 7 etwas Mehl in die Butter, gießt die Kalbfleischbrühe vom Bodensatz langsam hinzu, gibt eine Petersilienwurzel, auch, wenn man sie hat, einige Scorzonern hinein, sowie 1 Stunde vor dem Anrichten abgebrühten Reis.	346:357	0:363
abgebrüht	ADJA	1950	2	26120215_1950_04_07_01_018.tcf.xml-3-23	 	Bis hierher haben die Autoräder Asphalt gesehen, aber jetzt wühlen sie » ich in ein Schlammbad, da « anno 1600 den abgebrühtesten Postillon In Angstschweiß gebracht hätte.	115:129	0:171
abgebrüht	ADJD	1879	1	davidis_kochbuch_1879-520-49	 	Wenn die Bouillon zu einem Gesellschaftsessen recht kräftig gekocht wird und mehrere Gerichte folgen, so ist es üblich, sie klar zu geben mit Wurzelwerk und Klößchen; im übrigen thut man besser, die Suppe mit Perlgraupen oder Reis zu binden; der Reis muß aber gut abgebrüht werden.	264:273	0:281
abgebrüht	ADJD	1967	2	26120215_1967_06_28_01_098.tcf.xml-46-9	 	„Entweder ist der Mann ein großer Schauspieler oder abgebrüht wie kaum einer.	52:61	0:77
abgebrüht	ADJD	1956	2	26120215_1956_08_01_01_176.tcf.xml-23-35	 	Wie so etwas auf uns Schauspieler — besonders auf die in Berlin tätiLen — wirkte, davon kann man sich heute keinen Begriff mehr machen Mit drr Zeit wurden auch wir fjeRuniibcr diesen Erscheinunzen immer abgebrühter.	203:214	0:215
abgebrüht	ADJD	1879	1	davidis_kochbuch_1879-6112-25	 	No. 3. 4 Eigelb, 1 große saftige Zitrone, ¾ Tasse Zucker, 1 Soda-Cracker, fein gerollt, mit 1½ Tasse kochendem Wasser abgebrüht, Zucker, Eigelb, abgeriebene Schale und Saft der Zitrone hinzugedrückt, auf den Pie gegossen und gebacken.	118:127	0:234
