lemma	pos	date	grouping	identifier	description	context	indexes_target_token	indexes_target_sentence
vegetation	nan	1901	2	bib11653838_19011213_147024_50_0003_alto.xml-157-16	 	Man förskräckes, då man först inkommer i denna arkipelag, som synes så utan all vegetation.	80:90	0:91
vegetation	nan	1823	1	bib11653828_18230211_144028_34_0002_alto.xml-3-1	 	som Vegetation antyda en yngre formation än den gamla kontinenten.	4:14	0:66
vegetation	nan	1830	1	bib11653823_18300510_144010_106_0001_alto.xml-5-30	 	Under hela denna mänad har wäderleken warit owanligt regnig, ända tills bönan af denna mecka, dä torr och warm luft inträffat, till mycken förmon för den börjande vegetationen, soln torde hastigt fortgä, viii delina wäderlck fortfar.	163:175	0:233
vegetation	nan	1896	2	bib19227291_18961121_145289_141_0003_alto.xml-116-21	 	Tills vidare gäller det blott att utforska öknen systematiskt för att finna de trakter, der det nu finns vatten och vegetation, och i det afseendet har man blifvit mycket öfverraskad af ivad man redan funnit; men man har all anledning att vänta sig större öfverraskningar.	116:126	0:272
vegetation	nan	1830	1	bib19277277_18300505_147682_102_0001_alto.xml-9-14	 	med kylig luft, har denne nu anragit en blidare temperatur, sein fortffynbar vegetationen.	77:89	0:90
vegetation	nan	1816	1	bib11653828_18161116_144028_268_0001_alto.xml-3-66	 	der har konsten ersatt Naturen * * •) ’), ’),.6 * 18 Benrangel (örn nian sä sär säga) har ester hand blifwit betäckt med iL fot djup Swartmylla, tillkommen af förmultnade leniningar af Djur, Märter och Mine » raner; men wore än denna mylla djupare, sä kunde den ändä icke ästadkomma en » vackrare vegetation, än som nu finnes pä St. Helena.	297:307	0:340
vegetation	nan	1826	1	bib19227291_18260125_145289_4_0001_alto.xml-0-57	 	December: K-jsar Alexander hade pä sin äter- de- Här önstar jag fä tillbringa mina sista dagar, resa frän Tagsnrog genom Krim, i trakten af Se- i händelse jag lemnar frän mig Regeringen\", bastopol, sä beundrat yppigheten ock skönheten i Med dessa tankar ingick han i ett nära derwid be- denna sydliga Vegetation och det pittoreska i be- läget Munktloster, der han qwarblef, under lagenheten, att han, med den honom i sista stun- en andägtig sinnesstämning, öfwer en timmas tid.	301:311	0:477
vegetation	nan	1811	1	bib11653828_18110716_144028_162_0003_alto.xml-2-13	 	i tira mälla ter, ha fira pä flera orter förstört nästan att vegetation.	61:71	0:72
vegetation	nan	1895	2	bib15650814_18950330_146365_76_0001_alto.xml-64-8	 	Så komma de till fastlandet med sin rika vegetation: träd af tusentals arter, blommor i tu-	41:51	0:91
vegetation	nan	1895	2	bib15760600_18950720_146401_85_0003_alto.xml-244-10	 	Stigar och gångar voro öfvervuxna med mossa och ogräs; vegetationen var rik i sin vilda prakt.	55:67	0:94
vegetation	nan	1821	1	bib11653828_18210529_144028_124_0002_alto.xml-9-11	 	seglar, och intet spär af lif, intet tecken till vegetation, sörminssadc hennes melanchoU&gt; 7a utseende.	49:59	0:106
vegetation	nan	1823	1	bib11653823_18230121_144010_16_0007_alto.xml-4-36	 	seli, uti dan b ' r igaste iordmcn; Hö 170 till Loa last; Betet tillräckligt; Skog och Timmer till husbehof; mycken täckt; stor Trädgärd med förmonstg be« ägenh-t och tidig vegetation; Byggningarne utsöraS p ‘: en större Trädbyggnius, gammal men i gsdt P » ', in ' ehällande Sal och 7 Rum.	173:183	0:289
vegetation	nan	1903	2	bib11653811_19030925_145317_148_0002_alto.xml-49-14	 	Ett stycke söder örn Boigholms slottsruin, på det vidsträckta, af en rik vegetation utmärkta område, sorn sakta sluttar ned mot Kalmarsund, är man i färd med att uppföra en bostad åt kronprinsessan.	73:83	0:198
vegetation	nan	1821	1	bib11653828_18211022_144028_247_0001_alto.xml-5-10	 	ett ymnigt regn har ncdströmmat och klädt fälten med en vegetation, som gör att ma n!	56:66	0:85
vegetation	nan	1897	2	bib11653830_18970218_146968_14_0003_alto.xml-154-17	 	Växtligheten var så ovanligt rik därnere, yppig, färgrik och omväxlande — lifligt påminnande om söderns vegetation.	104:114	0:115
vegetation	nan	1895	2	bib19277180_18951205_147374_99_0002_alto.xml-27-7	 	solrika sommar drifwer fram hela denna stiftande vegetation till en samtidig blomstring!	49:59	0:88
vegetation	nan	1895	2	bib19227462_18951017_147640_242_0003_alto.xml-119-66	 	derför ej tänka sig något svårare misstag, än då man hör en jordbrukare yttra, att med anledning af de svåra tiderna måste han afstå ifrån eller minska användandet af köpta gödningsämnen, ty detta innebär att ej längre använda de medel, sorn m * ra än någonting annat på en i ordentlig kultur varande jord tillförsäkrar örn en god skörd äfven under för vegetationen mindre gynsamma förhållan den, eftersom den väl gödslade åkerns förmåga att under dessa ändock gifva en nöj aktig skörd är ojemförligt mycket större än dea magra jordens.	353:365	0:536
vegetation	nan	1825	1	bib19277346_18250115_147394_2_0003_alto.xml-7-0	 	vegetationen utbredde sig i att dess futthet öfwrr hans trädgärd.	0:12	0:65
vegetation	nan	1830	1	bib11653828_18300301_144028_49_0002_alto.xml-9-32	 	De longitudinella vext-regionerna (Zerne magis longitadinales) lägås äfven i betraktande från Lappland, hvarifrån fjellen längst Norrska gränsen, insjö-regionen lill Dalarna, oell Hafskust-regionen få sina skiljda rå-märken ur vegetationens geografi.	227:240	0:250
vegetation	nan	1895	2	bib11653830_18950814_146968_92_0002_alto.xml-2-20	 	Universitetets rektor prof. Fries höll derefter ett längre, intressant och lärorikt föredrag örn“ menniskans inflytande på vårt lands vegetation.	134:144	0:145
vegetation	nan	1826	1	bib11653823_18260714_144010_160_0002_alto.xml-4-21	 	Den allmänna torka och betta, som, allt sedan Maj månads början, oafbrutet förqwäfl och utrotat en del af vegetationen och till brädmognaS framstörtat en annan, har bidragit att öka de flcrestäkrS i Länet uppkomna 0lyckor, fom haft sin upprinnelse i owarfam ward af eiden.	106:118	0:272
vegetation	nan	1895	2	bib15873371_18951030_145112_296_0003_alto.xml-67-8	 	landskap, der allt naturens lif, all vegetation, all grönska bortsvedts af storindustrialismen.	37:47	0:95
vegetation	nan	1830	1	bib11653828_18300219_144028_41_0002_alto.xml-2-20	 	afsattsen till en liten, med kullar omgifveti kitlelformig dal, sorn, skyddad för vinden, med aili vackra vegetation erbjuder en ganska vänlig anblick.	106:116	0:151
vegetation	nan	1821	1	bib11653828_18210529_144028_124_0007_alto.xml-5-6	 	iiifif, lockande genom en yppig vegetation, en sund luft, och de klaraste bäckar, ned » störtande ifrSu höga berg.	32:42	0:114
vegetation	nan	1825	1	bib19227291_18251109_145289_45_0002_alto.xml-2-38	 	Professor Nilsson Säustapet underrättelsen om en ung Alligator, funnen lefwande i en back, nära Helsingborg, och Professor Agardh nya observationer öfwer saftens crrcnlation hos & lt; Lhars, samt de dermed i sammanhang stående Vegetations fenomener.	227:238	0:249
vegetation	nan	1818	1	bib11653825_18180606_145134_65_0002_alto.xml-0-13	 	Pä högkändtare ställen, som icke lidit af wat * tufloden, ar vegetationen o-vanligt stark, och lofwar en god fädes- och mnflörd.	61:73	0:128
vegetation	nan	1827	1	bib11653828_18270605_144028_128_0003_alto.xml-11-10	 	sam framkallat en, för denna ärstid owanligt yppig, vegetation, lockar naturligtwis hwarje stadsbo hellre ut i den fria ' luften, än inom murarnas stängsel och gwalm.	52:62	0:166
vegetation	nan	1901	2	bib11653838_19010816_147024_33_0002_alto.xml-68-0	 	vegetationen medtagen, någon riktigt hel skugga finnes ingenstädes och det är sorgligt stora, bruna fläckar öfverallt i grönskan, dock mindre än man skulle förmoda på ett så högt och utsatt läge.	0:12	0:195
vegetation	nan	1903	2	bib11653790_19030522_12541_39_0004_alto.xml-116-38	 	Under hvarje balfklots vår bildar sig en hvit slöja, hufvudsakligen bestående af moln men äfven delvis af snö, rundt polen, och omkring den visar sig ett mörkt band, som man antager vara vatten och vegetation, m kallas till lif af fuktigheten.	198:208	0:243
vegetation	nan	1897	2	bib11653830_18970823_146968_67_0001_alto.xml-67-12	 	nedåt och det blef allt mer och mer sydländskt: landskap och vegetation.	61:71	0:72
vegetation	nan	1828	1	bib19277277_18280221_147682_44_0001_alto.xml-25-0	 	Vegetationen stäk, i det hela taget, 1 det stöuaste flor, och.	0:12	0:62
vegetation	nan	1895	2	bib15760690_18951010_145050_156_0003_alto.xml-32-34	 	bildade pä bekostnad af de i de under jordlagren samlade magnesium-, kalium- koch natrium-) sulfaterna, hwilka i torr wäderlek af kapillärkraften med wattnet sugas lill jordytan och dersiäves göra jorden för vegetationen oduglig.	208:220	0:229
vegetation	nan	1895	2	bib11653830_18950422_146968_46_0004_alto.xml-36-10	 	för öfrigt icke utseende af någon torr sandslätt utan all vegetation, såsom vår fantasi föreställt sig den.	58:68	0:107
vegetation	nan	1895	2	bib19227462_18951122_147640_273_0003_alto.xml-185-21	 	äfven vid så låg temperatur är i högre grad fuktig och ej ombytes ofta, filmer man på köttets yta riktiga vegetationer af bakterier, mögelsvampar och dylikt; köttet blir, om det förvaras Änge, unket oell kännes liksom slemmigt på ytan.	106:118	0:235
vegetation	nan	1830	1	bib11653823_18300128_144010_22_0002_alto.xml-11-15	 	fstglm- har ön säkerligen att tacka stör de fe ri la spä ren till ben vegetation, fr-m lin förstönar henne.\"	70:80	0:108
vegetation	nan	1822	1	bib13506739_18221211_144030_289_0005_alto.xml-14-25	 	Hö 170 till 200 last; Betet tillräckligt; Skog och Timmer till husbehof; mycket löftäckt; stor Trädgärd med firmänlig belägenhet och tidig vegetation.	139:149	0:150
vegetation	nan	1825	1	bib11653823_18250704_144010_150_0003_alto.xml-14-6	 	Aore-nen är bekant för en yppig vegetation, srngtbar tordmon, en oä Idag wärling & gt; af fiskrika matten, bördiga statler, stogskladda högber och berg, b emaria än nied wackra löfträd, än med moget byggnadsmirke; den är tillika känd för hälsosam lnst och best innemänare tor ett måttligt och arbetsfamt lefnadssätt samt tor en särdeles färdighet i stöld, och qwinnvrua äga en » imärki sticklighet imid BofiapSstokfel, span - och mäfnad.	32:42	0:437
vegetation	nan	1898	2	bib11653811_18980611_145317_88_0002_alto.xml-73-5	 	dvergris kunde intet spår af vegetation upptäckas, om man ej dertill ville räkna en på vestra sidan sig utbredande förrädisk gräsmatta, hvilken betäckte en sumpmark.	29:39	0:165
vegetation	nan	1804	1	bib11653828_18040911_144028_211_0002_alto.xml-2-23	 	... re ivar för Sällskapet sä myckel mer wigligt, som, enligt andra Hushållarcs uppgifter, kalkens nyttjande ival i början pädrifwcr vegetationen, men ett ben sedermera likasom igenom en öwer spänning uttömmer åkerns must och fetma, och att den sedan behöfwer s » mycket mer gödning om ben stall fortfara ali wara bärande.	133:145	0:322
