lemma	pos	date	grouping	identifier	description	context	indexes_target_token	indexes_target_sentence
vegetation	nan	1829	1	bib15650837_18290930_146391_78_0001_alto.xml-9-47	 	^farande regn har ingifwit det mest oroande bekymkfwer wärsadens inbergande: ännu star den pä, stallen grön och pä andra äter ssuren och nära vorad; och ett lika underwerk af torka behöswes som, kort efter midsommar, ett wälgörande regn dåde och undersamt beredde vegetationen och skinide wära sarhägor för misiwert, onl den ej här i ort nu mera ssall wara gifwen.	264:276	0:364
vegetation	nan	1795	1	bib19225792_17950314_147359_11_0001_alto.xml-0-57	 	cT^irän medlet af October til medlet af May är sot » dea, rusen och b graswcn i snö: mänga djur för * ändra dä färgen och biiswa hwitå; under denna lid ar ganska farligt at resa, emedan man har exempel til öfweiflöd at mänga bliswik sördärfwade af kölden » Icke Deg mindre är vegetation otroligt snäll sS snart solen kan nedkasta sina upliswande strälar, Faktoristerne som sä uti medlet af Junis mänav, kunna inom kort lid störda.	276:286	0:430
vegetation	nan	1897	2	bib11653815_18971122_146944_135_0003_alto.xml-104-27	 	Från Sierrao går vägen ned till Sacramento, Californiens nufvudstad, genom en ful och ödslig trakt, der solen midt på sommaren obarmhertigt sveder bort hvarje vegetation.	159:169	0:170
vegetation	nan	1830	1	bib13506739_18300603_144030_125_0001_alto.xml-1-33	 	för 8rstiden owanligt kylig luft, och som landtmannen ansett för största för » man i miftcnde till 8rswexten, tyckas med dagen sol och sommartid wil&gt; a 8terkomma; imellertid har vegetationen med en förmanande hastighet sortskyndat i de sednare daaarne, och lofwar allt godt.	181:193	0:277
vegetation	nan	1900	2	bib11653790_19000706_145648_53_0002_alto.xml-62-56	 	vackraste och blomrikaste tid är det ock förtjusande här uppe, och på alla möjliga språk hör man här dagen om orden: » förtjusande », skönt », » vackert » o. s. v. Den rika och feta svartmyllan på berget frambringar den rikligaste växtlighet, och man kommer att tänka på Kinnekulles beryktade vegetation, då man går på Skansen under det herrliga löf verket och blickar kring på markens blommor och gräs.	293:303	0:403
vegetation	nan	1898	2	bib11653830_18980307_146968_19_0002_alto.xml-47-33	 	Man skulle kunna säga, att, då hos Nan sen den hårda graniten ligger uppe i dagen, år den hos Hedin höljd af ett älskvärdt och humoristiskt gemyts blomstrande och leende vegetation.	170:180	0:181
vegetation	nan	1895	2	bib19277277_18950623_147683_168_0002_alto.xml-109-2	 	med rik vegetation, inklämd mellan ett par klippor, hvilken fordom tjenade skansens bosättning till begrafningsplats, — många af dem slumra der i iorden, söfda af vågornas lätta Blag mot stranden.	8:18	0:196
vegetation	nan	1896	2	bib19277301_18960827_145146_70_0002_alto.xml-138-5	 	för swamparna tjenliga wäderleken är vegetationen Yppig, och swampwännec kunna göra en mycket god störd.	37:49	0:104
vegetation	nan	1895	2	bib19225758_18950809_144022_183_0001_alto.xml-22-48	 	Jag kallade trädgården för en lustgård, och jag är ej rädd för att tillägga hvilket superlativt epitet, ni behagar; ty jag trotsar er att visa mig maken, om jag nämligen tar hänsyn till både belägenhet och vegetation på en gång, Hvad nu denna vegetation angår, så är den fullkomligt sydländsk, till så väl art som frodighet, och när jag går där om aftnarne, då månens stora rödgula klot står bakom S:t Olof, under det orkesterns toner ljuda från paviljongen, ackompagDerade af vågornas taktmässiga slag mot lummig strand, så tycker jag nästan jag fått uppfylld min varma längtan » Till ett fjärran land i söder ».	243:253	0:613
vegetation	nan	1827	1	bib11653828_18270718_144028_165_0004_alto.xml-5-19	 	mecka, dä bläst och regn utmärkte hwarje dag, war den likmäl troligen en wäl » gerning för vegetationen, sam derigenom nägot upplifwatö efter den längwariga torrkans förhärjningar. '	91:103	0:182
vegetation	nan	1895	2	bib19227462_18950831_147640_202_0004_alto.xml-100-5	 	Människans Inflytande på vårt lands vegetation, före drag vid öppnande af sommarkurserna i Uppsala af Professor Th. M.	36:46	0:118
vegetation	nan	1895	2	bib19225758_18950308_144022_57_0002_alto.xml-216-22	 	var mycket angenämt och lärorikt att under det snön låg metershög utanför vandra där inne i dessa växthus, hvarest den yppigaste vegetation var till finnandes.	129:139	0:159
vegetation	nan	1895	2	bib15975090_18950509_148377_55_0003_alto.xml-98-6	 	bördiga jorden klädt sig i yppig vegetation, kan dock äfven slätten ha sina behag, ehuru aldrig jemförliga med trefnaden i Nordskånes leende nejder, men om vintern är den afskräekande, enformig och dyster.	33:43	0:205
vegetation	nan	1830	1	bib11653828_18300302_144028_50_0001_alto.xml-3-9	 	Han erinrar härvid örn verkan af befolkningen äfven på vegetationen eller vext-ökningen; ehuru man icke lärer tå lemna ur sigte, alt den största vextrikhet träffas på en bättre jordmån, och under andra gynnande omständigheter, hvilka naturligtvis förmått menniskan att företrä^ desvis inkräkta flen, och således föröka sig i antal, bredevid jördens ömnigare alster.	55:67	0:365
vegetation	nan	1828	1	bib19227306_18280603_147700_23_0003_alto.xml-3-13	 	Nu- asssär man stengeln, (lär sönder buteljen och finner har ett vegetationens fenomen: en Hparrisstengel af nära ett stäipunds wigt, skapad som ett nystan och sä mör som den allrabästa as » maa wäxt°.	65:78	0:201
vegetation	nan	1895	2	bib15650835_18951112_146472_95_0002_alto.xml-45-5	 	alla händelser wisar sig fjelltrakternas vegetation i allmänhet särdeles förmånlig som kreatursfoder, och wärt Norrland eger i detta afseende en särskild styrka genom bergarternas rikedom pä sosfatförande mineraler och genom hela vegetativnens samtidiga mognande.	41:51	0:263
vegetation	nan	1895	2	bib19277180_18950530_147374_44_0003_alto.xml-63-10	 	En skarp köld råder i hela öfre Italion, och vegetationen har tagit stor skada.	45:57	0:79
vegetation	nan	1895	2	bib15650835_18950305_146472_19_0004_alto.xml-125-22	 	ut sill roll; det flyter på Mars mycket långsamt, segt, oell sjöarna blefvo väldiga sumpland, hvari en stark vegetation snabbt utvecklade sig, hvarigenom den mörka färge » försvann.	109:119	0:181
vegetation	nan	1895	2	bib15760600_18951017_146401_123_0002_alto.xml-177-65	 	Man kan därför ej tänka sig något svårare misstag, än då man bör en jordbrukare yttra, att med anledning af de svåra tiderna måste han afstå ifrån eller minska användandet af köpta gödningsämnen, tv detta innebär att ej längre använda de medel som mera än någonting annat på en i ordentlig kultur varande jord tillförsäkrar om en god skörd äfven under för vegetationer mindre gynsamma förhållanden, efter som den väl gödslade åkerns förmåga att under dessa ändock gifva en nöjaktig skörd är ojämförligt mycket större än den magra jordens.	356:368	0:538
vegetation	nan	1809	1	bib11653806_18090117_145120_9_0001_alto.xml-3-7	 	„Alt Salker äro i allmänhet skadliga för vegetationen, och att, da man unVantar nngra & gt; vaxt-arter, som triswas naturlizen i saltsjön eller pä dcst stränder, alla förn^Haa mer eiler mindre fort, nar de wattnas med saltsjöwatken, eller nar man sätter dem i en jord impregnerad med salt, är g«nom ätstillige Naturforffares rön och försik längesedan bckant.	41:53	0:358
vegetation	nan	1899	2	bib11653790_18990516_145648_37_0002_alto.xml-91-41	 	söder begränsades af sjön Fisken, mot öster af en betydlig höjdsträckning, mot norr af en genom sitt sänka läge för byggnadsverksamhet otjänlig trakt och mot vester af en århundraden igenom af kopparrök från Falu grufva förbränd och för all vegetation oemottaglig ödemark, hänvisade det behof af väsentligt ökad tillgång på byggnadstomter, som redan inom den närmaste tiden komme att på ett kännbart sätt göra sig gällande, staden att för stadsplanens utvidgning söka förvärfva mark från den sydost om staden belägna kungsgården Noret.	241:251	0:535
vegetation	nan	1829	1	bib11653828_18290812_144028_184_0001_alto.xml-8-31	 	hängde sig strålarne af denna morgonrodnad på Schreckhorns *) och Jungfuns *) hjessor, och deras skimmer uppfångades af dessa ishafs omätliga spegel; vintern derofvanföre, der all vegetation är utdöd, tyckes uppeldas af dem.	180:190	0:224
vegetation	nan	1824	1	bib11653828_18240805_144028_179_0003_alto.xml-9-8	 	af Hr G:s uppgifter: 1:0 Gea det vegetation pä manens yta.	33:43	0:58
vegetation	nan	1895	2	bib15761097_18950427_145020_50_0006_alto.xml-90-8	 	Väl anlagda gångar slingra sig här bland en vegetation, som en botanisk trädgård med fog kan vara stolt öfver.	44:54	0:110
vegetation	nan	1895	2	bib19225758_18950514_144022_111_0003_alto.xml-228-16	 	Spanmålsmarknaden » Af berättelserna från utlandet framgår, att väderleksförhållandena hittills varit mycket gynnsamma för ali vegetation.	127:137	0:138
vegetation	nan	1807	1	bib11653828_18070915_144028_213_0003_alto.xml-3-30	 	Sä ostukibar denna ö synes wara, sä förflaggad och förbrännd kustens nedra del werkligen är, wisa likwal de inre ock högre lrakterne i det hela en gansta yppig vegetation; och o ' ktadt den stenbundna marken, regnbristen o. s. w. gifwes källste ingen fläck pä jorden, sä tjenlig för alla climaters produkter.	160:170	0:308
vegetation	nan	1895	2	bib15873371_18950516_145112_132_0002_alto.xml-95-13	 	föreningens assistent, B. Tolf, att egna de norrländska mossarna och vegetationen, i synnerhet i de nordligare landsdelarna, särskildt studium.	69:81	0:143
vegetation	nan	1895	2	bib15873371_18950831_145112_237_0004_alto.xml-15-0	 	Vegetationen har i skärgården blifvit rätt illa medfaren af den starka vestliga blåsten på sista tiden.	0:12	0:103
vegetation	nan	1816	1	bib11653828_18160802_144028_177_0001_alto.xml-3-16	 	Gom Spaluarernr fstke mycket högre wärde pä Hoptis Guld och Siifwergiufwor, än pä betz yppiga vegetation, fä hände det, att hela folkmängden blek ' innan torr för » störd genom öfwerdrifwek strängt arbete t grufworna.	94:104	0:217
vegetation	nan	1815	1	bib11653828_18150919_144028_217_0001_alto.xml-10-40	 	von * jafm trodde fig hafwa märkt, att mänfaiten wid foten af bergen emot flutet ak d-st dag ante lo en annan colorit, likasom stulle solsträlarne, rmder don twä weckyrS länga dagen, dufwa framlockat en ny vegetation.	206:216	0:217
vegetation	nan	1895	2	bib15760600_18951017_146401_123_0004_alto.xml-50-26	 	ridå, framställande ett yppigt tropiskt landskap, och i hörnen funnos djärft upptornade klippor med magiskt upplysta grottor, plaskande vattenfall och en förtrollande rik vegetation.	171:181	0:182
vegetation	nan	1895	2	bib19277277_18950808_147683_213_0006_alto.xml-184-12	 	som sir James Ross beskref såsom fullkomligt utan växtlif, fann man vegetation på klipporna 30 fot öfver bafsytan.	68:78	0:114
vegetation	nan	1807	1	bib11653828_18070609_144028_130_0003_alto.xml-7-5	 	Den har icke spär as vegetation, utan är betäckt med mutzlor zch	21:31	0:64
vegetation	nan	1816	1	bib11653828_18161116_144028_268_0001_alto.xml-4-12	 	mesta be, ', ä af lera, prydas est lika vegetation; men den aftager i dalarna, ju närmare man kommer ned till Hafivet Ofta ser man pä ett träd blommor, omogen och mogen frukt pa en gäng.	40:50	0:186
vegetation	nan	1830	1	bib11653828_18300302_144028_50_0002_alto.xml-0-24	 	Författaren meddelar härefter en uppställning af vexterne, efter Ordines Naturales, öfver hvilka en tabell är utförd nied jemförelse af Skånska och Lappska vegetationen.	156:168	0:169
vegetation	nan	1895	2	bib19277277_18950512_147683_128_0002_alto.xml-171-34	 	Nedanför ligger det gamla, trånga Trastevere med hela flaggkartor af tvättkläder uthängda till torkning på balkonger och i fönster, vid Tibern syns ännu ett stycke af de måleriska stränderna orördt med frodig vegetation på sluttningarna, och skuggorna nere i gränderna bli saftigt bruna med glödande reflexer på gula murar efter solgasset på mu ren midt emot.	209:219	0:359
vegetation	nan	1896	2	bib15873936_18961110_147385_131_0004_alto.xml-32-22	 	Det skulle ännu dröja en timme, innan solen ginge ned, och de vandrade genom den vackra omgifningen knädjupt i yppig vegetation.	117:127	0:128
vegetation	nan	1825	1	bib11653828_18251203_144028_281_0004_alto.xml-18-11	 	ken gräs eller mossa, men derutom träffar man den yppigaste vegetation.	60:70	0:71
vegetation	nan	1830	1	bib11653828_18300302_144028_50_0001_alto.xml-4-10	 	en annan sida, går mycket utrymme för flen vilda vegetationen förloradt genom markens uppodling till säd och fodervexter.	49:61	0:121
vegetation	nan	1895	2	bib15978012_18950315_148361_63_0002_alto.xml-8-29	 	intet annat än nakna klippor och torra, öde stepper, betäckta med intet annat än runda stenar och röd sand och en halft förtorkad, låg, buskartad vegetation.	146:156	0:157
vegetation	nan	1895	2	bib19277180_18951205_147374_99_0002_alto.xml-30-30	 	wisar fia fjelltrakternas vegetation i allmänhet särdeles förmånlig som kreatursfoder, och wärl Norrland eger i detta afseende en särflild styrka genom bergarternas rikedom pä fosfatsörande mineralier och genom hela vegetationens samtidiga mognande.	216:229	0:249
vegetation	nan	1896	2	bib11653815_18961104_146944_88_0002_alto.xml-58-31	 	Hvad belägenheten angår, så torde den vara den vackraste och bästa man kan tänka sig, hvartill kommer att mångå af villatomterna ega en mångårig, yppig och väl vårdad vegetation.	167:177	0:178
vegetation	nan	1903	2	bib11653811_19030704_145317_101_0003_alto.xml-72-0	 	Vegetationen försvann inom deras oräkneliga käkar, och i dess ställe var den afmejade jorden betäckt af deras spillning, Hvarje grässtrå, hvarje planta och frukt, säden, som mognande för so len stod redo att löna odlarens möda, allt hade i en blink försvunnit, förtärdt af glupska små odjur, som i miljoners mil joner fladdrade i luften och rörde sig på jorden.	0:12	0:361
vegetation	nan	1827	1	bib11653823_18270626_144010_146_0001_alto.xml-12-42	 	Ofwcrallt i Länet har Kornsadden blifwit i börjair af denna mecka slutad, och brädden är redan pä de flesta ställen synlig, hwilkct härrör till någon del af tidig roar och en för denna årstid uti orten omanlig wärma samt för vegetationen i öfrigt gynnande wäderiek.	225:237	0:265
vegetation	nan	1895	2	bib19227291_18950813_145289_96_0002_alto.xml-43-18	 	Fries höll ett längre, intressant oen lärorikt t öredrag örn menn i skans inflytande på vårt lands vegetation.	99:109	0:110
vegetation	nan	1830	1	bib11653828_18300302_144028_50_0001_alto.xml-6-24	 	att inbyggarnes antal, fastän i början af denna uppställning 5 gånger större än vexternas, likväl aftager i ett mycket hastigare förhållande än vegetationen.	144:156	0:157
vegetation	nan	1811	1	bib11653806_18110827_145120_99_0002_alto.xml-3-75	 	är delta synbart i distr.ctet Tenochtitmn, som wid Spmjprernes ankomst och dä sslarne intogo större widd samt ofta nied bs&gt; ver » swämningar wattnade land t&gt; war mycket grön » och fruktbärande.. En stor del af Nya Spanien är likrväl att räkna bland de frodigaste länder pä Ior » » em Sluttningen af Lordiller K 11 utsatt för fuktiga windar och ttcken, sorn ästadkom » ma en flön och stark vegetation, men äro till ka stadliga för nykomlingars helst,, tyst Mdcr Tropikerne är Euftitw ohclsosamhct v & *	395:405	0:507
vegetation	nan	1820	1	bib11653806_18200216_145120_19_0002_alto.xml-10-72	 	fullstäudiahcl dcstrifna försök att, enligt der, anwisning, som finnes i Acadrmieus Annaler igi g, sednare häftet, bränna ofruktbar Leralf (icke matjord cllkcr märgckakf) för att såsom gödnings-amne anwäudas, star Äcademicu utfart gme Pris as lika storlek och egeustcw nied de sts:uä.unde Prisen; och böra bestrifningarue örn dessa försök tiilira inuehälla en berättelse, huru leran blifwit anwäns, och burn den iverkat pä vegetationen, tili hwars utrönande fordras, att ben brända alfwén, fout nyttjas till försöket, sorgfälligt skiljes frän astan af det bränsle, - söm blifrvit anwändr.	423:435	0:588
vegetation	nan	1899	2	bib11653811_18991111_145317_174_0002_alto.xml-65-25	 	Sockerbetsodlingen borde kunna bli en industri för orten, synnerligast som Karlshamns sockerfabrik inköpt stora, sträckor » betjord » i den för sin sydländska vegetation bekanta Mörbylångabygden på Öland oell der i likbet nied förhållandet i Degerhamn ämnar anordna betvåg och måhända äfven inom en snar framtid ett — sockerbruk.	159:169	0:329
vegetation	nan	1810	1	bib11653828_18100908_144028_210_0001_alto.xml-2-29	 	här delar sia i flere grenar, pa hwilkas wattenspegcl solsträlarne äterstudfa, och bildar en präktig o: denna ö liggande utbredd för evra ögon med sin frodiga vegetation, beklädd med en oandligt omwaxlande grön tapet och bestuggad af en otalig mängd trän & lt; if alla slag och stapnadcr, ibland hwilka höjer sig stolt den hwitå poppeln, sam ar sä allmän pa denna kust, att man egenteligen kunde kalla ben Rhoneträdet.	159:169	0:418
vegetation	nan	1827	1	bib19277277_18270711_147682_159_0001_alto.xml-9-19	 	Frän Götheborg underrättas wi alt en sorglig stillhet räder i ha noel n, hwarcmot ett ymnigt regn upplifwat vegetationen, sä att landet lcswar öswerflöd af ålit.	108:120	0:161
vegetation	nan	1899	2	bib11653811_18990410_145317_53_0003_alto.xml-51-16	 	öar är i hög grad pittoresk, Guernesey är klippig, men bär ändock en sydländsk vegetation, under det att Jersey, den större ön, öfver allt erbjuder den yppigaste växtlighet, understödd af den mest intensiva kultur, så att på denna ö af trädgårdar ända till tio skördar örn året kunna uppnås.	79:89	0:291
vegetation	nan	1829	1	bib15650837_18290603_146391_44_0001_alto.xml-12-23	 	af mänaden fortfarande starka solwarme om dagarna, som omwexlat med mer och mindre markbara nattfroster, ^ har wisat menlig werkan pä vegetationen i allmänhetmen synnerligest pä höstsädet.	134:146	0:188
vegetation	nan	1821	1	bib11653828_18210629_144028_149_0002_alto.xml-2-7	 	floder nordmarks, ingenstädes saknades byggnadSwirke; vegetationen war rik lill och mod pä okanda - växter; sä mäl djuren sein wäxtcrna moro frodiga; endast de fä & gt; n-	54:66	0:171
vegetation	nan	1895	2	bib15650814_18950606_146365_130_0003_alto.xml-34-12	 	Är 1868 publicerade d:r Meyer sitt arbete » Undersökning af de adenoida vegetationerna i gommen och deras behandling ».	72:86	0:119
vegetation	nan	1897	2	bib11653811_18970821_145317_128_0003_alto.xml-84-16	 	banan i stark lutning nedåt och det blef allt mer och mer sydländskt i landskap och vegetation.	84:94	0:95
vegetation	nan	1896	2	bib19277301_18960629_145146_52_0003_alto.xml-60-22	 	betäckt mcd is ben 10 d:s, men fullt isfritt dagen derpå; och efter tre dagars nästan tropist hetta » visade vegetation, ett sydlänflt sommarlandflap i Qwickjock-dalen, omgifwen af h » oita fjelltoppar, häfvande gamla namnet\" Lapplands paradis\".	109:119	0:245
vegetation	nan	1895	2	bib15650837_18950601_146391_126_0002_alto.xml-136-23	 	» Hvad jag härute »; — skrifver han om sitt besök & Djurgården — » måste missunna Stockholm, var den fylliga vegetationen, de höga, lefrik » träden med tunga kronor.	109:121	0:165
vegetation	nan	1826	1	bib13506739_18261213_144030_279_0001_alto.xml-16-2	 	Winstockarnes ntomordeytliga vegetation har på del hela warit stadltg för frukten.	29:39	0:82
vegetation	nan	1825	1	bib19223423_18250209_145063_11_0001_alto.xml-5-45	 	Den z Moj, wid soluppgängen, klar » nade himmelen; de swarta töcken, hwilka nägra dagarS tid oupphörligt inskränkt fon » kretsen, ffingrade sig; och med enS wifads sig den herrliga Otaheiti, i hela den ri« ka och praktfulla vegetation, som Naturen i rikaste mätt utgjutit öfwer denna förtjusan # It b.	224:234	0:301
vegetation	nan	1895	2	bib15650835_18950426_146472_37_0002_alto.xml-53-20	 	snabba utweckling häntyda pä jordarternas goda beskaffenhet och det fördelaktiga inflytande, som floderna och de kringliggande^ bergshöjderna utöfwa pä vegetationen i dalgängarna.	152:164	0:179
vegetation	nan	1899	2	bib11653811_18990524_145317_77_0003_alto.xml-36-23	 	Mången föreställer sig väl » Fällan », som slätten i dagligt tal benämnes, som en stor sandslätt, utan spår af vegetation; men så är ingalunda fallet, den bär tvärtom en präktig gräsmatta, fastän naturligtvis på sina ställen illa åtgången.	111:121	0:239
vegetation	nan	1830	1	bib15650837_18300609_146391_46_0001_alto.xml-9-34	 	Den irona naturen ar nu isin fägring, och, it jusi soln man önskade det, inträffade sedan i förrsigarS ett sakta regn, som förherrligar den och allt » mer nopli sivar vegetationen.	167:179	0:180
vegetation	nan	1811	1	bib19225772_18110723_148004_81_0002_alto.xml-1-13	 	— En 2 mänaders fortfarande torka och rölmänaosheka har nastan alldeles förstört all vegetation i flera trakter af Ungern Pä stora landsträckor är allt förtorkadt.	85:95	0:163
vegetation	nan	1825	1	bib11653823_18250531_144010_122_0002_alto.xml-7-5	 	* 4) Anmärkningar Sswer vegetationen pä de högsta bergen ock be plantör, som välla stg siere Sr under snön, af Ramond.	24:36	0:118
vegetation	nan	1828	1	bib11653828_18280517_144028_113_0004_alto.xml-4-1	 	drak vegetationen » men den numera inträffade wackra wäderleken eksätter förlusten, och en enda nalle regn kan herrligt fruktbargSra wäk i alla hänseenden bördiga jordmän.	5:17	0:171
vegetation	nan	1830	1	bib13506739_18300607_144030_128_0001_alto.xml-7-15	 	--- Wäderleken, som hela förra manaden wari: kall och regnig, har hejdat vegetationen i de^fart; nägra starks frostnätter hafwa äfwen infunnit sig; det oaktadt är Rägen i allmänhet mycket lofwande och pä siere ställen betndligt försigkommen.	73:85	0:241
vegetation	nan	1895	2	bib19225758_18950529_144022_123_0005_alto.xml-125-3	 	den i full vegetation i en välskött trädgård i Sköfde, lämna ett annat utlåtande.	11:21	0:81
vegetation	nan	1895	2	bib15761097_18950921_145020_112_0005_alto.xml-49-5	 	Människans Inflytande på vårt lands vegetation af Professor Th. M.	36:46	0:66
vegetation	nan	1902	2	bib11653811_19020723_145317_110_0003_alto.xml-13-3	 	iblifva klipporna och vegetationen i dalsänkorna är mindre yppig.	22:34	0:65
vegetation	nan	1895	2	bib15978012_18951017_148361_242_0004_alto.xml-60-66	 	Man kan därför ej tänka sig något svårare misstag, än då man hör en jordbrukare yttre, att med anledning af de svåra tiderna måste han afstå ifrån eller minska användandet af köpta gödningsämnen, ty detta innebär att ej längre använda de medel, som mera än någonting annat på en i ordentlig kultur varande jord tillförsäkrar örn en god skörd äfven under för vegetationen mindre gynsamma förhållanden, efter som den väl gödslade åkerns förmåga att under dessa ändock gifva en nöjaktig skörd är ojämförligt mycket större än den magra jordens.	358:370	0:540
vegetation	nan	1819	1	bib19225772_18191005_148004_114_0002_alto.xml-11-9	 	föl staffa de ljuset en finare paffage och befordra vegetationen pä planeterne m. Et » Mayn, d.	52:64	0:95
vegetation	nan	1895	2	bib15760690_18951023_145050_163_0003_alto.xml-98-1	 	sör vegetationen mindre gynsamma förhällanden, efter som den wäl gödslade åkerns förmåga att under dessa ändock giswa en nöjaktig flörd är ojemförligt mycket större än den magra jordens.	4:16	0:186
vegetation	nan	1827	1	bib19277277_18270820_147682_193_0001_alto.xml-23-15	 	terna, emot kusterna dkifne hafis, hwarigenom hela landets klimat blifwit mindre godt för vegetationen.	90:102	0:103
vegetation	nan	1903	2	bib11653838_19030807_147024_32_0004_alto.xml-132-13	 	Strax intill, under sjalfva berget, visade sig en typisk bild af vegetationens sega men hopplösa kamp mot dödens makter: rätt vackra äldre träd växte där, men icke ett enda yngre, det var liksom örn den aflelsens och förnyelsens kraft hvaraf eljest hela naturen sväller, som oftast i rent af slösande rikedom, här hade alldeles utsinat.	65:78	0:336
vegetation	nan	1895	2	bib11653836_18950510_147011_19_0004_alto.xml-74-28	 	En skildring lyder sålunda: ” På en resa genom södra delen af Britiska Guyana gjorde min förare mig uppmärksam på en liten plats midt i en yppig vegetation.	145:155	0:156
vegetation	nan	1830	1	bib11653828_18301021_144028_244_0001_alto.xml-4-20	 	den redan närmar sig de snöbetäckta fjällar — ne, så visar den, det oaktadt, en temligen kraftig vegetation, hvilken emedlertid en betydlig mängd insekter har ali tacka för deras tillvaro, bland hvilka också Annas mångå egna kör denna trakt.	97:107	0:241
vegetation	nan	1830	1	bib11653828_18301122_144028_271_0002_alto.xml-0-10	 	landsträckornas kalkartade eller granithaltiga jordmån är mindre gynnande för deras vegetation, hvarföre de här stå mera isolerade och blandade med Catingas eller på vissa tider bladlösa skogar.	84:94	0:194
vegetation	nan	1903	2	bib11653811_19030822_145317_129_0003_alto.xml-26-15	 	I följd af sitt härliga klimat och sin underbara natur, som bjuder på söderns vegetation och yppighet, på samma gång som nordens is och snö, har Interlaken kommit att genomgå en liknande historia som så många andra af Schweiz ’ städer.	78:88	0:235
vegetation	nan	1829	1	bib11653823_18291110_0_261_0002_alto.xml-9-1	 	Äfwen vegetationen; slutligen ser man endast kostnad torr mosta och e » mängd uttorrkade nedfallna träd.	6:18	0:104
