lemma	pos	date	grouping	identifier	description	context	indexes_target_token	indexes_target_sentence
vegetation	nan	1827	1	bib19277277_18270517_147682_114_0001_alto.xml-10-7	 	Wi hafwa haft wackra wärdagar-och ett för vegetationen gynnande wäder hcrrstar nu.	42:54	0:82
vegetation	nan	1824	1	bib11653828_18240524_144028_119_0004_alto.xml-10-20	 	net blir han klar derigenom, att sw.ifwelfyran förenar sig med jordrartiklarne, och nu dödar wattnet Marne, tillintetgör vegetationen och uppfräter stenarne, som ligga pä flodens botten.	121:133	0:186
vegetation	nan	1829	1	bib11653828_18290527_144028_121_0002_alto.xml-11-21	 	Kolonien har fatt till skänks en stor landsträcka, och hennes subsistens är betryggad genom en fruktbar mark och en kraftig vegetation.	124:134	0:135
vegetation	nan	1822	1	bib11653823_18220720_144010_166_0001_alto.xml-0-15	 	Under refan norrut, wid medlet af Ju » ii, fann jag, att vegetationen i allmänhet blifwit hämmad och att wärsädet pä mänga ställen hade lidit af den torra, kalla och stormiga wäderleken, som länge herrssat; Men den warma sominarluften, som infann sig midfominarsafton och sedan fortfarit, har förbättrat utsigten med en förundranswärd ha?	57:69	0:338
vegetation	nan	1895	2	bib15650835_18950903_146472_74_0002_alto.xml-101-9	 	Oväfwe, fosforsyra och kali äro nödwändiga för all vegetation ware sig pä fast mark eller mulljord.	51:61	0:99
vegetation	nan	1827	1	bib19277277_18270726_147682_172_0001_alto.xml-14-7	 	Wädcrleken har hittills warit allmänneligen god för vegetationen och alla sädcsflag läfwa en rik fförd.	52:64	0:103
vegetation	nan	1896	2	bib15975090_18960903_148377_110_0004_alto.xml-34-62	 	sjelf se Norrbotten, dess tjusande, imponerande natur i en luft så ren och stärkande, man skall lära känna dess enkla och efterblifna men härdiga ooh ordentliga befolkning, och man skall kasta en blick ned i bergskungens guldmättade rike, man skall sjelf öfvertyga sig örn jättekrafterna i forsar och fall, och man skall beundra den sydländskt yppiga vegetationen — då törst börjar mari förstå, att i benämningen Sveriges framtidsland“ ligga de rikaste löften och den fullaste sanning.	351:363	0:485
vegetation	nan	1828	1	bib19277277_18280821_147682_194_0001_alto.xml-10-29	 	inognad med kämpakraft och knappt torde Nägon erinra sig ott, som nu, wid denna lid fullmoget Korn och Häste redan funnits styladt här i trakten, hwarest vegetationen wanfigen fortskrider längsammare än annorstädes.	154:166	0:215
vegetation	nan	1809	1	bib11653806_18090117_145120_9_0002_alto.xml-3-30	 	^ Det sker icke, som man skulle förmoda / pä del sätlet, all del formerar nya föreningar (combinaifons) t jorden, som göra henne otjenlig för vegetationen; eller alt det förändrar safterne som wäxten drager ur jorden till sin näring.	142:154	0:233
vegetation	nan	1899	2	bib11653811_18990102_145317_1_0003_alto.xml-131-4	 	Genom denna starkt hopväfda vegetation måste vi nu hugga och bryta en ränna, som de skjutna flodhästarne kunde flyta i, tills vi Ängö dem så nära land, att vi kunde räcka dem med våra sammanfogade vagnskettingar och sedan begagna oss af oxkraft för att få dem upp på land.	28:38	0:272
vegetation	nan	1828	1	bib19277277_18280607_147682_131_0001_alto.xml-15-13	 	Nu afstär nian stängeln, stär sönder buteljen, och finner har ett vegetationens fenomen: en sparrissiengfel af nara ett stälpiinds wigt, stapat som ett nystan och fä mör som den alldrabästa af denna wept.	66:79	0:204
vegetation	nan	1895	2	bib15650814_18950418_146365_90_0001_alto.xml-58-8	 	Må vara att denna milda luft och tropiska vegetation tvingar en att erkänna och njuta af söderns skönhet, det är dock säkert, att man gärna önskar sig tillbaka till den kalla, friska norden, till den trefliga brasan, medan snöstormen piskar rutorna utanför.	42:52	0:257
vegetation	nan	1830	1	bib11653828_18300605_144028_127_0001_alto.xml-11-32	 	Ibland Hinduernas religiösa lester är dea till Guri, öfverflödets Gudinna, den märkvärdigaste; den Arås under vårnattjemningen, vid hvilken jorden under den tropiska hinden är smyckad med den yppigaste vegetations öf-	202:213	0:217
vegetation	nan	1830	1	bib19277277_18300608_147682_129_0001_alto.xml-5-7	 	marit kall och regnig, har hejdat vegetationen i fin fart; n8gra starka frostnätter hafwa äfmen infunnit flg; det oaktadt är R8gcn i allmänhet-mycket & gt; 8fmande och p8 flere ställen betydligt försigkommen.	34:46	0:208
vegetation	nan	1830	1	bib19277277_18300603_147682_125_0001_alto.xml-14-34	 	stö na nar lirén är mi i sin fägring; och, just svin man önffade •bet, in ira stade sedan i förrgårs ett fatta regn, som förherrligar ben och alltmer uppliswar vegetationen.	160:172	0:173
vegetation	nan	1805	1	bib19225772_18051112_148004_130_0004_alto.xml-0-13	 	frän silö och gleischerivaltnel som ax olje,, ligt för all flags vegetation.	65:75	0:76
vegetation	nan	1895	2	bib19225758_18950216_144022_40_0005_alto.xml-68-9	 	af växtligheten, mén ställvis framkallar den ock en vegetation, som ger skydd mot samma hetta; och äfven öknarnes i allmänhet jämna terräng, oaserna, de kringboende folkens kännedom om vägar och färdsätt m. m.	52:62	0:209
vegetation	nan	1895	2	bib19277277_18951103_147683_300_0003_alto.xml-162-5	 	Tyvärr räcker dock denna yppiga vegetation ej så långt.	32:42	0:55
vegetation	nan	1895	2	bib11653790_18950712_145648_29_0003_alto.xml-56-16	 	socknen får man se klöfverfält så täta och höga, att de påminna om södra Sveriges vegetation under bördiga år.	82:92	0:110
vegetation	nan	1895	2	bib19225758_18950907_144022_208_0007_alto.xml-31-0	 	Vegetationen är naturligtvis här i sin högsta frodighet, och detta okar i hög grad svårigheten att röra sig.	0:12	0:108
vegetation	nan	1828	1	bib11653828_18280513_144028_110_0003_alto.xml-3-3	 	ner här ett vegetationens fenomen: en fparrisstengel af nära ett stälpunds w Zj! » flapad som ett nystan och sä mör som den allrabästa af denua wcxt.	12:25	0:149
vegetation	nan	1895	2	bib15975087_18950805_145596_119_0001_alto.xml-25-8	 	Allting är tropiskt — himmel och jord, vegetation och produkter.	39:49	0:64
vegetation	nan	1820	1	bib11653806_18200829_145120_96_0002_alto.xml-4-42	 	Landet togs, pä manligt satt, 1 ' brsitttung, ä Hans Sror-Britanniffa Maj:rs wägner, och fick namn af VZya Södra Shetland éthnafft war tempereradt; stränderne wörö bergige och, efter allt utseende, obebodde, rilen saknade icke vegetation, ty pä mänga skallen wäxtc grall och furuträd; i det hela liknade landet mycket Norrsta kusten.	227:237	0:333
vegetation	nan	1815	1	bib11653828_18150919_144028_217_0001_alto.xml-8-12	 	fropp!ör öst, emedan märt haf och wär dunkla rller af vegetation betäckta mark ej sa starkt reflecterar ljuset, att sädant more möjligt.	54:64	0:136
vegetation	nan	1895	2	bib19225758_18951111_144022_263_0002_alto.xml-87-25	 	Intressanta äro de också, dessa bärg, delvis sönder8tyckade i vilda toppar, delvis med utpräglad platånatur, skoglösa, men med en rik vegetation af egendomliga, för mig mestadels okända växter, bland hvilka jag dock kände igen några gamla bekanta frän Europas trädgårdar.	134:144	0:271
vegetation	nan	1903	2	bib11653811_19030704_145317_101_0003_alto.xml-68-13	 	hopade i klungor likt röda dammoln, äro talrika nog för att tillintetgöra vegetationen i ett distrikt, under det att stamtruppen högt uppe i luften sträcker nt som en oändlig skärm mellan solen och jorden.	74:86	0:205
vegetation	nan	1830	1	bib11653823_18300729_144010_172_0001_alto.xml-7-31	 	^ edan jellin sommarwärma infunnit sig, sch wäderleken äfwen warit torr under en westås tid, ehuru ben mi äter blifwit regnaktig, hafwa utsigterna för wärfädsgrödan mycket förbättrats och vegetationen i allmänhet wunnit kraftig utweckling, dock minst potatoes-wcxten, emedan stor del af utsädet ruttnat i jorden.	188:200	0:312
vegetation	nan	1811	1	bib19225772_18110712_148004_77_0001_alto.xml-16-7	 	Debrezin ser man ej spär af någon vegetation, blott wiiitersrukterne stä stöna och	34:44	0:82
vegetation	nan	1896	2	bib15869824_18961219_145700_101_0002_alto.xml-203-33	 	ändamål sådant vatten, som flutit blott genom hed- och sandtrakter, all den stund det icke medför några gödslande beståndsdelar, men väl mycket garf- och gallussyra, hvilka verka skadligt på vegetationen och framkalla halfgräs.	191:203	0:227
vegetation	nan	1812	1	bib11653828_18121216_144028_293_0003_alto.xml-10-66	 	hafwen äro oumbärliga till jordens beständ, i det dunster uppstiga genom solwär, man utur kem, hwilka antingen genom moln fukta jorden och göra henne skicklig till wäxtcrs frambringande, eller sönjccka sig wid kalla bergstoppar, bilda källor o » ch strömmar, sä tyckas vik cometcrne wara bestämda till alt igenom sina utdunstningar och förtjockake ängar crsälta del watten, som genom vegetation och förruttnelse bllfwit dra » get ifrän hafmet och förwandladt till en torr jord; ty alla vegetabilier ha siw » sin wäxt » drift helt och hället af poatmet, och sedan förwandlaS de genom förrMtnelfe till största delen i torr jord » äfwen afföndrar sig af ruttet watten alltid en gyttja.	384:394	0:682
vegetation	nan	1895	2	bib19227462_18950606_147640_129_0004_alto.xml-102-12	 	År 1868 publicerade d:r Meyer sitt arbete » Undersökning af de adenoida vegetationerna i gommen och deras behandling ».	72:86	0:119
vegetation	nan	1826	1	bib11653828_18260518_144028_112_0004_alto.xml-0-9	 	6:o Bcstänkes Zsrdcn med upplöst blcksalt, sä befordras vegetationen utomordentligt, och blommor och frukter hinna till dubbel storlek mot wunligt.	56:68	0:147
vegetation	nan	1895	2	bib19227462_18950221_147640_44_0003_alto.xml-192-25	 	Ett af dem, Damluckan, skulle möjligen af våra möderne mästare kallas konventionelt, ty teckningen är synnerligen vårdad, och färgen såväl på vegetationen som på det sakta forsande vattnet är naturlig och enkel.	142:154	0:211
vegetation	nan	1830	1	bib11653823_18300209_144010_32_0001_alto.xml-23-7	 	Efter Jalcas följer en IZ-regiorr; ingen vegetation synes, öfwerchlc höljes marken af en ewig snö, Men sä snart ruan nedstiger ät Bräsili-	41:51	0:138
vegetation	nan	1825	1	bib15650837_18251001_146391_78_0001_alto.xml-5-3	 	har förstört all vegetation; rörliga sandkullar, som ckro en lek för de ifrän det gränslösa hafwet obehindradt framrusande stormarna, uppstä, bortföras och samla sig än pä det cna, än pä det andra stallet.	17:27	0:205
vegetation	nan	1816	1	bib11653828_18160430_144028_99_0003_alto.xml-10-8	 	kjusa, listiga färg — ett beivir pä vegetationens wanmagt; ty under söderns himmel är ben dunklare och Msom fullblodig ger en sällsam anblick mot det för hfrigt rädande stränga lynnet i ben nordista naturen.	36:49	0:207
vegetation	nan	1895	2	bib15873371_18950430_145112_116_0003_alto.xml-128-44	 	Sådana djupt rotade plantor igenkänner man genast på deras blekgröna, gulaktiga färg; hos många växtarter, t. ex. hvetet, dör den för djupt liggande rotstocken alldeles bort och drifver ur den närmast ytan liggande stråknuten en ny rotstock, hvarigenom plantornas vegetation blott alltför ofta råkar i ett ödesdigert stillestånd.	264:274	0:329
vegetation	nan	1827	1	bib19277277_18270702_147682_151_0001_alto.xml-32-1	 	för vegetationen tyckeS Kornet dock cj lofwa nägon rik störd, och öfwcrhufwud har säden drisivit Men i halm dit ax.	4:16	0:115
vegetation	nan	1896	2	bib11653811_18961121_145317_180_0002_alto.xml-90-17	 	Växtligheten var så ovanligt rik dernere, yppig, färgrik och omväxlande — lifligt påminnande om söderns vegetation.	104:114	0:115
vegetation	nan	1895	2	bib19227462_18950822_147640_194_0003_alto.xml-38-26	 	Kommer man dit från Namur, går vägen genom en floddal, hvars höga, lodrätt stupande berg med sina skrofliga bruna sidor, sin gröna vegetation, sina här och der upptornade gamla borgar, hvars blomstrande byar, talrika fabriker, yppiga sädesåkrar ocb lugnt framflytande vattendrag erbjuda en mycket Fängslande landskapsbild.	131:141	0:322
vegetation	nan	1895	2	bib19225758_18950518_144022_115_0008_alto.xml-86-18	 	Så kommer äfven i år föreningens assistent, R. Tolf, att egna de norrländska mossarne och vegetationen, i synnerhet i de nordligare landsdelarne, särskildt studium.	90:102	0:164
vegetation	nan	1895	2	bib19227462_18950808_147640_182_0005_alto.xml-56-12	 	Det synes * i alla händelser föga sannolikt, att befintligheten af vegetation på Possession Island skulle hafva undgått de vetenskapsmäns skarpa iakttagelser, hvilka medföljde Erebns och Terror, och det är alldeles tydligt, att en stor nordgående varm ström existerar, hvilken bryter sönder isfälten inom den antarktiska cirkeln.	67:77	0:329
vegetation	nan	1897	2	bib11653830_18970617_146968_48_0002_alto.xml-100-25	 	Mattfrostor omtalas nu från många håll ha åstadkommit stor skada på vårsäd och potatis, och i trädgårdar har frosten gått illa åt den frodiga vegetationen.	142:154	0:155
vegetation	nan	1897	2	bib19227291_18971109_145289_135_0003_alto.xml-10-7	 	svulstbildning i näsan, kallad“ adenoida vegetationer i nässvalgrummet.	41:53	0:71
vegetation	nan	1903	2	bib11653838_19030515_147024_20_0003_alto.xml-145-14	 	Den eftervinter, som i år hemsökt den sydliga delen af Europa, sedan vegetationen till följd af någon tids vårvärme redan framframskridit ganska långt, säges ha gjort mycken skada i synnerhet i vintrakterna.	69:81	0:207
vegetation	nan	1801	1	bib11653828_18010724_144028_165_0002_alto.xml-7-9	 	I Departementet Isere ha siv.t de runDmäsioge-n och hela Vegetationen skadliga Gttterr iiljfwu.	57:69	0:95
vegetation	nan	1895	2	bib15760690_18950207_145050_22_0003_alto.xml-69-59	 	Sjöfarande swenflar kände naturligtwis nägot mer om Mexico, men dock blott förhållandena wid de stora hamnarna i låglandet, olämpligt till boningsort sör nordliga solk, men föga om höglandet, den widsträckta, bördiga och härliga platå, som bildas af Sierrans östliga, länga sluttningar, ett rikt och lyckligt lans, der söderns och nordens vegetationer moras i en ewig wär, en aldrig förbleknande grönsta, der klimatet, fastän man befinner sig mellan wändkretsarne.	339:351	0:464
vegetation	nan	1895	2	bib19227462_18951214_147640_292_0007_alto.xml-87-24	 	den europeiska stadsdelen hittar nian väl någon liten grön plats, vanligtvis mer eller mindre förtorkad och hvitpudrad af damm, men annars representeras vegetationen mest af en eller annan uppför husväggame klättrande vinranka eller af några dystra grågröna cypresser, hvilkas uppträdande alltid antyder befintligheten af en af dessa vanvårdade gamla museimanska kyrkogårdar.	153:165	0:375
vegetation	nan	1895	2	bib15873936_18950813_147385_94_0003_alto.xml-15-25	 	Omedelbart därpå höll rektor, prof. Fries, ett intressant föredrag, som lönades med litliga handklappningar, om » människans inflytande på vårt lands vegetation ».	150:160	0:163
vegetation	nan	1895	2	bib19277277_18950628_147683_172_0002_alto.xml-1-10	 	Efter fyra timmars ridt sago vi ännu intet spår af vegetation, sadeln glödde, tungan lådde vid gommen.	51:61	0:102
vegetation	nan	1815	1	bib11653806_18150704_145120_70_0002_alto.xml-19-51	 	Pä utdikad sank mark är kalkens wälaö, rande werkan annu mera synbar, än pä ben förut häfdade jorden; dessa fält, font förut i årtusende warit wattendruckna, hysa en mängd lemningar af wäxt- och djur-ämnen, som i första början ej äro flickliga att under, hälla vegetation, men genom ben brända kai » sens äwerkan, nu pä en gäng begynna blifw » bärande, hwarjemte här, äfwen som l annan jord, mastar, insecter och deras agg, af kalken förstöras.	261:271	0:444
vegetation	nan	1830	1	bib11653828_18300301_144028_49_0002_alto.xml-4-18	 	Dernäst tagat i betraktande de olika vext-regioner eller latituder (Zonce transversa / ss), som genom vegetationens skiljaktighet erhålla sin bestämda utsträckning, ofta helt naturligt inträffande med deri geografiska och statistiska indelningen.	102:115	0:246
vegetation	nan	1815	1	bib11653825_18150704_145134_71_0002_alto.xml-8-48	 	Pä utdikad sank mark ar kalkens wälgörande werkan annu mera synbar, än pä ben förut hasdade jorden; besia fält, forn förut i ärtusende warit wattendruckna, hysa en mängd lemningar af wäxt- och djur-ämnen^ som i första början ej äro stickliga att imber » hälla vegetation, men gcuom ben branda kai » fens äwerkan, nu pä en gäng begynna blifwcr bärande, hwarjcmte här, äfwen forn 1 ' annan » jord, mastar, msccter och deras ägg, af kalken förstöras.	260:270	0:447
vegetation	nan	1895	2	bib15650814_18951004_146365_232_0003_alto.xml-126-18	 	och i hörnen funnos djärft upptornade klippor med magiskt upplysta grottor, plaskande vattenfall och en förtrollande rik vegetation.	121:131	0:132
vegetation	nan	1818	1	bib11653828_18180221_144028_43_0002_alto.xml-10-41	 	en Tyst mil strän Hustvudflaten, och man har der en utsigt öftver en af de största och wackraste flater, kanyända i hela W, stindienf af 6 mils widd frän öster till wester.. Har ser man beti yppigaste vegetation, beredd af jordmänens fetma, wattentillopp frän bergen och den warma lusten, och af bergen styddad fön deli skarpare sjöluf, ten.	201:211	0:341
vegetation	nan	1811	1	bib11653825_18110712_145134_79_0003_alto.xml-9-6	 	till Debretzin scs intet spär till vegetation; blotf winter fru terne ko!	35:45	0:73
vegetation	nan	1895	2	bib19277180_18950522_147374_42_0003_alto.xml-125-6	 	att egna de norrländsta mossarne och vegetationen, i synnerhet i de nordligare landsdelarne, särskildt studium.	37:49	0:111
vegetation	nan	1814	1	bib11653806_18140222_145120_28_0002_alto.xml-4-39	 	att detta förfarande upptager mycken tid och fordrar mycket bränsle, när fräga är att gö » ra delta i stort, sä hindrar ej tolkningen, att ju en del af den saft som marit ämnad att befordra vegetation, mt » genom frosten blif » wit förwzndlad till watten, blif^er q.var til » lika med ett dennaiordwäxt tNhörande ffarpt grundämne, hwilket fraMriNqsr en öfwer » flödig m ss?	190:200	0:373
vegetation	nan	1830	1	bib11653828_18301122_144028_271_0002_alto.xml-3-30	 	herrskar samma formernas yppighet, storhet och majestät, som i de sydliga skogarna; inen den glödande hettan, da nästan dagligen nedstörtande regnskurarna, de flödande strömmarse försätta vegetationen i en evig oro och gäsning.	188:200	0:227
vegetation	nan	1806	1	bib11653828_18060625_144028_142_0003_alto.xml-1-6	 	— I början af April har vegetationen uppnätt sin hög,	24:36	0:53
vegetation	nan	1899	2	bib11653811_18990805_145317_118_0003_alto.xml-65-14	 	menad, hvarunder skogsparkernas rika växtlighet så småningom försvinner oell ersättes af bergsidornas torra vegetation af risigt gultörne och rasslande ormbunksfålt.	108:118	0:165
vegetation	nan	1895	2	bib15873371_18951101_145112_298_0003_alto.xml-41-8	 	illa nog, ända till 60 procent af vegetationen af sådana arter, som åtminstone i färskt tillstånd alls ioke ätas af kreaturen, t. ex. Itanunculus acris.	34:46	0:152
vegetation	nan	1830	1	bib19227291_18300407_145289_14_0002_alto.xml-18-65	 	Sedan ma » pä derra ställe uppslagit ett tält pä en udde as stranden, h^-de m: n tillfälle alt anställa gräfningar i jorde », hwilken war betäckt med wexcer, och man fann med förwäning, atr denna udde war erc isberg, af 160 fors höjd, förenad med fasta landec ocd betäckt ined ett jordhwarf, foin hade en liflig vegetation.	312:322	0:323
vegetation	nan	1895	2	bib11653830_18951018_146968_120_0002_alto.xml-24-25	 	längre använda de medel, som mera än någonting annat på en i ordentlig kultur varande jord tillförsäkrar örn en god skörd äfven under för vegetationen mindre gynsamma förhållanden, efter som den väl gödslade åkerns förmåga att under dessa ändock gifva en nöjaktig skörd är ojemförligt mycket större än den magra jordens.	138:150	0:320
vegetation	nan	1897	2	bib11653811_18971227_145317_200_0004_alto.xml-71-12	 	Så beredde han den magra jorden till en mönsterfarm, hvars yppiga vegetation förgäfves sökte sin like i trakten och M. vardt en burgen man; dertill ock gift och familjefader.	66:76	0:174
vegetation	nan	1903	2	bib11653811_19030916_145317_143_0003_alto.xml-78-15	 	Den är således klassisk, denna yppiga, grönskande mark, som uppbär en sydländsk vegetation och utgör ramen om den största och härligaste af Schweiz ’ alpsjöar.	80:90	0:159
vegetation	nan	1895	2	bib15650814_18951018_146365_244_0003_alto.xml-128-51	 	visserligen sant, att de växter, som uppfylla hårdvallarne i Norrland, ej äro några sällsyutheter, q^en örn de rätta arterna ej hinna sprida sig till den nyanlagda vallen i rätt tid, intages platsen af diverse värdelösa arter, som sedan för all framtid komma att utgöra platsens vegetation.	279:289	0:290
vegetation	nan	1896	2	bib15873936_18961107_147385_130_0004_alto.xml-86-7	 	en enslig park öfverväxt af en tropisk vegetation, och tegeltaken glimmade röda i eftermiddagssolens sken.	39:49	0:106
vegetation	nan	1829	1	bib11653828_18291019_144028_242_0002_alto.xml-1-40	 	räknades alla de, som kunde göra anspråk på någon slags stalstjenst, och till det andra folket, la masse contribuable, materien, hvarmed lörvaltningen företar sina experimenter, den oförslärbara grund och mark, hvarutur hennes yppiga vegetation framskjuter, hvarpå hon betar och trampar med fötterna.	234:244	0:300
vegetation	nan	1817	1	bib19227291_18170115_145289_3_0002_alto.xml-6-9	 	Man ser här intet annat än stein berg utan vegetation, frän 50 till 1500 Famnars jloisee ') högd, och en enda Slätt, der Bonaparte residerar.	43:53	0:141
vegetation	nan	1895	2	bib15978012_18951025_148361_249_0003_alto.xml-48-26	 	Den brasilianska regeringen har beslutit att lägga telegrafkabel i denna stora vattenväg, emedan det visat sig omöjligt att skydda de på stolpar upphängda luftledningarna met vegetationens inkräkning, hvars makt öfvers tiger allt hvad mati kan föreställa sig, Världens största bok är enligt „Förgät mig ej“ ett arbete i den kinesiska afdelningen af Britisk museum som består af icke mindre än 5,030 band.	175:188	0:404
vegetation	nan	1830	1	bib11653828_18300302_144028_50_0001_alto.xml-0-0	 	Vegetationen i förhållande till jordmånen Ilar gitvit förf. anledning till en vext-geologi, nied högst upplysande undersökningar, men af för vidsträckt omfattning, att upptagas i en öfversigt sorn denna.	0:12	0:203
vegetation	nan	1830	1	bib11653828_18300419_144028_88_0004_alto.xml-4-25	 	gräfning i jorden fann man, att denna förmenta landtudde var ett isberg af 100 fots höjd, betäckt af ett jordöfverdrag med eri liflig vegetation.	134:144	0:145
vegetation	nan	1896	2	bib15873936_18961006_147385_116_0003_alto.xml-149-5	 	alia förruttoelseprocesser — den ruttnade vegetationen utvecklar dem och sänder dem ned i jorden, hvarifrån åter de lefvande växterna tillgodogöra sig dem.	42:54	0:155
vegetation	nan	1895	2	bib19349359_18951105_148383_131_0004_alto.xml-26-28	 	konstnärligt målad ridå, framställande ett yppigt tropiskt landskap, och i hörnen funnos djerft upptornade klippor med magiskt upplysta grottor, plaskande vattenfall och en förtrollande rik vegetation.	190:200	0:201
vegetation	nan	1830	1	bib11653828_18300302_144028_50_0002_alto.xml-10-55	 	2531 species af Herr Wahlenberg fullständigt beskrifne, nemligen n 65 plianerogamer oell 1 » 66 Cryptogamer, hvilket har det roärkvärga med sig att på siffran framvisa ett lika antal individer i de bålla, till sin natur så mycket skiljda stora vext organisationerna, oell att en enda klass, mod den obseuraste vegetation, innefattar * lika mångå Species, sorn de Öfrige 25 klasserna.	310:320	0:383
vegetation	nan	1830	1	bib11653828_18300219_144028_41_0001_alto.xml-3-17	 	staden St James, sorn ligger i en bergsklyfta emellan två höga, stela, på ali vegetation blottade lavaklippor, och genom sitt vänliga utseende göra det dystra i dess omgifning så mycket märkbarare, förde oss en slingrande, i klippan inhuggen väg, uppföre de stela, af naturen ogängliga bergsafsatserna.	78:88	0:302
vegetation	nan	1830	1	bib11653828_18300904_144028_204_0002_alto.xml-12-28	 	Våra läsare torde kanske känna den vidunderliga saga, man utspridt örn detta träd, huru det (örgiltade atmosferen rundfonikring, så att i dess grannskap ingen vegetation kunde trifvas på liera mils alstånd, huru missdådare nied hopp örn benådning utsändes att hopsamla dess kåda, huru de största försigtigbetsmårt, sorn vidtogos för att skydda elern, likväl oftast blefvo fruktlösa, o. s. v. Det verkliga förhållandet är följande: Det träd, hvarilrån upasgiftet tagea, växer på östra kusten af öu lava 5 dess stam är r und, rak och reser sig fullkomligt slät oell utan qvistar till en höjd af bo, 70 till oell nied 80 fot.	159:169	0:622
vegetation	nan	1895	2	bib19227462_18950822_147640_194_0003_alto.xml-98-56	 	om ej omöjligt, att tänka sig, att en må larea pensel eller en murares slef Öfveda rit dessa smutsgala, smutsgrå eller smuts röda murar, på hvilka väder och vind, regn och solsken qvariemnat sioa spår och sorn spegla sig i kanaler, der ett grumligt och stillastående vatten ocb en frodig vegetation bära samma ultra-konservativa skaplynne.	288:298	0:339
vegetation	nan	1895	2	bib19277277_18950714_147683_188_0003_alto.xml-89-10	 	rare än denna, som i vexlande utsigter och yppig vegetation ej lemnar något öfrigt att önska.	49:59	0:93
vegetation	nan	1818	1	bib11653828_18180523_144028_115_0001_alto.xml-7-8	 	sä mali afseende pä massornas former, som vegetationens och luftens beskaffenhet och den af det hela retade moralista känslans caracter.	42:55	0:136
