lemma	pos	date	grouping	identifier	description	context	indexes_target_token	indexes_target_sentence
stab_nn	nn1	1840	1	fic_1840_7681.txt-544-33	 	We trembled then, at the deep death-note Pealed from the panting bull-dog's throat, -- The flash, -- the echo and the smoke, -- The yell, -- the stab, -- the sabre stroke, -- The musket shot, -- the frenzied shriek, -- The death-groan of the hunted Greek, -- Till our white feet with streams of gore were dyed, And mangled limbs were strown on every side, -- With many a skull by Turkish sabre cleft; Our vultures finished what their blood-hounds left!	145:149	0:452
stab_nn	nn1_vv0	1848	1	fic_1848_8147.txt-43-36	 	Yet judge not harshly of mankind for this, It in the end gives justly; but Fame's crown Can ill requite a life of cankering care; Can ill requite the assassin's bloody stab; Or a long	168:172	0:183
stab_nn	nn2	1851	1	fic_1851_1184.txt-3020-5	 	His long finger made swift stabs here and there at the canvas.	27:32	0:62
stab_nn	nn1	1857	1	mag_1857_556291.txt-61-39	 	despair by making them feel too deeply the poverty of the first attempt; how to take down the vanity of these, by making them see how frothy is all that fine writing, without giving a deadly stab to their natural and rightful self-appreciation, - is aL * ays a difficult problem, which it requires great delicacy and sympathy to solve in a satisfactory manner.	191:195	0:360
stab_nn	nn1@_vvg	1972	2	mag_1972_479300.txt-442-8	 	One of the blacks uvolved in the shower stabbing was at the movie.	40:48	0:66
stab_nn	nn1	2002	2	fic_2002_31327.txt-372-6	 	Emmeline felt a sharp and sudden stab of envy over that, an uncharitable emotion that she'd been able to subvert when she was sober. \"	33:37	0:134
stab_nn	nn2	1855	1	mag_1855_556096.txt-212-21	 	But in March, 1778, two years after its adoption, the new constitution received a number of violent legislative stabs, and a substitute for it was presented to him by	112:117	0:166
stab_nn	nn1@	1827	1	fic_1827_9763.txt-5388-22	 	hide thee from my view for a time; hide it from me that my heart was black enough to meditate the stabbing of a brother!	98:106	0:120
stab_nn	nn2_vvz	1989	2	fic_1989_780082.txt-1559-10	 	He pulled himself upright, his spine unkinking with little stabs at each vertebra.	59:64	0:82
stab_nn	nn1	1961	2	mag_1961_268345.txt-2-7	 	force, the legislators made a forlorn stab at statesmanship.	38:42	0:60
stab_nn	nn1@	1839	1	fic_1839_7477.txt-2827-20	 	Were there in ' t A face of justice -- But to see my rights Slighted and trampled by a stabbing ruffian, A father's favor poisoned by the breath Of an old visionary; be left blank, Because I scorn to flatter, and protest My loyalty for favor, strips me bare Of patience; and I swear, ere brook such wrong, I'll give their chronicles a bloodier leaf Than Amnon's.	87:95	0:362
stab_nn	nn1_vv0	1833	1	fic_1833_7240.txt-509-1	 	A stab from a real knife, might save you.	2:6	0:41
stab_nn	nn1	1987	2	mag_1987_335949.txt-15-11	 	house arrest in New Delhi after calling the pact a \" stab in the back, but early this week Prabakaran was released and returned to Jaffna after pledging that he would ask his commanders to disarm.	53:57	0:196
stab_nn	nn1	1964	2	fic_1964_10449.txt-1666-11	 	No matter, for the effect was the same -- a stab of burning pain into the very depth of Lapinabit's being! \"	44:48	0:108
stab_nn	nn1	1860	1	fic_1860_1818.txt-240-18	 	She then put her hand in again, but very cautiously, and Little Jacket gave it another stab, which made her cry out more loudly than before.	87:91	0:140
stab_nn	nn1	1993	2	fic_1993_25032.txt-3201-22	 	That would take buckets, carrying buckets of dirty water.... \" Clara saw Rosalie's surprise and distaste, felt a stab of loneliness keen as ice, and said, \" It's habit.	113:117	0:168
stab_nn	nn1_vv0	1853	1	mag_1853_566334.txt-489-85	 	Mr. Webster had now recovered his composure, and fixing his keen eye on the Chief Justice, said, in that deep tone with which he sometimes thrilled the heart of an audience \" Sir, I know not how others may feel, ' (glancing at the opponents of the College before him,) but, for myself, when I see my alma mater surrounded, like C * esar in the senate house, by those who are reiterating stab upon stab, I would not, for this right hand, have her turn to me, and say, Et tu quo que mi flu!	387:391	0:488
stab_nn	nn1	2003	2	fic_2003_48660.txt-213-14	 	L and I felt elated; we would finish the musical and take a stab at a career!	60:64	0:77
stab_nn	nn1	1859	1	fic_1859_9037.txt-94-5	 	Its indifference is not a stab in their bosom, the slow bleeding of which can only be stifled in the grave!	26:30	0:107
stab_nn	nn2	1839	1	fic_1839_7001.txt-67-21	 	make, must yet ere then Be acted here; ay, with the genuine clasp Of anguish, and fierce stabs, not buried in silk robes, But in hot hearts, and sighs from wrung souls ' depths.	89:94	0:177
stab_nn	nn1	1849	1	fic_1849_7347.txt-633-8	 	Thanks to you, I got but one stab, ' replied the traveller.	29:33	0:59
stab_nn	nn1	1995	2	fic_1995_39256.txt-9-46	 	When someone scored, a cheer rose from the players and their crowd, and Allie turned her face straight up to the black sky, closing her eyes, tasting a love and safety she knew would never be duplicated, that certainty a sweet stab in her heart.	227:231	0:245
stab_nn	nn1	1976	2	mag_1976_490783.txt-2-2	 	Their potted stab at tropical drama could not alter our long-held opinion that nature must surely he more subdued and self-effacing in this part of town than anywhere else on the planet; leaf and branch always wear a vaguely neurotic air when they show up here, as though they were prey to anxiety about whether they can sustain themselves in any meaningful relationship with the elements, or were smarting at being ordered sight unseen and lovelessly by fashionable decorators.	13:17	0:478
stab_nn	nn1	1833	1	mag_1833_564480.txt-184-16	 	That ' * fiend, who sits grinning on the window-seat, gave me a mortal stab.	71:75	0:76
stab_nn	nn1	1978	2	fic_1978_10636.txt-7924-6	 	As if in recoil from this stab, she angrily turned, my pillar of cloth, and it was alarming, how closely her back resembled her front.	26:30	0:134
stab_nn	nn1	1986	2	fic_1986_10741.txt-4153-6	 	It had set off a sharp stab of memory that was humiliatingly physical in its intensity. \"	23:27	0:89
stab_nn	nn1	1860	1	fic_1860_8585.txt-168-22	 	Herbert Waverly Wait; not long since, only a few months ago, it smote upon my heart like a sudden stab that there was a something, I knew not what, wanting in our perfect understanding of each other.	98:102	0:199
stab_nn	nn2	1843	1	fic_1843_7026.txt-2497-1	 	The stabs of scorn and contumely are given in the highest halls of liberty, but none can look upon the heart which bleeds or gangrenes as it repels them!	4:9	0:153
stab_nn	nn1	1853	1	mag_1853_566334.txt-489-87	 	Mr. Webster had now recovered his composure, and fixing his keen eye on the Chief Justice, said, in that deep tone with which he sometimes thrilled the heart of an audience \" Sir, I know not how others may feel, ' (glancing at the opponents of the College before him,) but, for myself, when I see my alma mater surrounded, like C * esar in the senate house, by those who are reiterating stab upon stab, I would not, for this right hand, have her turn to me, and say, Et tu quo que mi flu!	397:401	0:488
stab_nn	nn2_vvz	1846	1	fic_1846_4464.txt-4116-8	 	And with the words he dealt her three stabs, the least of which was mortal; but, even in that moment of dread passion, with fiendish ingenuity he endeavored	38:43	0:156
stab_nn	nn2	1981	2	fic_1981_10681.txt-3135-13	 	Then she would squat there a while, resting, moaning at the stabs of pain in her knees and feet and hips, until she was ready to haul herself to a standing position.	60:65	0:165
stab_nn	nn2	2009	2	fic_2009_36924.txt-37-21	 	When it looked like Brady would go in after him, Olivia threw caution aside and raced downhill, ignoring the stabs and jabs of anything that tried to impede her progress.	109:114	0:170
stab_nn	nn1_vv0	1815	1	fic_1815_8708.txt-1575-1	 	Officer Stab, stab, again: but heaven supports my soul To warn thee, O thou Upas of the world, Thou scourge of God -- that soon thy reign will end.	8:12	0:147
stab_nn	nn1	1988	2	fic_1988_780086.txt-469-4	 	He felt a sharp stab of pain; then the cushioning of time and distance rebounded inside him, driving out all but a small, lingering ache.	16:20	0:137
stab_nn	nn1	1981	2	fic_1981_780030.txt-128-12	 	She took a deep breath and arched her back, ignoring the stab of pain it caused in her pelvic region, and saw his gaze slide helplessly down her throat to her upthrust breasts, swollen for the baby. \"	57:61	0:200
stab_nn	nn1	1835	1	fic_1835_7063.txt-3842-15	 	If you acquit him upon the principle of doubt, future assassins have only to stab in solitude, and they will stab in safety.	77:81	0:124
stab_nn	nn1	1853	1	mag_1853_504732.txt-881-9	 	Napoleon hoped that he was now secure from a stab in the back.	45:49	0:62
stab_nn	nn1	1960	2	fic_1960_4443.txt-1324-13	 	If something showed up in it I'd be able to make a stab at getting a shot in.	51:55	0:77
stab_nn	nn1	2007	2	mag_2007_388314.txt-297-21	 	Sullivan, the same man who warned him he'd be prosecuted for going to Hanoi, and Sullivan made a stab at summing it up: I guess the lesson of all of this is that you have to destroy the opposition before it can rise.	97:101	0:216
stab_nn	nn1	1987	2	fic_1987_10753.txt-4767-5	 	Martha saw with a little stab that someone had removed the bouquet of flowers from the chest where she had just put them; they were now on a small table beside Jesus.	25:29	0:166
stab_nn	nn1	1994	2	fic_1994_41243.txt-295-21	 	A young man with a thin mustache appeared to be pushing himself against this woman, and Megan felt a sudden stab of violation.	108:112	0:126
stab_nn	nn1	1985	2	news_1985_668623.txt-14-5	 	As Epton mulls over another stab at the mayor ' s office, his thoughts always drift back to the media.	28:32	0:102
stab_nn	nn1@_vvg	1846	1	fic_1846_4462.txt-3486-16	 	Never heed polishing them very much, but give them right keen edges, and good stabbing points. \"	78:86	0:96
stab_nn	nn2_vvz	1849	1	fic_1849_7006.txt-1593-22	 	Of my party, not one was injured in this last affray; but several of the horsemen had received cuts and stabs, though none of a dangerous character.	104:109	0:148
stab_nn	nn1	1849	1	fic_1849_7218.txt-3615-37	 	I don't mean to murder myself -- I 'm past that now -- give it me \" -- and snatching it from my hand, he flung down an empty purse, and with a terrific stab, nailed it fast with the dirk to the table. \"	152:156	0:202
stab_nn	nn2	1850	1	fic_1850_4498.txt-670-17	 	Of an impulsive and passionate nature, she had fortified herself to encounter the stings and venomous stabs of public contumely, wreaking itself in every variety of insult; but there was a quality so much more terrible in the solemn mood of the popular mind, that she longed rather to behold all those rigid countenances contorted with scornful	102:107	0:344
stab_nn	nn1	1996	2	fic_1996_54331.txt-52-9	 	and I can't help but feel a nasty stab of fury in my gut, because Jonny's mother drank daily during her pregnancy, and took every drug she could find in staggering quantities.	34:38	0:175
stab_nn	nn2	1978	2	fic_1978_23932.txt-190-14	 	Before then his life seemed to him formless and scattered, a series of stabs at a /5,), c ' 1, life.	71:76	0:100
stab_nn	nn1@_vvg	1969	2	fic_1969_10510.txt-1184-34	 	And everywhere he took copious notes, his broad, tough-looking hands with the black hair bunched between the knuckles jotting down the endless numbers and percentages in his notebook with the same rapid stabbing motion of a blind man writing braille.	203:211	0:250
stab_nn	nn1	1994	2	fic_1994_54062.txt-398-18	 	There was not a taxi to be had, or a light to be seen except for the stab of searchlights and the flashes of anti-aircraft batteries.	69:73	0:133
stab_nn	nn2	1846	1	fic_1846_8891.txt-2979-8	 	Frederick Bramble I deprecate the cruel critic's stabs.	49:54	0:55
stab_nn	nn1	1984	2	mag_1984_492132.txt-48-4	 	Therefore, a \" stab wound \" the size of a man's thumb is made in the patient's side and a hollow tube is inserted through the body into the kidney.	15:19	0:147
stab_nn	nn2_vvz	1966	2	fic_1966_10477.txt-9251-28	 	There you prayed over him with those black hats and robes on, undressed the frightened child, and began to stab him in certain places, twelve stabs first, then another making thirteen wounds -- thirteen each in the region of the heart, on the neck, from which most of the blood is drawn, and on the face -- according to your cabalistic books.	142:147	0:342
stab_nn	nn1	1977	2	fic_1977_780095.txt-1626-6	 	I did not care that my stab at this version of normality might be a little overt.	23:27	0:81
stab_nn	nn1	1842	1	fic_1842_7289.txt-3623-8	 	It seemed as if his sensibilities suffered a stab with every syllable which he was called upon to answer.	45:49	0:105
stab_nn	nn1	1851	1	mag_1851_589926.txt-96-45	 	When the burglar will enter the dwelling-when the assassin will stabwhen the knave will defraud-when the dishonest will deny or evade the obligations of his contract-neither can be foreseen nor foreknown; for if foreseen or foreknown, the entry of the burglar -- the stab of	267:271	0:274
stab_nn	nn2	1980	2	fic_1980_10664.txt-5180-5	 	Sure, I had felt Stabs of Envy (as any other Mortal Soul bath done), but always I seem'd to know that all the divers Destinies ofp284Humankind have their own Pains as well as their own Pleasures, and e'en the Greatest Lord who suffers no pecuniary Want, may be tormented with the Gout, or Devastation at the Loss of Love, and feel his Suff'rings as keenly as the poor Gin-soakt Beggar.	17:22	0:385
stab_nn	nn1	1973	2	mag_1973_281092.txt-1-13	 	Albert DeSalvo, 42, confessed \" Boston Strangler \"; of multiple stab wounds; at Walpole State Prison in Massachusetts.	64:68	0:118
stab_nn	nn2	1824	1	nf_1824_747448.txt-2264-37	 	I * ' imagine that this dark hint took its origin from one of \" my Notes in ' The Giaour, ' in which I said that the coun \" tenance of a person dying by stabs retained the character \" of ferocity, or of the particular passion imprinted on it, \" at the moment of dissolution.	153:158	0:274
stab_nn	nn1_vv0	1847	1	fic_1847_7194.txt-1078-39	 	How his eyes flashed -- how his deep tones rung through the chamber, as he uttered words like these: -- \" These facts -- (the long recital of galling wrongs) -- have given the last stab to agonizing affection, and manly spirit bids us renounce forever these unfeeling brethren.	181:185	0:277
stab_nn	nn1	1839	1	fic_1839_7297.txt-548-6	 	He would sooner forgive thee a stab at his throat than a flout upon his understanding, as indeed, would most men, those in especial who have the ambition of greatness without its soul, and better love the attributes which follow achievement, than the difficult paths and chastening circumstances which attend it.	31:35	0:312
stab_nn	nn1_vv0	1837	1	mag_1837_554503.txt-162-31	 	, that in Parkhurst would probably be found under that word, as a derivative, the English word dagger, especially as the Hebrew verb signifies to pierce, or stab.	157:161	0:162
stab_nn	nn2	1964	2	fic_1964_10446.txt-178-4	 	I was riven with stabs of love for the circumstance of such a life.	17:22	0:67
stab_nn	nn1	2007	2	fic_2007_51973.txt-18-19	 	He still felt queasy, and somewhat muddled too, with a slight headache lingering after that sudden weird stab of pain.	105:109	0:118
stab_nn	nn1@_vvg	1846	1	fic_1846_4464.txt-4612-22	 	Blood flowed like water; and so fierce was the hatred of the combatants, so deadly the nature of the tremendous stabbing broadswords of the Romans, that few wounds were inflicted, and few men went down ' till they were slain outright.	112:120	0:234
stab_nn	nn1	1974	2	mag_1974_283983.txt-5-10	 	After dawdling for weeks, the Administration made an eleventh-hour stab at saving COLC, but the move was too weak and came much too late.	67:71	0:137
stab_nn	nn1	2005	2	fic_2005_33100.txt-174-26	 	On the paved garden floor, the priest lay as if dressed in mourning, wearing the black of his trade, festooned now with multiple stab and slash wounds that outrioted the roses banked against the old stone walls.	129:133	0:211
stab_nn	nn1@	1856	1	fic_1856_9779.txt-6643-19	 	But Henry persevered in his determination to do no murder, for such he persuaded himself would be the stabbing of the sleeping and defenceless man.	102:110	0:147
stab_nn	nn1	1853	1	nf_1853_747555.txt-1471-18	 	Those civil wars, by which the Spanish- American republics have been so much distracted, another severe stab, not merely at the theory of the equal rights of man, but at the idea of the capacity of mankind for self-government, have been almost entirely occasioned by the great inequalities of wealth	104:108	0:299
stab_nn	nn2	1832	1	fic_1832_8751.txt-1487-13	 	Col. Colonni A wounded man is hither brought, So much with gaping stabs and blood disguised, By none around has he been recognised.	66:71	0:131
stab_nn	nn1	1828	1	fic_1828_7034.txt-317-9	 	The English boy threw himself forward and received a stab, aimed at the heart of his old friend; and the priest, with one convulsive bound, and one loud shriek of agony, withdrew the sword and plunged it deeply in his own breast.	53:57	0:229
stab_nn	nn1	1832	1	fic_1832_8862.txt-359-3	 	this is a stab to his peace of mind which he will never recover: he loved her to distraction, and she, the dissembling, artful jade, appeared to love him with equal ardour.	10:14	0:172
stab_nn	nn1	1859	1	fic_1859_270.txt-2892-15	 	I don't deny that there was a pang in it, yes, a stab; but there was a prayer, too, - - the \" Amen \" belonged to that.	49:53	0:118
stab_nn	nn1	1826	1	nf_1826_747833.txt-380-12	 	The former gave the blow openly, the latter gives the deadly stab in secret.	61:65	0:76
stab_nn	nn1	1825	1	fic_1825_7041.txt-3242-16	 	Had I known it earlier, I would sooner have died than have given such a stab to your peace; and you, in your disinterested kindness, would willingly have gone to your grave, and left me in ignorance of it.	72:76	0:205
stab_nn	nn1	1965	2	mag_1965_431712.txt-29-19	 	(She also has a conscience: guilt over this breach of theater ethics still gives her an occasional stab of shame.)	99:103	0:114
stab_nn	nn2	1969	2	fic_1969_10518.txt-6417-13	 	He made himself as small as possible, gritting his teeth against the stabs of the cactus and hoping the men would get past quickly.	69:74	0:131
stab_nn	nn1@_vvg	1846	1	fic_1846_4464.txt-2011-69	 	Their train, following closely after them, had all entered into the defile, the last of them having already passed the abutment nearest to Rome, when a loud shout arose from either side the bridge; and from the thickets and gardens at each extremity forth rushed a band of stout youths armed with casques and cuirasses of bronze, with the oblong shields and Spanish stabbing swords of the legionaries.	366:374	0:401
stab_nn	nn1	1822	1	fic_1822_7244.txt-4195-18	 	It is true that, before I knew him here, your own hand had given the deadly stab to your own reputation.	76:80	0:104
stab_nn	nn1	1854	1	mag_1854_566434.txt-95-14	 	A scene of confusion followed, the table was overturned, Rizzio received a stab, was seized, dragged out of the closet through the bed-room into the anteroom, and then left near the outer door, weltering in his blood, having been dispatched by the infliction of fifty-six wounds.	75:79	0:279
stab_nn	nn2	1839	1	fic_1839_7477.txt-5300-10	 	(Draws aside his vesture, and displays two bleeding stabs upon his breast.)	52:57	0:75
stab_nn	nn1	1966	2	mag_1966_431722.txt-99-10	 	makes the wound fester; the mind, renewing the stab, causes it to bleed afresh.	47:51	0:79
stab_nn	nn1	1980	2	news_1980_668150.txt-20-4	 	White made a fabulous stab, but tried throwing to third, hoping to catch Jackson rounding the bag.	22:26	0:98
stab_nn	nn1	2006	2	fic_2006_51442.txt-550-13	 	When the eye-poking was done and the class returned to their seats, Stab raised his hand.	68:72	0:89
stab_nn	nn1	1835	1	fic_1835_8114.txt-1111-137	 	, nor tastes of food, Till from his cheerless solitude, The exulting voice of balmy spring, The sullen hermit forth shall bring; But can the soul, that slumbers never, Live on, when hope has fled for ever; -- When homage, royalty, and power Have pass'd, the pageant of an hour; -- Live on, through exile, want, and chains, When neither friend nor slave remains; -- Live on, the mark and theme of hate, To bide the smile of frowning fate, -- The single chance, -- not yet to fall, As vulgar souls resign their breath; -- And bear, with gloomy patience, all, One trophy to erect in death; One stab, with dying hand, to give, And know one foeman shall not live?	591:595	0:658
stab_nn	nn1_vv0	1819	1	fic_1819_8693.txt-536-8	 	give it utterance; -- though every word Stab to my heart, that were some ease, compar'd To this dark horrible uncertainty.	40:44	0:122
stab_nn	nn1	1998	2	news_1998_626742.txt-55-5	 	Payson decided to take a stab at the upper end of the housing market.	25:29	0:69
stab_nn	nn1@_vvg	1961	2	fic_1961_10407.txt-9969-10	 	Out in the corral with the men at roundup time stabbing steers with hypodermics and notching ears and clipping horns and branding even castrating?	47:55	0:146
stab_nn	nn1_vv0	2007	2	fic_2007_33834.txt-209-22	 	His tone didn't suggest a man who'd been pining for me for months and had decided to make one last stab at winning my heart, but I was still curious. \"	99:103	0:151
stab_nn	nn1	1848	1	fic_1848_1108.txt-802-0	 	stab to his pride with savage fortitude and he bore with self-scorn the pursuit of her innocent curiosity. \"	0:4	0:108
stab_nn	nn2	1981	2	fic_1981_780032.txt-2469-6	 	They minced and winced at the stabs of twigs and stones in their soles, until their tender feet were at last so full of throbbing pains that new jabs could scarcely be felt.	30:35	0:173
stab_nn	nn1	2000	2	news_2000_603039.txt-17-10	 	With each accident, ADs around the country feel a stab in the heart that it happened -- and a sigh of relief that it wasn't their schools. \"	50:54	0:140
stab_nn	nn1	1836	1	nf_1836_749613.txt-1271-23	 	He was leaning, with folded arms, over a bale of blankets, engaged in bargaining, when he received a deadly stab in the back, and fell down the companion-way.	108:112	0:158
stab_nn	nn1@_vvg	1964	2	fic_1964_10451.txt-1281-5	 	She groaned against the white-hot stabbing that was moving into her legs. \"	34:42	0:75
stab_nn	nn1	2005	2	fic_2005_780526.txt-1116-22	 	A KEENING SOUND builds to a wail- - THUD- LINCOLN JOLTS as something hits his shoulder, catching him off-balance, a stab of pain keeling him onto the rail - CLANG - LINCOLN SLUMPS INTO FG - TWO CENSORS converging like white ghosts from the purple haze - one reprimanding his recalcitrant cohort- # CENSOR # You asshole!	116:120	0:319
stab_nn	nn1	2001	2	fic_2001_29928.txt-47-18	 	He knew they were near Salisbury because he spotted the extraordinary, unmistakable spire of the gothic cathedral-a stab of darkness just slightly darker than the sky behind it-shortly before they stopped.	116:120	0:205
stab_nn	nn1	1978	2	news_1978_733578.txt-0-25	 	@@733578 txt ROGER LYNN MYERS, 11, who mysteriously disappeared from his Du Page County home March 2, was found dead Sunday with stab wounds on his body in a south suburban forest preserve, authorities said.	129:133	0:207
stab_nn	nn1	1995	2	fic_1995_52955.txt-622-4	 	She vanishes with the stab of a thick little finger.	22:26	0:52
stab_nn	nn1	2004	2	fic_2004_49118.txt-73-4	 	Beau made a final stab at straightening his uniform, finishing up with a stiff bow, saying, \" Lieutenant Eugene Beauregard Fontenot at your service. \"	18:22	0:150
stab_nn	nn2	1992	2	fic_1992_53581.txt-7-8	 	My father listened, but after a few stabs at advice (\" You shouldn't be so concerned about the guy, just yourself \"), he adopted a pose which I thought of as his film noir self: wrist cocked	36:41	0:190
stab_nn	nn1	1968	2	mag_1968_494516.txt-136-4	 	Mr. Clegg makes a stab in the right direction when he says that they	18:22	0:68
stab_nn	nn1_<sub>	1834	1	fic_1834_2652.txt-544-14	 	His glance seemed meant to penetrate the bosom of the youth with a mortal stab -- it was hate, rather than anger, that he looked.	74:78	0:129
stab_nn	nn1	1840	1	fic_1840_7292.txt-4202-23	 	was the imprudent reply of the maiden -- her anxiety for the justification of her lover, making her forgetful of the mortal stab which such a suggestion must give to the old gentleman	124:128	0:183
stab_nn	nn1	1853	1	mag_1853_566332.txt-217-46	 	* * * * And yet, melancholy to relate, we find this avowed Christian, the author of New Themes, ' instead of sharing the indignation which we should suppose a Christian would feel at such an insult to Christians and such a stab to Christianity, we find him actually triumphing over the insulted clergy as follows	223:227	0:312
stab_nn	nn1	1981	2	fic_1981_10681.txt-980-5	 	With a quick, desperate stab of her spear she impaled it.	24:28	0:57
stab_nn	nn1@	2004	2	fic_2004_31534.txt-147-16	 	She woke periodically to cough or because the ache in her hip felt like the intermittent stabbing of a knife, thrust deep into the joint.	89:97	0:137
stab_nn	nn1	1858	1	fic_1858_1282.txt-4968-21	 	The reading of this curious document afforded the senate no little diversion, while to the government it was a fatal stab, for it discovered the queer order of intellects it had chosen to perform its offices abroad.	117:121	0:215
stab_nn	nn1	1852	1	fic_1852_69.txt-7613-20	 	St. Clare and one or two others made an effort to separate them, and St. Clare received a fatal stab in the side with a bowie-knife, which he was attempting to wrest from one of them.	96:100	0:183
stab_nn	nn1	1839	1	fic_1839_7477.txt-2881-19	 	Still can he greet me with that brow of love, Radiant as Moses ', yet in secret stab?	80:84	0:85
