lemma	pos	date	grouping	identifier	description	context	indexes_target_token	indexes_target_sentence
uppläggning	nan	1895	2	bib15760600_18950718_146401_84_0001_alto.xml-26-5	 	vid forsling, förvaring eller uppläggning af kött, fläsk, korf eller andra saluhållna matvaror, äfvensom kubbar och bänkar, hvarpå kött eller fläsk å allmän saluplats styckas, samt redskap, som därvid användas, skola hållas väl rena.	30:41	0:233
uppläggning	nan	1819	1	bib13506739_18190125_144030_19_0004_alto.xml-0-28	 	Fyra Rum, hwaraf twenne stora och ljusa öro patzanbe till Werk&gt; kad, Kök, 2:ne stora Källrar, torr Wind, patzande till torra Sakers uppläggning, del i Bagarstuga mcd inmurad Panna, samt Brunn midt mot vi tJfltfln, belägne ncJra Hötorget, & lt; lro att hyra.	135:146	0:260
uppläggning	nan	1826	1	bib19277277_18261218_147682_294_0004_alto.xml-35-19	 	Moderna FruntlmmsrSkläder efter mitt, samt Fruntimmers » hattar, förfärdigas fir billigaste pris, äftven emottagsg Löslockar till uppläggning för Z jk.	130:141	0:151
uppläggning	nan	1895	2	bib19277277_18950130_147683_29_0008_alto.xml-66-2	 	omfattande såväl uppläggning Born afslutriing af handelsböcker, åtager sig dertill skicklig person.	17:28	0:99
uppläggning	nan	1807	1	bib11653806_18070609_145120_61_0003_alto.xml-7-54	 	är pä begge, men stogen kan säljas, och ler och sand fäs för inter, och än mer der timret stall köpas dyrt och föras längwäga ifrån, men ler och sand ar nära till hands, finner man lätt, att om nägot mer beswar stulie wara med murbrukets tillredning och uppläggning lill wagg än med timrets, besparar man dock peiminge-utgiften pä inköpet, och far tillika såsom en winst dragfria rum, som trotsa tiden och elden, och gagnar pä dubbelt sätt sig och det allmänna.	254:265	0:461
uppläggning	nan	1804	1	bib19225792_18040218_147359_7_0005_alto.xml-2-13	 	hwarest en Rättfri SpannemSlswlnd är akt sä hyra lill 3 a 400 tunnors uppläggning.	70:81	0:82
uppläggning	nan	1895	2	bib19277277_18950720_147683_194_0004_alto.xml-46-27	 	öfre våningen såsom magasinsrum fått samma tillgänglighet och värde som den nedre, man har inom en ringa grundyta och under ett tak dubblerat upplagsutrymmet och lättat uppläggningen genom alt betydligt minska transportlängderna, med handkraft, i vågled, men i stället så mycket mera tillgodogöra kranarnas mekaniska kraft för transport i lod led.	169:182	0:347
uppläggning	nan	1895	2	bib15650814_18951126_146365_277_0004_alto.xml-35-9	 	Hushållerska, kunnig i finare och enklare matlagning, uppläggning m. m., söker plats.	54:65	0:85
uppläggning	nan	1895	2	bib19225758_18950508_144022_106_0004_alto.xml-58-2	 	passande för uppläggning af torra varor, önskas hyra.	13:24	0:53
uppläggning	nan	1812	1	bib19225772_18120626_148004_70_0002_alto.xml-5-45	 	betingande annorstädes, brist pä fadane arbetare ställen ej bör förmodas, och tillgäng till nödig Sand eller Barlast icke eller kan saknas, när tidig reqvisition deraf göres hos Hamnmästaren, fom, pä satt förut är förordnadt, har under dej } inseende uppläggningen af sjöledes inkommande Barlast, och frän upplagsplatsen i Mastbugget aflemnar hwad behoswet kräfwer: ^ warda ftmtelige Hus- och Tomtägare, Hwilke hafwa bristfälligt Gator, härmed paminte och föreständigade, att ofördröjegen nu i Höst, sä länge ärstiden medgifwer, wid 2 Rld.	251:264	0:539
uppläggning	nan	1824	1	bib19277277_18240315_147682_62_0006_alto.xml-7-21	 	, Nära Skeppsbron pä nedra betten är den i.sta nästkommande April att hyra ett större rum, pajande till torra warors uppläggning, eiler att inreda ti.l Handels-Kontor,, amr ett mindre rum med eller utau möbter.	117:128	0:210
uppläggning	nan	1803	1	bib19225772_18030126_148004_12_0004_alto.xml-0-18	 	Till nästa Pöst en star eldfri Kallare af de basta, kienlig bade för wäta ock torra warvrS uppläggning; närmare underrältelie lemnäs Cbr.	91:102	0:137
uppläggning	nan	1808	1	bib19225792_18081022_147359_43_0006_alto.xml-1-2	 	torra warors uppläggning, ett godt Stall för 2:ne hastar med tillräcklig Höwind deröfwer samt commod gäng frän stallet till höwinden, 2:ne stora och «äl försedda Spannemälswindar med 2 uppgångar aro nu genast lediga att sä hyras; adretz fä pä Tryck.	13:24	0:249
uppläggning	nan	1820	1	bib19225792_18200401_147359_12_0004_alto.xml-5-7	 	Utan dertill erhäklet tillständ, begagnas till uppläggning af Bäkar, Timmer, Ankaren, m. m. föranlätes Magistraten, wid vike af 1 N:d. zr fi.	47:58	0:141
uppläggning	nan	1895	2	bib19277330_18950528_0_62_0004_alto.xml-82-11	 	önskar för att få vistas på landet, arbete med handelsböckers uppläggning och afslutning, samt reda trassliga och felförda.	62:73	0:123
uppläggning	nan	1810	1	bib19225792_18100407_147359_14_0005_alto.xml-2-10	 	genast ästundas få hyra ett större Magasin för torra warors uppläggning; swar afwakras uti förseglad billet till B. soln inlenmas pä Tryckeriet.	60:71	0:144
uppläggning	nan	1830	1	bib19277277_18300315_147682_61_0002_alto.xml-7-60	 	, Teende reparationer erfordra » större och mindre partier af alla sorter Bräöer, Plank, Läktcr, Ribbor, Sparrar och Bjeikar af furu, diverse Spiksorter och Öfrige effekter af Smiden till bygdnadcr, priser sör ätstillige dimensioner af Fönster och Dörrar, priser pa Plåttak » anstrykning mcd tinolieferiiisia per qwadrataln, Arbetslön för Jer » plätars uppläggning d tak pr stepp., priser ä mindre Gatsten sami Gatgrus per last, priser pa Oljemålning, dels per qwadrataln, delstycketals, äfwen Tapeccrs Målning nied oljefärg, a-wcn wr Limfärg per qwadrataln, få äga hugade lcfwerantörcr att alla Söknedagar ifrån kl. 10 till 1 xå dagen, intill denne inånads stut, uti Kongl.	353:364	0:674
uppläggning	nan	1895	2	bib19277349_18950808_147403_101_0004_alto.xml-19-30	 	man till svar: » Ryssby har nu linien upptagen. » Skall telefonen blifva till någon verklig nytta för oss Ljungbybor måste telegrafverket gå i författning om ny linies uppläggning åtminstone mellan Ljungby och Vislanda, men för öfrigt vore det ej ur vägen att linien sträcktes ända fram till Vexiö.	168:179	0:298
uppläggning	nan	1895	2	bib15873371_18950923_145112_259_0004_alto.xml-55-4	 	Mindre varupartier emottagas till uppläggning å såväl nederlag som frimagasin.	34:45	0:78
uppläggning	nan	1816	1	bib13506739_18160817_144030_190_0007_alto.xml-16-42	 	Ett Magasin med stort utrymme och godt läge, samt i man deras tjenligt böde till upplä§aning och stdsäljninq af Waror, en s. ygg Kammare derinnanföre, med egen iiigäng, samt en torr och rymlig Källare, s.rur begagnad till uppläggning os Bräntiwin, är att hyr« wid Skeppsbron.	222:233	0:275
uppläggning	nan	1809	1	bib13506739_18090517_144030_112_0010_alto.xml-14-29	 	ÄstundaS att hyra nu genast en rymlig liaekbod, eller ock lius Kallare eller Wind, belägen i Staden eller nära derintill pä Söder, tjenlig till torra Warors uppläggning.	157:168	0:169
uppläggning	nan	1804	1	bib19225772_18040425_148004_47_0002_alto.xml-14-8	 	5:0 Uppdragning utur wattnet wid Wästra Hamnen och uppläggning pa amvista	51:62	0:73
uppläggning	nan	1810	1	bib19225772_18100828_148004_97_0004_alto.xml-2-48	 	Ert rymligt Stall för 2 hästar med Fcderlada dredewid, somt tillräcklig Höwind derösiver med npvgLug frän stallet, lemle en Wagndod, kan i nästa månads flut moc vora bekommas i Florensta huset N:o 22 wid Lillegaieböruet, hiva.ivid erindras, arr söwinden kan genast kill foders uppläggning disponeras af dea som hörer Skaller och Wagnboden.	277:288	0:339
uppläggning	nan	1895	2	bib15873371_18950916_145112_252_0004_alto.xml-85-4	 	Mindre varupartier emottagas till uppläggning å såväl nederlag som frimagasin.	34:45	0:78
uppläggning	nan	1804	1	bib19225772_18041218_148004_147_0003_alto.xml-4-9	 	samma ställe ä^o nagra Loft lediga att uthpraS till uppläggning af Spanneinä!, torra roaror, Möbler eller On » geraS.	52:63	0:117
uppläggning	nan	1895	2	bib15975090_18950117_148377_7_0001_alto.xml-55-13	 	meddelar undervisning i Tyska och Engelska språken, verkställer öfversättningar samt ombesörjer räkenskapers uppläggning ocb afslutning.	109:120	0:136
uppläggning	nan	1821	1	bib13506739_18210510_144030_108_0009_alto.xml-5-9	 	En torr och rymlig Kallare, pajande tlll Win uppläggning saint belägen uti Staden eller wid Söder » malm » Torg, åstunta » art hyra.	45:56	0:132
uppläggning	nan	1898	2	bib11653811_18981014_145317_158_0002_alto.xml-29-0	 	uppläggning 1892 utsvält till ett sådant omfång, att under vissa bokstäfver namnen upptaga ej mindre än 60 helsidor.	0:11	0:116
uppläggning	nan	1895	2	bib19277277_18951126_147683_323_0007_alto.xml-59-2	 	passande för uppläggning och tappning af viner, önskas hyra.	13:24	0:60
uppläggning	nan	1825	1	bib19225792_18250423_147359_16_0006_alto.xml-0-22	 	1 * 1 Ett hwälft Magi!sill uti ett hils Ivid stora Hamnegatan nära Packhuset, tjenligt för nederlag af torra ivarors uppläggning, att genast tillträda; om hyran kan öfroerenskomnias med Cvmmercc-Rädet Broms.	117:128	0:207
uppläggning	nan	1803	1	bib19225772_18030701_148004_74_0004_alto.xml-0-33	 	Uti stenhuset midt emot Komedihuiet ärv till nästa Michelis lediga att fS hura aine Ungkarlsrum med eller utan Möbler, samt en stor hivalfd Källare, jemte en Wind, tjenlig sol Epanmäls uppläggning.	185:196	0:197
uppläggning	nan	1827	1	bib13506739_18270514_144030_111_0004_alto.xml-19-7	 	Ett mindre Magasi », påtande för uppläggning af Ncderlag?gvdS, ästundas hyra, helst pä löder nära Södermalms Torg; hwarom underrättelse lemnaS fi Kontoret t hörnet af Hornsgatan och Ragwalds trappa.	33:44	0:198
uppläggning	nan	1815	1	bib19225772_18150616_148004_68_0004_alto.xml-10-13	 	Ett större Zfwaujordilkr rört hwalfbt Magafin, vatzaude för handelslägenhet eller waror&lt; uppläggning, är genast att sa horas; widare beited fas i huset N:o 27 wid Drottninggatan.	92:103	0:181
uppläggning	nan	1895	2	bib19277277_18950128_147683_27_0010_alto.xml-95-2	 	omfattande såväl uppläggning sora nfslutning af liandelsböckor, åtager sig dertill skicklig person.	17:28	0:99
uppläggning	nan	1895	2	bib19227462_18951125_147640_275_0004_alto.xml-209-9	 	* Omfattande direkt och från transitopuplag tullbehandlade varor jemte uppläggningar på nederlag, men ej förtullningar derifrån.	71:84	0:128
uppläggning	nan	1826	1	bib19225772_18260823_148004_97_0004_alto.xml-6-11	 	Ett mindre, torrt hwälfdt Magasin, pajande för torra warors uppläggning, eller i brist deraf till Handelsbod, är nu genast ledigt att mot billig hyra fa tillträda uti HusetN:v2?	60:71	0:177
uppläggning	nan	1898	2	bib11653811_18980216_145317_26_0004_alto.xml-84-6	 	att med vederbörande träffa aftal om uppläggning af den fyllning, som kan fås vid upprensning af sundet, och dervid anvisa plats der detta upplag får ske.	37:48	0:154
uppläggning	nan	1900	2	bib11653811_19000418_145317_58_0003_alto.xml-133-14	 	Redaktionen torde godhetsfullt intaga följande i tidningen: Tackande för Observatörs upplysningar rörande trävarors uppläggning å barlastholmens kajer, kan man ju icke annat än lyckönska träexportörerna att staden afgiftsfritt till dem upplåter sina kajer, ty herrar vedgårdsegare har ju då den stora fördelen att icke alls behöfva begagna egna planer, enär staden lemnar fria sådana.	116:127	0:384
uppläggning	nan	1824	1	bib19277277_18240312_147682_60_0006_alto.xml-11-27	 	Nära Skeppsbro » pä nedra botten är de » irsta nästkommande April att hyra ett större ruin, pafiande till torra w- » & gt; pors uppläggning, eller att inreda till Handels-Kontor, samt ett mindre rum med eller utan möbler.	128:139	0:221
uppläggning	nan	1806	1	bib19225772_18061022_148004_118_0003_alto.xml-5-44	 	offentlig enterprenad - auktion alk uppläras lill de minstbjudande werkställandet af de » a Marstrands Stads Kyrka steende reparation, hwilken, jemlikt i nador faststäld detzein ock rirnivg, kommer att innefatta fa ival yttre takers och bwalstvcts nedraguing, jamt koppartäckuingens ater uppläggning pä lägre takresning, fom ock nott liwalfs anläggande af bräder, gvlfweks fyllning och a, lemning, gräster.smnrens genombrytning till dörr- och fönster öppningar, lamt takens förändring vä bäda wapendufen m. m., jom kan inhemtas af ber pä Herr Wahlströms Boktryckeri inlemnade förstag.	288:299	0:584
uppläggning	nan	1895	2	bib15873371_18950902_145112_238_0004_alto.xml-73-4	 	Mindre varupartier emottagas till uppläggning å såväl nederlag som frimagasin.	34:45	0:78
uppläggning	nan	1895	2	bib15650814_18950930_146365_228_0002_alto.xml-69-8	 	/ stadsdelen V lister skola i höst vid uppläggning af nya kyrkoböcker och vid mantalsskrifningarna gatunamnen införas i stället för lflgenhetsnamnen.	39:50	0:149
uppläggning	nan	1895	2	bib15873371_18950311_145112_69_0004_alto.xml-98-4	 	Mindre varupartier emottagas till uppläggning ä såväl nederlag som frimagasin.	34:45	0:78
uppläggning	nan	1895	2	bib19277277_18950608_147683_153_0005_alto.xml-66-10	 	verksamhet skulle inskränkas till underhåll, ut- och afrustning samt uppläggning af den sjökrigsmateriel, som tillhördo Slockholmsstationen eller som komma att erhålla sin 6tän diga förläggningsort här, i och för försvaret af hufvudstaden och dess skärgård, samt till tillverkning af minor och annan materiel så väl för det fasta som för det rörliga minför svaret.	69:80	0:364
uppläggning	nan	1810	1	bib19225772_18100620_148004_68_0002_alto.xml-5-87	 	* * Som genom nedrasntngen förlcdne gärdås af sä tvål Quaymuren och en del af Wästra Hamnega an framför Winhandlaren Borgens hus, som ock ena armen as Stadens derintill belägna Brygga, all fart öfwer samma Brygga tills widare och intin dest reparation hara hunnit werkstallas, kommer att upphöra; sä warder sädant till Allmänhetens kunstap lemnadt, med sörestrift, att de som hofwa nödigt färdas till Lilla Torget och widare ät stora Bommen, icke fä, under Quay- och Brygg » nurarncs uppläggning, betjena sig af nämnde Brygga, utan bör wägen tågås genom någon af de Söder om lilla Torget belägna gator litt Magasinsgatan.	484:495	0:621
uppläggning	nan	1805	1	bib19225792_18050824_147359_34_0006_alto.xml-6-33	 	wil försedda Rum med utsikt 2t älswen, samt Kök och nödiga Uthus m. m., ekt Salteri hwarest ka » saltas cirka 300 tunnor Sill, Winden deräfwanpä tjenlig lör uppläggning af torra och lätta waror, 2:ne Saltbodar, hwaraf ben ena rymmer cirka 220 och den andra 340 tunnor Salt.	157:168	0:273
uppläggning	nan	1895	2	bib15650814_18951203_146365_283_0004_alto.xml-83-14	 	skicklig i allt hvad till ett större kök hörer såväl i finare matlagning som uppläggning m. m, önskar att hos familjer tillaga middagar, supeer efter nutidens fordringar, och torde ärade fruar godhetsfullt ihågkomma henne.	77:88	0:222
uppläggning	nan	1818	1	bib13506739_18180305_144030_53_0006_alto.xml-4-17	 	Som den sednast ifrån Götheborg af Herr Lorents tiliwerkning hitkomne Poeter, numera ester skedd utpackning ccb uppläggning uti warmr Rum, uponatt sin wanliga godhet, sa fortsärtcs försäljningen deras uti Huset N:o 2 wid Slottsbacken, Qwcirt.	112:123	0:242
uppläggning	nan	1812	1	bib19225792_18121024_147359_43_0005_alto.xml-5-5	 	sid östra Hamnegatan För Kohls uppläggning är en större Lod att fä & gt; yras; adretz fas pä Tryckeriet.	31:42	0:104
uppläggning	nan	1817	1	bib13506739_18170903_144030_203_0013_alto.xml-1-32	 	Uti sa kalladi Räntinäliarhuset 61ifrctr till instundande fattning art hyra ett Wagnshus, ©tc-f för t Hastar med.sodctifulle, samt z öfwer brrcwar.dra warande Wi ' dar till Wacors eller Spannmåls uppläggning.	196:207	0:208
uppläggning	nan	1895	2	bib19225758_18950520_144022_116_0004_alto.xml-82-8	 	Restaurantvan hushållerska, skicklig i finare matlagning och uppläggningar, söker plats genom Göteborgs l * latsbyr &, Magasinsgatan 13.	61:74	0:136
uppläggning	nan	1821	1	bib13506739_18210620_144030_141_0012_alto.xml-9-16	 	ät garden cn tr. uppjdtroen en torr och nätt Packbod t lörstugan, till torra Warors uppläggning.	84:95	0:96
uppläggning	nan	1895	2	bib15650835_18950215_146472_13_0001_alto.xml-9-69	 	alf dä snö faller i sadan mängd, att allmänna rörelsen ä gator och torg förswäras eller förhindras, den öswerflödiga snön stall undanstottas och bortföras; att det mä wara husegare tillätet att intill sin fastighet flotta en del öfwerflödig snö, derwid dock bör iakttagas, att den sälunda uppstöttade snön packas och lägges till lika höjd och bredd utefter hela fastigheten; att ä trottoairer dylik uppläggning af snö ej mä förekomma utan stola desamma jemte gatorna i öfrigt städse hällas i det stick att snöbetäckningen bildar en jemn yta utan större gropar; att det äligger husegare att, dä polismyndigheten sä nödigt pröfwar, befria tak och rännor frän snö och is; wid werkställighet häraf bör noga tillses att färch derigenom ej uppkommer för förbigäende och att ingen eller sä ringa olägenhet som möjligt derigenom tillskyndas den trafikerande allmänheten; att der snö inne ä gärd stulle ligga i sädan myckenhet, att den kan wara till hinder för eldsiäckningsarbete, sädan snö, der polismyndigheten vröiwar det nödigt, sä snart som möjligt bortstaffas, samt att wederbörande hafwa att ställa sig till efterrättelse hwad polismyndigheten till fullgörande af dessa bestämmelser mä kunna förestrifwa.	399:410	0:1203
uppläggning	nan	1895	2	bib19227462_18951205_147640_284_0003_alto.xml-159-11	 	förses med mira ett hundratal illustrationer för nppskärning, dukning, uppläggning, dekorering m. m.	71:82	0:100
uppläggning	nan	1898	2	bib11653790_18980520_145648_38_0002_alto.xml-33-15	 	af helsovårdsnämden väckta och af stadsfullmäktige beslutade förslaget angående antagande af stadgar om förbud mot uppläggning af orenlighet å området vid och omkring blifvande pumpverket för stadens vattenledning har af K.	115:126	0:223
uppläggning	nan	1817	1	bib19225792_18170412_147359_15_0010_alto.xml-0-42	 	Stensättares betingande annorstädes, brist pä sadane arbetare stallgen ej bör förmodas och tillgäng till nödig sand eller btirtast icke lärer fela, när tidig reqvisition däraf göres hos Hamnmästaren, som pä sätt förut är förordnadt, har under desi inseende uppläggningen af sjöledes inkommande B » rlast och ' frän upplagsplatsen i Masthugget afl^mnar hwad behofwet kräfwer; men derest Hamnmästaren ei skulle hafwa till » gang pä Barlast, ' Hus- och Tomtägares skyldighet da är, att genast pä annat sätt sig densammaförssaffc; Warda samtelige Hus- och Tomtägare, hlvilke hafwa brisif.illige Gator, härmed paminte och förskändigade, att ofördrö^eiigen nu i W^r, wid z R ' d^ & gt; 6 st. Specie Banko vite, besörja om de sammas istanosättande, äswensom för nästa är och widare framgent, den föreskrift kommer att wid enahanda wite riena wederböranoe till efterrättelse, som Policekammaren, efter föranstaltad besigtning a Gatorne hwerje ar, finner nödigt, att i detta häiisecnde meddela.	257:270	0:985
uppläggning	nan	1895	2	bib19225758_18950816_144022_189_0004_alto.xml-171-15	 	eller torrt magasin önskas hyra nu genast i närheten af Fredsgatan, att användas for uppläggning af manufakturvaror.	85:96	0:116
uppläggning	nan	1895	2	bib15873371_18950225_145112_55_0004_alto.xml-18-4	 	Mindre varupartier emottagas till uppläggning å såväl nederlag sorn frimagasin.	34:45	0:79
uppläggning	nan	1807	1	bib19225772_18070821_148004_94_0004_alto.xml-0-21	 	En Wind öfwer en källare söder i staden o » nära stora hamnen, tjenlig till Kalk eller andra torra warors uppläggning, är mor billigaste bora geuast ledig; abretz fZS pä Tryckeriet.	106:117	0:181
uppläggning	nan	1895	2	bib19227462_18950921_147640_220_0006_alto.xml-28-29	 	Ull, ofärgad och färgad » 11,900 — Väfnader, alla slag & gt; 958,300 + 390,800 929,000 S00 218,500 Omfattande direkt och från transitonpplag tullbehandlade varor jemte uppläggningar på nelluingar derifrån.	168:181	0:205
uppläggning	nan	1895	2	bib15873371_18950617_145112_162_0004_alto.xml-66-4	 	Mindre varupartier emottagas till uppläggning å såväl nederlag sorn frimagasin.	34:45	0:79
uppläggning	nan	1903	2	bib11653790_19030414_12541_28_0002_alto.xml-112-13	 	Vidare bör flottningen 1 regel afslutas tidigare på hösten äu hittills, hvarförutom uppläggning af virke vintertid å laxens lekplatser bör så vidt möjligt undvikas, särskildt beträffande obarkadt virke.	84:95	0:202
uppläggning	nan	1895	2	bib15873371_18950527_145112_142_0004_alto.xml-133-4	 	Mindre varupartier emottagas till uppläggning å såväl nederlag som frimagasin.	34:45	0:78
uppläggning	nan	1811	1	bib19225792_18110803_147359_31_0005_alto.xml-5-7	 	: Pä Rödasten finnas flera lagenheter till uppläggning af Salt och andra waror, lediga att uthyras, hwarom D. Carnegie och Komp.	43:54	0:128
uppläggning	nan	1819	1	bib19225772_18190512_148004_53_0004_alto.xml-2-6	 	De äro ock mpcker rjenlige till uppläggning och torkning af	32:43	0:59
uppläggning	nan	1895	2	bib15650835_18950212_146472_12_0004_alto.xml-172-5	 	deras revidering och afslutning samt uppläggning af nya höcker, kunna mot billigt arfvode erhålla biträde af undertecknad, sorn med tacksamhet mottager arbete.	37:48	0:159
uppläggning	nan	1895	2	bib19277330_18950601_0_64_0004_alto.xml-73-22	 	En person, som någon tid af sommaren är ledig, önskar för att få vistas på landet, arbete med handeisböckers uppläggning oell afslutuing, samt reda trassliga oell felförda.	109:120	0:172
uppläggning	nan	1898	2	bib11653811_18980314_145317_41_0001_alto.xml-8-44	 	behagade sammanträda onsdagen den 16 mars 1898 klockan 5 e.m. för behandling af följande ärenden: l:o) Hamndirektionens skrifvelse i ärendet angående ifrågasatt utvidgning och reglering af Kalmar hamn; 2:o) Från senaste sammanträdet hvilande ärendet angående Hamndirektionens skrifvelse rörande plats för uppläggning af mudder och fyllningsämnen; 3:o) Drätselkammarens skrifvelse rörande än dring i byggnadsritningarne för det till den beslutade vattenledningen hörande vattentornet; 4:o) Drätselkammarens anhållan om lönebidrag till vikarien för Drätselkammarens kamrerare; 5:o) Drätselkammarens utlåtande öfver Styrelsens för Kalmar — Torsås jernvägsaktiebolag framställning örn aflemnande afmotförbindelse såsom säkerhet för stadens borgen för ett bolagets lån; 6:o) Drätselkammarens yttrande öfver Arrendatorn Frans Anderssons ansökan att å arrendelotten mo 24 få uppföra tvenne boningshus; 7:o) Fattigvårdsstyrelsens hemställan om bemyndigande för Drätselkammaren att i nya fattigvårdsinrättningen å Falkenberg få inlägga tidsenlig ångtvätt- och torkinrättning; 8:o) Fattigvårdsstyrelsens förslag till ledig plats för en frielev vid Fröbergska ITppfostringsanstalten; 9:o) Gasverksstyrelsens berättelse örn förvaltningen af stadens gasverk under år 1897; 10:o) Vederbörande revisorers berättelse öfver verkstäld granskning af Grandinska välgörenhetsfondens räkenskaper och förvaltning för år 1897; lim) Handlanden lino Peterssons ansökan att få arrendera en plan vid Elevatorskajen till upplagsplats; 12:o) Johanna Andersson Sjögrens och Gustafva Lindströms hvar för sig gjorda ansökan att få inköpa nordöstra hälften af tomten mo 45 på Engö; 13:o) Åkaren E.	305:316	0:1663
uppläggning	nan	1830	1	bib19225772_18300427_148004_46_0003_alto.xml-3-8	 	för flem det åstunda äger rättighet bestyra örn uppläggning och aflefyerering.	48:59	0:78
uppläggning	nan	1825	1	bib19277277_18250430_147682_98_0004_alto.xml-41-11	 	Nära SlnAen Sr för billigt pris, l.Vaenhenhet för torra warorS uppläggning att un genast hyra.	63:74	0:94
uppläggning	nan	1900	2	bib11653811_19000414_145317_57_0003_alto.xml-135-32	 	Jag vill med anledning häraf bedja få upplysa » ordningsvän » om en sak, nemligen den att träkajen, såväl som öfriga kajer i vår goda stad, är till för uppläggning af varor, in- som utgående.	152:163	0:191
uppläggning	nan	1895	2	bib19225758_18950627_144022_146_0002_alto.xml-344-26	 	Betänkandet innehåller bland annat en öfversikt af den utländska lagstiftningen i ämnet och statistiska tabeller öfver Sveriges direkta sjöfarts- och handelsförbindelser med andra land, öfver uppläggning å nederlag, fyr- cch båkafgifter samt lastpänningarna, utarbetade af amanuensen å kommerskollegiets statistiska afdelning fil.	192:203	0:330
uppläggning	nan	1895	2	bib15975087_18951207_145596_190_0002_alto.xml-114-12	 	I öfrigt förekommer inemot ett hundratal illustrationer för nppfkärning, dukning, uppläggning dekorering m. m.	82:93	0:110
uppläggning	nan	1895	2	bib15873371_18951007_145112_273_0004_alto.xml-9-4	 	Mindre varupartier emottagas till uppläggning å såväl nederlag som frimagasin.	34:45	0:78
uppläggning	nan	1803	1	bib19225792_18030430_147359_17_0004_alto.xml-0-16	 	ne sala och inge andre köpare tillstädes öro, göra tiis » aok uppköp deras till uppläggning och ajsaiu.	80:91	0:103
uppläggning	nan	1895	2	bib15873936_18951219_147385_149_0003_alto.xml-176-12	 	I öfrigt förekommer inemot ett hundratal illustrationer för uppskärning, dukning, uppläggning, dekorering m. m.	82:93	0:111
uppläggning	nan	1896	2	bib15873936_18960901_147385_101_0004_alto.xml-74-14	 	1,5 meter eller så omkring, beroende på tillgång på band och hela stukans uppläggning.	74:85	0:86
uppläggning	nan	1895	2	bib15978012_18950121_148361_17_0002_alto.xml-26-12	 	för hans besvär med uppsättande af förslag till de nya stadgarne och uppläggning af föreningens räkenskapsböcker.	69:80	0:113
