lemma	pos	date	grouping	identifier	description	context	indexes_target_token	indexes_target_sentence
uppläggning	nan	1895	2	bib19225758_18951218_144022_295_0004_alto.xml-56-4	 	kunnig i matlagning och uppläggning, önskar atl gå bort i familjer att biträda Vid bjudningar.^Adr.	24:35	0:99
uppläggning	nan	1828	1	bib19225772_18280530_148004_61_0005_alto.xml-17-11	 	Ett torrt hwälft Magasin ät gatan, patzande för torra warors uppläggning, är nu genast att mot billig hyra fä tillträda uti Huset N:o 27 ivid Drottninggatan.	61:72	0:157
uppläggning	nan	1897	2	bib11653811_18970201_145317_17_0004_alto.xml-2-16	 	Äfvenså är det lotspligtigt, då det, kommande från utländsk ort, anlöper plats för uppläggning eller, örn det innehar last, för inhemtande af order likasom ock, då det är barlastadt, från sista afgångsorten.	83:94	0:207
uppläggning	nan	1809	1	bib19225792_18090715_147359_28_0005_alto.xml-3-9	 	& gt; En stor och rymlig Bod till uppläggning af koret ' a waror, säsoin Tobak, Socker m. m., nära Norra famnen belägen, ax nu genast att fä hyras: adrctz äs pa L yckeriec.	34:45	0:172
uppläggning	nan	1895	2	bib15873371_18950621_145112_166_0001_alto.xml-31-17	 	Hvarje föremål, son lemnäs till förvaring i Parasiticidas enkom derför inredda rymliga magasiner, undergår före uppläggningen fullständig desinfeelion och rengöring, hvarigenom den möjligheten, att sjukdomsfrön kunna öfverföras från ett föremål till ett annat, absolut förekom-	112:125	0:277
uppläggning	nan	1895	2	bib15873371_18950413_145112_101_0004_alto.xml-60-4	 	Mindre varupartier emottagas till uppläggning ä såväl nederlag som frimagasin.	34:45	0:78
uppläggning	nan	1807	1	bib19225792_18071017_147359_42_0005_alto.xml-0-18	 	' Söder 4 Staden kan nu genast fä hyras ett osma » jord eldfrrtt Hwalf för torra warors uppläggning; v:n hyran kan öswerenskommas med And.	88:99	0:138
uppläggning	nan	1895	2	bib15873371_18950121_145112_20_0004_alto.xml-37-4	 	Mindre varupartier emottagas till uppläggning å såväl nederlag som frimagasin.	34:45	0:78
uppläggning	nan	1895	2	bib19227291_18950608_145289_68_0002_alto.xml-94-11	 	skulle örlogsvarfvets verksamhet inskränkas till underhåll, ut- och afrustningj samt uppläggning af deu sjökrigsmateriel, sorn tor närvarande tillhörde Stockholms-stationen eller som framdeles komme att erhålla sin ständiga förlägguingsort härstädes, i och för försvaret af hufvudstaden och Stockholms skärgård, samt till tillverkning af minor och annan materiel så väl för det fasta som för det rörliga mia försvaret.	85:96	0:418
uppläggning	nan	1810	1	bib19225792_18101027_147359_43_0005_alto.xml-3-2	 	Till Kobls uppläggning är en Binge ledig att fä hyra, hwilken rymmer omkring 2050 tunnor; adrest fäs pä Tryckeriet.	11:22	0:115
uppläggning	nan	1809	1	bib13506739_18090519_144030_114_0011_alto.xml-4-30	 	Ästundas alt hyra nu genast en rymlig Packbod, eller ock ljus Kallare eller Wind, belägen i Staden eller nä a derintill pä Söder, tienlig till torra Warors uppläggning.	156:167	0:168
uppläggning	nan	1807	1	bib19225772_18070429_148004_47_0001_alto.xml-3-62	 	Och pä det, hwad gatornas stensättande widkommer, ingen mä undstylla sig derin med, att han dertill ej kunnat fä nödig sand eller ballast, helst as den som sjöledes m med stepp och fartyg inkommer; sä äligger det hwar och en, som tvet sig ballast - ä behöswa, att hos Hamnmästaren, under hwars inseende ballastens uppläggning ställd ö ar, i lid sig anmäla och reqvirera den ballast som behöfwes, hwilken dä af honom isrän Ballastplaksen i Masthugget aflemnas, enligt hwad Magistraten deni förordnar.	314:325	0:499
uppläggning	nan	1895	2	bib15760690_18951209_145050_190_0002_alto.xml-52-12	 	I öfrigt förekommer inemot ett hundratal illustrationer för uppflärning, dukning, uppläggning, dekorering m. m. Äcbetet utlofwas fullständigt i ungefär 12 häften i flutet af januari eller början af februari 1896.	82:93	0:212
uppläggning	nan	1805	1	bib13506739_18051022_144030_244_0007_alto.xml-3-10	 	UebjudeS att hyra et » säker och tillsluten Plats till uppläggning af Bräder och allehanda Materlalicr, goda Källrar, tjenliga UppWningSrum för Sill, Salt, Ull m. m.	55:66	0:165
uppläggning	nan	1830	1	bib19225772_18300416_148004_42_0007_alto.xml-8-8	 	för dera det åstunda äger rättighet bestyra örn uppläggning och aSefverering.	48:59	0:77
uppläggning	nan	1826	1	bib19225772_18260705_148004_76_0003_alto.xml-13-92	 	^ - Uti Commerce-Rädet PetterHmis Hus, wij&gt; stora södra Hamngatan, bliswa instundande Michaeli följande lägenbeter till uthyrning ledige: trenne hwälfda Magasiner och en större bwalso Källare ät gata », ett Rum ät gärden, tjenligt till Contor, med utgäng äfwen till ett af Magasinerue, ett Magassn uppe i gärden, med 3 fönsterlufter och jerngaller, för 300 tunnor Spannn&gt; als uppläggning, samt ert mindre Magasin pä nedra botten, Stallrum för i a JJW\" Howlnd, Alla Magasinerne äro för partiwarors uppläggning / äfwensom för Minuthandel.	503:514	0:542
uppläggning	nan	1826	1	bib19225772_18260630_148004_74_0005_alto.xml-6-30	 	Pä Färgenäs uthyras till billigt pris Bodar, tjenlige för » vrlag af Salt, Sill, Tjära m. m., EpannmalSwindar, äfwen en instängd plats till uppläggning af Plankor; närmare kan öfwerenskoinmas med A.	140:151	0:198
uppläggning	nan	1895	2	bib19227462_18950528_147640_122_0003_alto.xml-193-6	 	Ångfartyget Njord, som efter sin uppläggning under vintern undergått diverse smärre reparationer vid södra varfvet, bar efter undergången prof- och besigtningsresa samt kompassjustering angjort vid sin gamla tilläggningsplats vid Skeppsbrokajen och har från och med i lördags på morgonen börjat intaga last samt kommer att deu i juni göra sin första resa för året till Haparanda med anlöpande af en del mellanstationer i nedre och öfre Norrland.	33:44	0:445
uppläggning	nan	1895	2	bib19225758_18950420_144022_91_0004_alto.xml-93-8	 	Hushällerska som är skicklig i finare matlagning och uppläggningar, och som har betyg frän finare Restanranter, söker plats till Badort eller Hotell.	53:66	0:149
uppläggning	nan	1895	2	bib19227462_18950107_147640_5_0003_alto.xml-86-22	 	varor; i dock att varor, sorn äro upplagda underl tullväsendets kontroll och som inom loppet af j 30 dagar efter uppläggningen sjövägen åter utföras till utlandet, vare sig direkt eller äf-	113:126	0:189
uppläggning	nan	1895	2	bib19225758_18950610_144022_132_0004_alto.xml-120-12	 	van att förestå större hushåll samt vara kunnig i finare matlagning, uppläggning och syltning.	69:80	0:94
uppläggning	nan	1903	2	bib11653811_19030313_145317_41_0002_alto.xml-59-18	 	Kommer ej snö eller åtminstone så mycket käle i marken, att man kan begagna drögar för virkets uppläggning vid farbara väger, måste säkerligen stora partier lämnas kvar i skogen öfver sommaren, ty får denna blida väderlek fortfara, kommer vårbruket i år en hel månad tidigare än vanligt.	95:106	0:287
uppläggning	nan	1895	2	bib15873371_18950909_145112_245_0004_alto.xml-74-4	 	Mindre varupartier emottagas till uppläggning å såväl nederlag som frimagasin.	34:45	0:78
uppläggning	nan	1895	2	bib19277349_18950813_147403_103_0004_alto.xml-107-0	 	uppläggning iakttages, att bandets ändar böjas tillräckligt för att bilda hatt och kunna ligga kvar, att de läggas tätt intill hvarandra samt att axändarna läggas åt den sida, hvarifrån vinden företrädesvis kommer.	0:11	0:214
uppläggning	nan	1895	2	bib15873371_18951021_145112_287_0004_alto.xml-72-4	 	Mindre varupartier emottagas till uppläggning å såväl nederlag som frimagasin.	34:45	0:78
uppläggning	nan	1895	2	bib15650835_18951022_146472_89_0004_alto.xml-21-12	 	att fatta beflut: l:o) I anledning af kyrkorädets hemställan om uppläggning af nytt tak ä prestgärden och densammas päbyggnad; 2:o) Rörande Folkstolläraren E.	64:75	0:158
uppläggning	nan	1816	1	bib13506739_18160828_144030_199_0006_alto.xml-14-5	 	ivra till torra tätta Warors uppläggning (& gt; j rägec Fanager) uti Huset N.o 14 wid sioia Nygatan, nära Kornhamns Torget, dä derom ttlljäges en trappu Upp å ftunö a g Hy r a: ÄstuntaS att fyra antingen pä & gt; ^änai) eller qwartel ett iloit och wrckert Rum, bc äxet inne i Sta: den och tle^.llgt till begagnande tte ett mindre Musikailfft Sallst^p Ä » ve - n Tambur eller ert mindre Rum ttllua erdälles, w?re tet sä mycket bättre.	29:40	0:433
uppläggning	nan	1826	1	bib19225792_18260527_147359_20_0007_alto.xml-6-2	 	Magasiner till uppläggning af Salt finnas att hyra p » Rödasten; hyran uppgifweS pä A.	15:26	0:86
uppläggning	nan	1902	2	bib11653811_19021011_145317_156_0003_alto.xml-143-16	 	Därpå tänkte monsieur Dututel, medan han gick uppför trapporna, på att fursten nyligen klandrat uppläggningen af en kallrätt, han tänkte också på en soppa som varit för salt och en rådjursstek, som han sjelf tyckte varit något seg, och slutligen tänkte han också på att öfverstelöjtnant L ’ Estrange rynkat pannan så märkvärdigt, då han senast gick igenom räkningarne för köksdepartementet.	96:109	0:390
uppläggning	nan	1813	1	bib19225772_18131005_148004_114_0008_alto.xml-7-21	 	James Dickson ästnudar fä byra ett Fartyg eller nägra Bodar wid Rerieret, sä belägna att fartyg kunna flyta iniill for uppläggning af Salt.	119:130	0:139
uppläggning	nan	1806	1	bib19225772_18060912_148004_102_0003_alto.xml-6-30	 	Stads Korka steende reparation, hwilken, lemllkr i näber faststäld destei » och ritning, kommer att innefatta sa wäl yttre takets och hwalfwets nedtagning, jamt koppartäckningens Ster uppläggning pä lägre takresning, som ock nott ywalfs anläggande af bräder, golfmers fpllviug och afjemning, grästensmurens genombrytning kill dörr- och fönster öppningar, samt taken » förändring på bida wapenbuse » m. m., jom ka » inhemta » af det pä Herr Wahlströms Boktryckeri inlemnade förilag.	184:195	0:481
uppläggning	nan	1818	1	bib13506739_18180319_144030_65_0006_alto.xml-21-17	 	Som den sednast isrän Götheborg af Herr Lorents tillmerkning hitkomne Porter, numera efter ssedd utväckning och uppläggning uti warmr Rum, uvonätt fin manliga godbet, fä forlsättes försäljningen deraf uti Hirfct N:o 2 wid Slottsbacken, Qwart.	112:123	0:242
uppläggning	nan	1896	2	bib11653790_18960124_145648_4_0001_alto.xml-55-4	 	minstbjudande upplåtes framkörning och uppläggning af 19,000 kub.-fot is.	39:50	0:73
uppläggning	nan	1819	1	bib13506739_18190127_144030_21_0007_alto.xml-0-6	 	Wind, pahande till torra Sakcrs uppläggning, del i Bagarstuga med inmurad Panna, samt Brunn midt emot rå gatan, belägne nara Hötorget, Äro att hyra.	32:43	0:148
uppläggning	nan	1830	1	bib19225772_18300319_148004_32_0003_alto.xml-12-8	 	för dem det åstunda äger rättighet bestyra om uppläggning och aflefverering.	46:57	0:76
uppläggning	nan	1895	2	bib15650835_18950219_146472_14_0004_alto.xml-145-5	 	deras revidering och afslutning samt uppläggning af nya böcker, kunna mot billigt arfvode erhålla biträde af undertecknad, sorn meck tacksamhet mottager arbete.	37:48	0:160
uppläggning	nan	1830	1	bib13506739_18300331_144030_74_0003_alto.xml-6-31	 	ock&gt; öfrige effeccer af Smidcn till Bvggncrder, priser för Htskillige dimensioner af Fönster och Dörrar, priser pa Plättaks anstrykning med liiioijefrrni^a, per Qwadrataln, arbetslön för Jernplätars uppläggning a tak per Skeppund, priser a mindre Gatsten samt Gatgnis per läst, priser pa Oijemälning dels per Äwadrataln, dels » rrcketals, äfwen Tapeters målning med Oljefärg, äfwen för Limfärg per Qwadratalnsä äga hugade lefwerantörer att alla Söcknedagar ifrån klockan io till i, intill denna mänadS sint, uti Kongl.	202:213	0:521
uppläggning	nan	1812	1	bib19225792_18120627_147359_26_0002_alto.xml-3-53	 	— Och dä genom lemnade friheten till Stensättares betingande annorstädes. » brist pä sadane arbetare ffäligen ej bör förmodas, och tillgäng till nödig Sand eller Barlast icke eller kan saknas, när tidig requisition deraf göres hos Hamnmastaren, som, pä sätt förut är forordnadt, har under desi inseende uppläggningen af sjöledes inkomMande Barlast, och frän upplagsplatsen i Masthugget cflemnar hwad bebofwet kr&lt; ifn&gt; » r: warda sumteliAe Hns- och Tvmtagare, hwilke hafwa bristfalli-	303:316	0:489
uppläggning	nan	1806	1	bib19225772_18060709_148004_74_0003_alto.xml-18-31	 	Till nästa Michelis utbjudes att hyra uti harwarande Frimurare-Barnhuset 2snygga Ungkarlsrum, samt uti desi Lvgcbyggnad al stora Hamnegatan 2 stora hwalfda Källare, rjenlige till bade wäta och torra warors uppläggning; närmare deffed meddelas af Konsul Carlsio ».	206:217	0:263
uppläggning	nan	1830	1	bib11653828_18300316_144028_62_0002_alto.xml-8-22	 	Kockarna ha varit trötta och sömniga af middagsbråket, och dessutom vårdslösa genom sjelfva materiaternas magerhet, hvarföre de äfven slarlvat vid uppläggningen.	147:160	0:161
uppläggning	nan	1895	2	bib15873371_18950708_145112_182_0004_alto.xml-73-0	 	Uppläggning och uttagning ombesörjes efter anmodan, Göteborgs Magasins-Aktiebolag, Magasinsqvarteret N:o 4.	0:11	0:107
uppläggning	nan	1816	1	bib13506739_18160815_144030_188_0007_alto.xml-18-44	 	^ Ett Ma.afin med stort utrymme och godt lage, samt i man deras tjenligt bade tifll uppläggning v » fiifitlintnp, of Waror, en snygg Kammare derinnanföre, med egen ingång, samt en torr och rymlig Källarr, förut begagnad till uppläggning as Brä„nwin, är att hyra reid Skeppsbron.	225:236	0:278
uppläggning	nan	1826	1	bib19225772_18260712_148004_79_0003_alto.xml-4-66	 	Uti Commerce.-Rädet Petterstons Hils, ivid stora södra Hamngatan, blifwa instundande Michaeli följande lägenheter till uthyrning ledige: trenne hwälfda Magasiner och en större hwälfd Källare ät gatan, ett Rum är gärden, t, enligt till Contor, med urgäng äfwen lill ett af Magasinerne, ett Maqasti, uppe l gärden, med 3 fönsterlufter och jerngaller, for 300 tunnor Spannmäls uppläggning, samt ert mindre Magasin pä nedra botten, Stallrum för 1 a 1 hästar nied Höwind.	374:385	0:466
uppläggning	nan	1895	2	bib15873371_18950326_145112_83_0004_alto.xml-90-4	 	Mindre varupartier emottagas till uppläggning å såväl nederlag som frimagasin.	34:45	0:78
uppläggning	nan	1895	2	bib19225758_18950515_144022_112_0001_alto.xml-26-17	 	Hvarje föremål, som lemnäs till förvaring i Parasiticidas enkom derför inredda rymliga magasiner, undergår före uppläggningen fullständig desinfektion och rengöring, hvarigenom den möjligheten att sjukdomsfrön kunna öfverf öras från ett föremål till ett annat, a b so Snäf förekommes.	112:125	0:284
uppläggning	nan	1807	1	bib13506739_18070715_144030_160_0010_alto.xml-9-24	 	Pa Ladugjrdsland » Kyrkogärd, är ett rymligt Wagnkhus att byra, och nästa flyttning att tillträda; det är pahande äiwen till warors uppläggning, eller hwad behof som hälst.	132:143	0:172
uppläggning	nan	1895	2	bib19227462_18950622_147640_143_0010_alto.xml-112-14	 	» sej » 91,000 — 438 * Omfattande direkt och från tullbehandlade varor jemte uppläggningar på åeriag, men ej fortullningar derifrån.	77:90	0:132
uppläggning	nan	1895	2	bib15873371_18950204_145112_34_0004_alto.xml-9-5	 	Mindre varupartier emottaga » till uppläggning å såväl nederlag sorn frimagasin.	35:46	0:80
uppläggning	nan	1895	2	bib19277277_18950610_147683_155_0007_alto.xml-16-15	 	fullt van att förestå större hnshåll samt vara kun * nig 1 finare matlagning, uppläggning och syltning.	78:89	0:103
uppläggning	nan	1817	1	bib13506739_18170514_144030_110_0005_alto.xml-5-32	 	Till salu stnnes ett Magasinshus med Källare derunder, beläget i Staden nära Skeppsbron, utom det att laget & gt;: r i onlcende till WindarneS indelning inrättadt för Spanmals uppläggning, är det patzan » de för Viltualiehandel eller dylikt.	176:187	0:241
uppläggning	nan	1817	1	bib13506739_18170517_144030_112_0005_alto.xml-4-29	 	SlUl salu finnes ett Magassnsiius med Kallare dcrnnder, beläget i Staden nara Skeppsbron, utom det art läget 5r i » seende till Wii.dsrnes indelning inrättabt för Spa^.mälS uppläggning, är dct patzande för Viktuakiehandel eller dylikt.	173:184	0:235
uppläggning	nan	1821	1	bib19225792_18210317_147359_10_0008_alto.xml-0-10	 	Den som pa Entreprenad will åtaga sig en större Stenqunys uppläggning pa Majwiken, behagar anmäla sig pa Herr James Dicksons kontor.	58:69	0:132
uppläggning	nan	1895	2	bib19277277_18950914_147683_250_0007_alto.xml-6-113	 	destinationsorten ställda resgodset, hvarom här är fråga, förvaras i särskild vagn eller af tullkam maren i Malmö för ändamålet godkänd vagnsafdel ' ning, hvari nämnda tullkammare meddelar behörig plombering samt med angifvande af icke blott vagnens eller vagnsafdelningens märke och nummer, utan Ufven deraf, att innehållet utgöres af icke undersökt resgods meddelar förpassning i två exemplar, af hvilka det ena skall åtfölja godset och det andra med först afgående post försändas till vederbörande tuliförvaltning i bestämmelseorten m. m.; dels äfven att fraktgods, utgörande hel vagnslast och af beskaffenhet, att hinder jemlikt § 1 mom. 3 i gällande tullstadga icke möter för dess uppläggning å transitupplag, hvilket med ångfärja anian der från Köpenhamn till Malmö för att utan örn lastning genom omedelbar transitoförsändning befordras vidare med jernväg till ort i Norge, der tullkammare finnes och förtullning får ega rum, må å ångfärjans märkrulla upptagas såsom ett kolli ooh jemväl såsom ett kolli angifvas i vanlig ordning hos tullkammaren i Malmö och af nämnda tullkammare förpassas till destinationsorten, under vilkor att i on och umira vagn icke må förvaras gods, som skall pä ifrå: nvnrande sätt försändas till m«r fin en mottnfU * i destinationsorten, för så vidt godset icke är euiualleradt, m. m.; äfvensom att, för den händelse K.	686:697	0:1353
uppläggning	nan	1895	2	bib15873371_18951028_145112_294_0004_alto.xml-61-4	 	Mindre varupartier emottagas till uppläggning å såväl nederlag som frimagasin.	34:45	0:78
uppläggning	nan	1895	2	bib15873371_18951202_145112_329_0004_alto.xml-8-4	 	Mindre varupartier emottagas till uppläggning å såväl nederlag som frimagasin.	34:45	0:78
uppläggning	nan	1805	1	bib13506739_18050930_144030_226_0007_alto.xml-19-2	 	Rum till uppläggning af allehanda Waror, äro att byra.	9:20	0:54
uppläggning	nan	1807	1	bib19225792_18070620_147359_25_0007_alto.xml-3-18	 	Uti huset N:o l8 Ivid Drottninggatan ar ledigt att uthyras ett stort eldfritt Hwalf, tjcnligt sä till uppläggning af torra som wäta waror.	102:113	0:138
